[
    {
        "title": "كتاب سيبويه «Le livre de Sîboûyéh»",
        "author": "Aboû Bischr Amr ibn 'Othman ibn Kanbar",
        "author_date_hijri": "180",
        "author_date_CE": "796",
        "title_of_original_text_commented_upon": "",
        "author_of_original_text_commented_upon": "",
        "date_of_author_of_original_text_commented_upon_hijri": "",
        "date_of_author_of_original_text_commented_upon_CE": "",
        "date_of_original_text_commented_upon_hijri": "",
        "date_of_original_text_commented_upon_CE": "",
        "date_of_copying_hijri": "629",
        "date_of_copying_CE": "1231",
        "date_of_printing_hijri": "",
        "date_of_printing_CE": "",
        "place_of_printing": "",
        "incipit": "",
        "explicit": "ثم كتاب سيبويه ...... وذلك يوم الاربعاء السابع والعشرين من ذى قعبة عام",
        "material": "Papier",
        "script": "Magrébine",
        "number_of_folios": 271,
        "layaout_or_lines_per_page": 27,
        "text": "كتاب سيبويه «Le livre de Sîboûyéh» ou, comme prononcent les Arabes, «de Sîbawaihi».\nCet important traité de grammaire arabe, composé par un Persan des environs de Schîrâz, remonte au deuxième siècle de l'Hégire, l'auteur Aboû Bischr Amr ibn 'Othman ibn Kanbar, surnommé Sîbawaihi, étant mort vers 180 de l'Hégire (796 ap. J.-Ch.). L'exemplaire de l'Escurial se trouve décrit, ainsi que les exemplaires de Paris et de St. Pétersbourg, dans l'introduction qui précède le premier volume de mon édition (Paris, 1881, gr. in-8, p. XXI-XXXIV).\nC'est là qu'on trouvera aussi le texte d'une grande note qui occupe les feuillets 3 v° et 4 r°.\nLe texte commence, sans préface, au feuillet 4 v°. A la fin du manuscrit, qui n'a pas de titre, on lit (fol. 271 v°): ثم كتاب سيبويه ...... وذلك يوم الاربعاء السابع والعشرين من ذى قعبة عام. Cette copie, de 629 de l'Hégire (1231 ap. J.-Ch.), est vocalisée avec le plus grand soin; elle a été collationnée sur un exemplaire, qui faisait autorité en Espagne, comme il ressort de la note suivante, placée à la marge du feuillet 271 v°: قابلت كتابي هذا باسل الاصول اصل الاندلسي الذي بخط العالم العلم الاستاذ ابى نصر هرون بن موسى المقرو على الامام النحوى ابى عبد الله الرياحي فما وجد فى كتاب هذا من طرّة فن الكتاب المذكور نقلت ....... وذلك في اخريات ذي قعدة عام ٦٢٩ وكتب حسن بن احمد بن يبقى.\nL'exemplaire de Haroun ibn Moûsâ était divisé en deux volumes (سفر); ثar au fol. 135 r°, qui ne contient que quatre lignes du textes، on lit ensuite كمل السفر الأول والحمد لله وحده. C'est a ce même endroit, avant le chapitre intitulé هذا باب ما ينصرف وما لا ينصرف que s'arratent aussi le manuscrit 161 de la Bibliothèque Impériale de St. Pétersbourg et le premier volume de mon édition.\nOn trouvera plus loin, sous le numéro 310 (Casiri 308) un commentaire sur les vers cités dans le «Livre de Siboûyéh».\nPapier. Écriture Magrébine. 271 feuillets. 27 lignes par page."
    },
    {
        "title": "Volume d'un commentaire sur المقدمة الجزولية Introduction à la grammaire» par Abou Moûsà 'Îsa ibn 'Abd al-Aziz Al-Djouzoûlî",
        "author": "Schaloûbînî",
        "author_date_hijri": "VII",
        "author_date_CE": "",
        "title_of_original_text_commented_upon": "المقدمة الجزولية Introduction à la grammaire»",
        "author_of_original_text_commented_upon": "Al-Djouzoûlî",
        "date_of_author_of_original_text_commented_upon_hijri": "",
        "date_of_author_of_original_text_commented_upon_CE": "",
        "date_of_original_text_commented_upon_hijri": "",
        "date_of_original_text_commented_upon_CE": "",
        "date_of_copying_hijri": "VIII",
        "date_of_copying_CE": "",
        "date_of_printing_hijri": "",
        "date_of_printing_CE": "",
        "place_of_printing": "",
        "incipit": "باب هذا هو باب لا النافية ولا بد من مقدمة بين يدى الباب وحينئذ نفسر الفاظه فنقول لا تخلو لا من ان تدخل على اسم معرفة او على نكرة",
        "explicit": "",
        "material": "Papier",
        "script": "Magrébine",
        "number_of_folios": 142,
        "layaout_or_lines_per_page": 25,
        "text": "Volume d'un commentaire sur المقدمة الجزولية Introduction à la grammaire» par Abou Moûsà 'Îsa ibn 'Abd al-Aziz Al-Djouzoûlî. C'est sans doute une partie du commentaire, composé au septième siècle de l'Hégire par Schaloûbînî et connu sous le nom de الامالى «Les dictées» (Hadji Khalifa VI, p. 80). Une comparaison avec les manuscrits 36 et 190 de la collection me fait supposer que nous avons ici le septième volume d'un commentaire en dix volumes à peu près.\nCasiri a donné ce volume comme un commentaire sur le «Livre de Sîbouyéh», composé au IV siècle de l'Hégire par Kamal ed-Dîn Aboû Yahyâ l'Espagnol. Le manuscrit ne porte de titre ni au commencement ni à la fin; et le champ serait ouvert sans limite à toutes les hypothèses, si on ne lisait au fol. 6 rº après un long développement du commentateur: ولنرجع الى تفسير لفظ ابى موسى «Revenons à l'explication du texte d'Aboû Moûsâ».\nCommencement: باب هذا هو باب لا النافية ولا بد من مقدمة بين يدى الباب وحينئذ نفسر الفاظه فنقول لا تخلو لا من ان تدخل على اسم معرفة او على نكرة Le dernier chapitre commenté (fol. 136 v°) est consacré aux حروف التصديق والايجاب.\nPapier. Écriture Magrébine. 142 feuillets. 25 lignes par page. Sans date; manuscrit du VIIIº siècle de l'Hégire."
    },
    {
        "title": "Fin de la première partie et deuxième partie du Commentaire de Nadjm ed-Dîn Moḥammad ibn Ḥosain Al-Astarâbâdhî sur la Kafiya (الكافية) d'Ibn Al-Hadjib",
        "author": "Nadjm ed-Dîn Moḥammad ibn Ḥosain Al-Astarâbâdhî",
        "author_date_hijri": "683",
        "author_date_CE": "1283",
        "title_of_original_text_commented_upon": "الكافية",
        "author_of_original_text_commented_upon": "Ibn Al-Hadjib",
        "date_of_author_of_original_text_commented_upon_hijri": "",
        "date_of_author_of_original_text_commented_upon_CE": "",
        "date_of_original_text_commented_upon_hijri": "",
        "date_of_original_text_commented_upon_CE": "",
        "date_of_copying_hijri": "869",
        "date_of_copying_CE": "1464",
        "date_of_printing_hijri": "1275",
        "date_of_printing_CE": "1858",
        "place_of_printing": "Constantinople",
        "incipit": "",
        "explicit": "هذا اخر شرح المقدمة ...... وقد. ثم تمامها وختم اختتامها في ...... سنة ٨٦٩ بمدينة القاهرة المحروسة",
        "material": "Papier",
        "script": "Orientale",
        "number_of_folios": 199,
        "layaout_or_lines_per_page": 27,
        "text": "Fin de la première partie et deuxième partie du Commentaire de Nadjm ed-Dîn Moḥammad ibn Ḥosain Al-Astarâbâdhî sur la Kafiya (الكافية) d'Ibn Al-Hadjib (cf. Hâdjî Khalifa V, p. 7).\nComme le précédent ce manuscrit a été pris par Casiri pour un commentaire sur le «Livre de Siboûyéh», bien que le nom du commentateur ne lui ait pas échappé. Il est indiqué au fol. 3 v°, où l'on lit: ثم الجزء الأول من شرح الكافية للشيخ ...... نجم الملة والدين رضى الاسلام والمسلمين محمد بن الحسين الاسترابافاذى. La tranche inférieure du manuscrit porte الثانى من الرضى. D'apres Hadji Khalifa, la composition de ce commentaire a été terminée en 683 de l'Hégire (1283 ap. J.-Ch.). Il a été imprimé à Constantinople en 1275 de l'Hégire (1858 ap. J.-Ch.).\nA la fin (fol. 199), on lit: هذا اخر شرح المقدمة ...... وقد. ثم تمامها وختم اختتامها في ...... سنة ٨٦٩ بمدينة القاهرة المحروسة. C'est donc une copie faite au Caire en 869 de l'Hégire (1464 ap. J.-Ch.).\nLes manuscrits 18 et 91 contiennent deux autres exemplaires de ce même commentaire.\nPapier. Écriture Orientale. 199 feuillets. 27 lignes par page. Il ne reste plus que trois feuillets de la première moitié."
    },
    {
        "title": "Second volume du Commentaire d'Al-Mouradi (المرادي) sur le célèbre poème grammatical d'Ibn Mâlik",
        "author": "Al-Mouradi",
        "author_date_hijri": "749",
        "author_date_CE": "1348",
        "title_of_original_text_commented_upon": "الالفية",
        "author_of_original_text_commented_upon": "Ibn Mâlik",
        "date_of_author_of_original_text_commented_upon_hijri": "",
        "date_of_author_of_original_text_commented_upon_CE": "",
        "date_of_original_text_commented_upon_hijri": "",
        "date_of_original_text_commented_upon_CE": "",
        "date_of_copying_hijri": "801",
        "date_of_copying_CE": "1398",
        "date_of_printing_hijri": "",
        "date_of_printing_CE": "",
        "place_of_printing": "",
        "incipit": "باب الترخيم",
        "explicit": "",
        "material": "Papier",
        "script": "Magrébine",
        "number_of_folios": 111,
        "layaout_or_lines_per_page": 25,
        "text": "Second volume du Commentaire d'Al-Mouradi (المرادي) sur le célèbre poème grammatical d'Ibn Mâlik, poème que ses mille vers ont fait nommer الالفية . L'auteur est nommé à la tranche inférieure, qui porte الثاني من شرح المرادى et dans la suscription (fol. 111 r°), où on lit : عام ٨٠١ ..... كل شرح الفية ابن مالك للمرادى. Le nom complet d'Al Mouradî est Schams ed-Din Hasan ibn Al-Kasim Al-Mourâdî, surnommé Ibn Oumm Ķâsim; il mourut en 749 de l'Hégire (1348 ap. J.-Ch.). Son commentaire sur l'Alfiyya est signalé par Ḥâdjî Khalifa I, p. 408. L'exemplaire com\" : باب الترخيم mence par le (cf. l'édition que Dieterici a donnée de l'Alfiyya avec le commentaire d'Ibn 'Akil, p. ٢٧٣).\nPapier. Écriture Magrébine. 111 feuillets. 25 lignes par page. Manuscrit daté de l'an 801 de l'Hégire (1398 ap. J.-Ch.)."
    },
    {
        "title": "Supercommentaire sur le commentaire d'Al-Mourâdî sur l'Alfiyya d'Ibn Mâlik",
        "author": "Ahmad ibn Abi 'l-Kasim Al-Karoûmî",
        "author_date_hijri": "",
        "author_date_CE": "",
        "title_of_original_text_commented_upon": "Alfiyya d'Ibn Mâlik",
        "author_of_original_text_commented_upon": "Al-Mourâdî",
        "date_of_author_of_original_text_commented_upon_hijri": "",
        "date_of_author_of_original_text_commented_upon_CE": "",
        "date_of_original_text_commented_upon_hijri": "",
        "date_of_original_text_commented_upon_CE": "",
        "date_of_copying_hijri": "998",
        "date_of_copying_CE": "1589",
        "date_of_printing_hijri": "",
        "date_of_printing_CE": "",
        "place_of_printing": "",
        "incipit": "الحمد لله الذي تفرد فى ذاته وصفاته وافعاله الخ",
        "explicit": "",
        "material": "Papier",
        "script": "Magrébine",
        "number_of_folios": 319,
        "layaout_or_lines_per_page": 39,
        "text": "Supercommentaire sur le commentaire d'Al-Mourâdî sur l'Alfiyya d'Ibn Mâlik (cf. ms. 4). Le titre et le nom de l'auteur sont donnés à la fin (fol. 319 r°) dans la note suivante : كل جميع الكتاب المسمى بالهادى الى مقاصد المرادي ...... انتسيخ من نسخة مؤلّفه ...... احمد بن ابى القاسم القرومى لخزانة مولانا السلطان ...... الامام المنصور بالله امير المؤمنين بن الخلفاء الراشدين ...... وكان الفراغ منه فى ۹۹۸ .... «Guide vers les opinions, qu'a voulu exprimer Al-Mouradi», tel est le titre; l'auteur est Ahmad ibn Abi 'l-Kasim Al-Karoûmî; la copie a été faite en 998 de l'Hégire (1589 ap. J.-Ch.) d'après l'exemplaire autographe, que l'auteur avait écrit pour le sultan du Maroc Aboû 'l-'Abbâs, surnommé Al-Mansoûr Billah. Commencement الحمد لله الذي تفرد فى ذاته وصفاته وافعاله الخ.\nPapier. Écriture Magrébine. 319 feuillets. 39 lignes par page. Manuscrit d'une exécution admirable et d'une égalité d'écriture parfaite."
    },
    {
        "title": "Traité des cent régents grammaticaux (العوامل المائة)",
        "author": "Abd al-Kahir Al-Djordjant",
        "author_date_hijri": "",
        "author_date_CE": "",
        "title_of_original_text_commented_upon": "",
        "author_of_original_text_commented_upon": "",
        "date_of_author_of_original_text_commented_upon_hijri": "",
        "date_of_author_of_original_text_commented_upon_CE": "",
        "date_of_original_text_commented_upon_hijri": "",
        "date_of_original_text_commented_upon_CE": "",
        "date_of_copying_hijri": "",
        "date_of_copying_CE": "",
        "date_of_printing_hijri": "",
        "date_of_printing_CE": "",
        "place_of_printing": "",
        "incipit": "",
        "explicit": "",
        "material": "Papier",
        "script": "Magrébine",
        "number_of_folios": 177,
        "layaout_or_lines_per_page": "",
        "text": "Traité des cent régents grammaticaux (العوامل المائة), par Abd al-Kahir Al-Djordjant. Ils ont été publiés entre autres par Erpenius (Leidæ, 1617), par Baillie (Five Books on Arabic grammar, Calcutta, 1802) et par Lockett (Calcutta, 1814), par celui-ci avec une traduction anglaise.\nCopie faite par un chrétien du Maroc.\n2° (Fol. 7 v°). Commentaire abrégé d'Al-Makondî sur l'Alfiyya d'Ibn Mâlik. En tête, le manuscrit porte en lettres d'or: ابو زيد عبد الرحمن بن على بن صالح المكودى ...... قال الشيخ الاستاذ رضى الله عنه ; puis à l'encre noire اما بعد ...... الحمد لله رب العلمين شرح مختصر على الفية ابن ملك الخ. A la fin (fol. 170 vº), la composition de ce commentaire dans la rédaction abrégée (Ḥâdjî Khalifa I, p. 409), que contient le manuscrit, est fixée à l'année 799 de l'Hégire (1396 ap. J.-Ch.): وكان الفراغ من تأليفه والخلاص من تدوينه وتصنيفه بعد عصر يوم الجمعة ثامن وعشرين من رجب الفرد المبارك سنه ٧٩٩. La copie doit être peu postérieure elle doit avoir été exécutée du vivant de l'auteur, et pour son usage. Ce commentaire a été imprimé avec des gloses au Caire en 1279 de l'Hégire (1862 ap. J.-Ch.). Le manuscrit 32 contient un autre ouvrage d'Al-Makoûdî.\n3° (Fol. 171 v°). Traité des flexions, intitle: مراح الارواح «Le repos des esprits», par Ahmad ibn Ali ibn Masoad (Hadji Khalifa, n° 11758). La fin manque. Cet opuscule a été imprimé bien des fois; voir Zenker, Bibliotheca Orientalis I, n° 138 et suiv.; II, 131 et suiv. Commencement : اعلم ان الصرف ام العلوم والنحو ابوها الخ.\nPapier. Écriture Magrébine. 177 feuillets. Aux feuillets 7 à 170, 25 lignes par page."
    },
    {
        "title": "Commentaire abrégé d'Al-Makondî sur l'Alfiyya d'Ibn Mâlik",
        "author": "Al-Makondî",
        "author_date_hijri": "799",
        "author_date_CE": "1396",
        "title_of_original_text_commented_upon": "Alfiyya d'Ibn Mâlik",
        "author_of_original_text_commented_upon": "Ibn Mâlik",
        "date_of_author_of_original_text_commented_upon_hijri": "",
        "date_of_author_of_original_text_commented_upon_CE": "",
        "date_of_original_text_commented_upon_hijri": "",
        "date_of_original_text_commented_upon_CE": "",
        "date_of_copying_hijri": "",
        "date_of_copying_CE": "",
        "date_of_printing_hijri": "1279",
        "date_of_printing_CE": "1862",
        "place_of_printing": "Caire",
        "incipit": "ابو زيد عبد الرحمن بن على بن صالح المكودى ...... قال الشيخ الاستاذ رضى الله عنه ; ثم اما بعد ...... الحمد لله رب العلمين شرح مختصر على الفية ابن ملك الخ",
        "explicit": "وكان الفراغ من تأليفه والخلاص من تدوينه وتصنيفه بعد عصر يوم الجمعة ثامن وعشرين من رجب الفرد المبارك سنه ٧٩٩",
        "material": "Papier",
        "script": "Magrébine",
        "number_of_folios": 177,
        "layaout_or_lines_per_page": 25,
        "text": "Traité des cent régents grammaticaux (العوامل المائة), par Abd al-Kahir Al-Djordjant. Ils ont été publiés entre autres par Erpenius (Leidæ, 1617), par Baillie (Five Books on Arabic grammar, Calcutta, 1802) et par Lockett (Calcutta, 1814), par celui-ci avec une traduction anglaise.\nCopie faite par un chrétien du Maroc.\n2° (Fol. 7 v°). Commentaire abrégé d'Al-Makondî sur l'Alfiyya d'Ibn Mâlik. En tête, le manuscrit porte en lettres d'or: ابو زيد عبد الرحمن بن على بن صالح المكودى ...... قال الشيخ الاستاذ رضى الله عنه ; puis à l'encre noire اما بعد ...... الحمد لله رب العلمين شرح مختصر على الفية ابن ملك الخ. A la fin (fol. 170 vº), la composition de ce commentaire dans la rédaction abrégée (Ḥâdjî Khalifa I, p. 409), que contient le manuscrit, est fixée à l'année 799 de l'Hégire (1396 ap. J.-Ch.): وكان الفراغ من تأليفه والخلاص من تدوينه وتصنيفه بعد عصر يوم الجمعة ثامن وعشرين من رجب الفرد المبارك سنه ٧٩٩. La copie doit être peu postérieure elle doit avoir été exécutée du vivant de l'auteur, et pour son usage. Ce commentaire a été imprimé avec des gloses au Caire en 1279 de l'Hégire (1862 ap. J.-Ch.). Le manuscrit 32 contient un autre ouvrage d'Al-Makoûdî.\n3° (Fol. 171 v°). Traité des flexions, intitle: مراح الارواح «Le repos des esprits», par Ahmad ibn Ali ibn Masoad (Hadji Khalifa, n° 11758). La fin manque. Cet opuscule a été imprimé bien des fois; voir Zenker, Bibliotheca Orientalis I, n° 138 et suiv.; II, 131 et suiv. Commencement : اعلم ان الصرف ام العلوم والنحو ابوها الخ.\nPapier. Écriture Magrébine. 177 feuillets. Aux feuillets 7 à 170, 25 lignes par page."
    },
    {
        "title": "Traité des flexions (مراح الارواح «Le repos des esprits»)",
        "author": "Ahmad ibn Ali ibn Masoad",
        "author_date_hijri": "",
        "author_date_CE": "",
        "title_of_original_text_commented_upon": "",
        "author_of_original_text_commented_upon": "",
        "date_of_author_of_original_text_commented_upon_hijri": "",
        "date_of_author_of_original_text_commented_upon_CE": "",
        "date_of_original_text_commented_upon_hijri": "",
        "date_of_original_text_commented_upon_CE": "",
        "date_of_copying_hijri": "",
        "date_of_copying_CE": "",
        "date_of_printing_hijri": "",
        "date_of_printing_CE": "",
        "place_of_printing": "",
        "incipit": "اعلم ان الصرف ام العلوم والنحو ابوها الخ",
        "explicit": "",
        "material": "Papier",
        "script": "Magrébine",
        "number_of_folios": 177,
        "layaout_or_lines_per_page": "",
        "text": "Traité des cent régents grammaticaux (العوامل المائة), par Abd al-Kahir Al-Djordjant. Ils ont été publiés entre autres par Erpenius (Leidæ, 1617), par Baillie (Five Books on Arabic grammar, Calcutta, 1802) et par Lockett (Calcutta, 1814), par celui-ci avec une traduction anglaise.\nCopie faite par un chrétien du Maroc.\n2° (Fol. 7 v°). Commentaire abrégé d'Al-Makondî sur l'Alfiyya d'Ibn Mâlik. En tête, le manuscrit porte en lettres d'or: ابو زيد عبد الرحمن بن على بن صالح المكودى ...... قال الشيخ الاستاذ رضى الله عنه ; puis à l'encre noire اما بعد ...... الحمد لله رب العلمين شرح مختصر على الفية ابن ملك الخ. A la fin (fol. 170 vº), la composition de ce commentaire dans la rédaction abrégée (Ḥâdjî Khalifa I, p. 409), que contient le manuscrit, est fixée à l'année 799 de l'Hégire (1396 ap. J.-Ch.): وكان الفراغ من تأليفه والخلاص من تدوينه وتصنيفه بعد عصر يوم الجمعة ثامن وعشرين من رجب الفرد المبارك سنه ٧٩٩. La copie doit être peu postérieure elle doit avoir été exécutée du vivant de l'auteur, et pour son usage. Ce commentaire a été imprimé avec des gloses au Caire en 1279 de l'Hégire (1862 ap. J.-Ch.). Le manuscrit 32 contient un autre ouvrage d'Al-Makoûdî.\n3° (Fol. 171 v°). Traité des flexions, intitle: مراح الارواح «Le repos des esprits», par Ahmad ibn Ali ibn Masoad (Hadji Khalifa, n° 11758). La fin manque. Cet opuscule a été imprimé bien des fois; voir Zenker, Bibliotheca Orientalis I, n° 138 et suiv.; II, 131 et suiv. Commencement : اعلم ان الصرف ام العلوم والنحو ابوها الخ.\nPapier. Écriture Magrébine. 177 feuillets. Aux feuillets 7 à 170, 25 lignes par page."
    },
    {
        "title": "Commentaire abrégé d'Al-Makoûdî sur l'Alfiyya d'Ibn Mâlik",
        "author": "Al-Makoûdî",
        "author_date_hijri": "",
        "author_date_CE": "",
        "title_of_original_text_commented_upon": "Alfiyya d'Ibn Mâlik",
        "author_of_original_text_commented_upon": "Ibn Mâlik",
        "date_of_author_of_original_text_commented_upon_hijri": "",
        "date_of_author_of_original_text_commented_upon_CE": "",
        "date_of_original_text_commented_upon_hijri": "",
        "date_of_original_text_commented_upon_CE": "",
        "date_of_copying_hijri": "984",
        "date_of_copying_CE": "1576",
        "date_of_printing_hijri": "",
        "date_of_printing_CE": "",
        "place_of_printing": "",
        "incipit": "",
        "explicit": "",
        "material": "Papier",
        "script": "Magrébine",
        "number_of_folios": 208,
        "layaout_or_lines_per_page": 27,
        "text": "1° Autre exemplaire du Commentaire abrégé d'Al-Makoûdî sur l'Alfiyya d'Ibn Mâlik (voir le manuscrit 6, 2º).\n2° (Fol. 133). Commentaire d'Ibn Hischâm sur l'Alfiyya, intitule : اوضح المسالك الى الفية بن ملك ( Le plus clair des chemins vers l'Alfiyya d'Ibn Mâlik.» L'auteur de ce commentaire est nommé à la première ligne Aboû Mohammad 'Abd Allâh Djamâl ed-Dîn ibn Yousouf Ibn Hischâm AlAnşârî; cet Ibn Hischâm mourut en 762 de l'Hégire (1360 ap. J.-Ch.); cf. Hadji Khalifa I, p. 413. Ce commentaire paraît avoir été imprimé à Calcutta en 1832, si l'on rectifie, pour ce qui concerne l'auteur, la note de Zenker, Bibliotheca Orientalis, II, n° 119. La date du manuscrit n'est pas claire; elle paraît être 984 de l'Hégire (1576 ap. J.-Ch.), et s'applique aux deux ouvrages, écrits d'une même main, qui sont contenus dans le manuscrit. Commencement: الحمد لله رب العلمين اما بعد حمد الله مستحق الحمد وملهمه الخ.\nPapier. Écriture Magrébine. 208 feuillets. 27 lignes par page."
    },
    {
        "title": "Commentaire d'Ibn Hischâm sur l'Alfiyya",
        "author": "Ibn Hischâm",
        "author_date_hijri": "762",
        "author_date_CE": "1360",
        "title_of_original_text_commented_upon": "Alfiyya d'Ibn Mâlik",
        "author_of_original_text_commented_upon": "Ibn Mâlik",
        "date_of_author_of_original_text_commented_upon_hijri": "",
        "date_of_author_of_original_text_commented_upon_CE": "",
        "date_of_original_text_commented_upon_hijri": "",
        "date_of_original_text_commented_upon_CE": "",
        "date_of_copying_hijri": "984",
        "date_of_copying_CE": "1576",
        "date_of_printing_hijri": "",
        "date_of_printing_CE": "1832",
        "place_of_printing": "Calcutta",
        "incipit": "الحمد لله رب العلمين اما بعد حمد الله مستحق الحمد وملهمه الخ",
        "explicit": "",
        "material": "Papier",
        "script": "Magrébine",
        "number_of_folios": 208,
        "layaout_or_lines_per_page": 27,
        "text": "1° Autre exemplaire du Commentaire abrégé d'Al-Makoûdî sur l'Alfiyya d'Ibn Mâlik (voir le manuscrit 6, 2º).\n2° (Fol. 133). Commentaire d'Ibn Hischâm sur l'Alfiyya, intitule : اوضح المسالك الى الفية بن ملك ( Le plus clair des chemins vers l'Alfiyya d'Ibn Mâlik.» L'auteur de ce commentaire est nommé à la première ligne Aboû Mohammad 'Abd Allâh Djamâl ed-Dîn ibn Yousouf Ibn Hischâm AlAnşârî; cet Ibn Hischâm mourut en 762 de l'Hégire (1360 ap. J.-Ch.); cf. Hadji Khalifa I, p. 413. Ce commentaire paraît avoir été imprimé à Calcutta en 1832, si l'on rectifie, pour ce qui concerne l'auteur, la note de Zenker, Bibliotheca Orientalis, II, n° 119. La date du manuscrit n'est pas claire; elle paraît être 984 de l'Hégire (1576 ap. J.-Ch.), et s'applique aux deux ouvrages, écrits d'une même main, qui sont contenus dans le manuscrit. Commencement: الحمد لله رب العلمين اما بعد حمد الله مستحق الحمد وملهمه الخ.\nPapier. Écriture Magrébine. 208 feuillets. 27 lignes par page."
    },
    {
        "title": "Commentaire de Schams ed-Din Mohammad Al-Fâriḍî sur l'Alfiyya d'Ibn Mâlik",
        "author": "Schams ed-Din Mohammad Al-Fâriḍî",
        "author_date_hijri": "",
        "author_date_CE": "",
        "title_of_original_text_commented_upon": "Alfiyya",
        "author_of_original_text_commented_upon": "Ibn Mâlik",
        "date_of_author_of_original_text_commented_upon_hijri": "",
        "date_of_author_of_original_text_commented_upon_CE": "",
        "date_of_original_text_commented_upon_hijri": "",
        "date_of_original_text_commented_upon_CE": "",
        "date_of_copying_hijri": "987",
        "date_of_copying_CE": "1579",
        "date_of_printing_hijri": "",
        "date_of_printing_CE": "",
        "place_of_printing": "",
        "incipit": "(الحمد لله) المجيب الندا، الأول بلا ابتدا، (اما بعد) فهذا ما فتح الله تعالى به شرحا او كالشرح على الالفية الخ",
        "explicit": "",
        "material": "Papier",
        "script": "Orientale",
        "number_of_folios": 371,
        "layaout_or_lines_per_page": 29,
        "text": "Commentaire de Schams ed-Din Mohammad Al-Fâriḍî sur l'Alfiyya d'Ibn Mâlik. Ainsi est nommé l'auteur de ce commentaire en tête de son ouvrage, et à la tranche inférieure, : qui porte شرح الفية ابن مالك للفارضي Il ne m'a été possible de recueillir aucune donnée ni sur lui, ni sur les autres ouvrages qu'il peut avoir composés. Copie datée de 987 de : l'Hégire (1579 ap. J.-Ch.. Commencement: (الحمد لله) المجيب الندا، الأول بلا ابتدا، (اما بعد) فهذا ما فتح الله تعالى به شرحا او كالشرح على الالفية الخ.\nPapier. Écriture Orientale. 371 feuillets. 29 lignes par page.\n"
    },
    {
        "title": "كتاب شرح الالفية في علم العربية",
        "author": "عبد العزيز ابن جمعة بن زيد النحوى الموصلى",
        "author_date_hijri": "",
        "author_date_CE": "",
        "title_of_original_text_commented_upon": "Alfiyya",
        "author_of_original_text_commented_upon": "يحيى بن معاذ بن عبد النور",
        "date_of_author_of_original_text_commented_upon_hijri": "",
        "date_of_author_of_original_text_commented_upon_CE": "",
        "date_of_original_text_commented_upon_hijri": "",
        "date_of_original_text_commented_upon_CE": "",
        "date_of_copying_hijri": "703",
        "date_of_copying_CE": "1303",
        "date_of_printing_hijri": "",
        "date_of_printing_CE": "",
        "place_of_printing": "",
        "incipit": "الحمد لله بارى النسم ومفيض النعم الخ",
        "explicit": "",
        "material": "Papier",
        "script": "Asiatique",
        "number_of_folios": 306,
        "layaout_or_lines_per_page": 25,
        "text": "Titre: كتاب شرح الالفية في علم العربية تاليف الشيخ ...... عبد العزيز ابن جمعة بن زيد النحوى الموصلى «Livre intitlé: Commentaire sur l'Alfiyya relative à la science de la langue arabe; cœuvre du schaikh...\n'Abd el-Azîz Ibn Djoum' a ibn Zaid, le grammairien de Maușoul.» Il ne s'agit pas ici de l'Alfiyya d'Ibn Mâlik, mais d'un poème analogue, et nommé de même, dont l'auteur est Yahyâ ibn Mou'ț ibn Abd en-Noûr (voir Ḥâdjî Khalîfa I, p. 414 et les manuscrits 22 et 23). La copie, datée de 703 de l'Hégire (1303 ap. J.-Ch.), doit être peu postérieure à la composition, puisque les manuscrits 89 et 90 contiennent un autre ouvrage du même auteur, terminé par lui en 694 de l'Hégire (1294 ap. J.-Ch.). Commencement: الحمد لله بارى النسم ومفيض النعم الخ.\nPapier. Écriture Asiatique. 306 feuillets. 25 lignes par page."
    },
    {
        "title": "Commentaire d'Ibn 'Akil sur l'Alfiyya d'Ibn Mâlik",
        "author": "Ibn 'Akil",
        "author_date_hijri": "",
        "author_date_CE": "",
        "title_of_original_text_commented_upon": "Alfiyya",
        "author_of_original_text_commented_upon": "Ibn Mâlik",
        "date_of_author_of_original_text_commented_upon_hijri": "",
        "date_of_author_of_original_text_commented_upon_CE": "",
        "date_of_original_text_commented_upon_hijri": "",
        "date_of_original_text_commented_upon_CE": "",
        "date_of_copying_hijri": "870",
        "date_of_copying_CE": "1465",
        "date_of_printing_hijri": "1252",
        "date_of_printing_CE": "1837",
        "place_of_printing": "Boûlâk",
        "incipit": "اذا اجتمع ضميران وكانا منصوبين",
        "explicit": "",
        "material": "Papier",
        "script": "Asiatique",
        "number_of_folios": 139,
        "layaout_or_lines_per_page": 25,
        "text": "Commentaire d'Ibn 'Akil sur l'Alfiyya d'Ibn Mâlik. Les onze premiers feuillets manquent, et l'exemplaire commence au haut de la page r. dans l'édition de Dieterici: اذا اجتمع ضميران وكانا منصوبين. En dehors de son édition (Lipsise 1851 in-4), M. Dieterici a publié une traduction allemande du commentaire d'Ibn 'Aķil (Berlin, 1852, in-8). Ce commentaire a été également publié à Lucknow, à Boûlâk, cette dernière édition en 1252 de l'Hégire (1837 ap. J.-Ch.), et aussi à Beiroût en 1872.\nCasiri attribue le commentaire contenu dans ce manuscrit à Moḥammad ibn 'Işâm ed-Dîn de Grenade. Sur quel fondement s'est-il appuyé? Je l'ignore. Au fol. 10 r°, on lit en tête du troisième cahier الثالث من ابن عقيل et ainsi de suite de dix en dix feuillets jusqu'à la fin. Le manuscrit est daté de 870 de l'Hégire (1465 ap. J.-Ch.).\nPapier. Écriture Asiatique. 139 feuillets. 25 lignes par page."
    },
    {
        "title": "Commentaire d'Asch-Schoumounnî sur l'Alfiyya d'Ibn Mâlik",
        "author": "Asch-Schoumounnî",
        "author_date_hijri": "872",
        "author_date_CE": "1467",
        "title_of_original_text_commented_upon": "Alfiyya",
        "author_of_original_text_commented_upon": "Ibn Mâlik",
        "date_of_author_of_original_text_commented_upon_hijri": "",
        "date_of_author_of_original_text_commented_upon_CE": "",
        "date_of_original_text_commented_upon_hijri": "",
        "date_of_original_text_commented_upon_CE": "",
        "date_of_copying_hijri": "",
        "date_of_copying_CE": "",
        "date_of_printing_hijri": "",
        "date_of_printing_CE": "",
        "place_of_printing": "",
        "incipit": "اما بعد حمد الله على ما منح من اسباب البيان الخ",
        "explicit": "",
        "material": "Papier",
        "script": "Orientale",
        "number_of_folios": 272,
        "layaout_or_lines_per_page": 27,
        "text": "Commentaire d'Asch-Schoumounnî, comme on doit écrire d'après Hadji Khalifa VII, p. 614, et non pas d'Al-Ouschmoûnî, comme l'auteur est nommé dans ce manuscrit, sur l'Alfiyya d'Ibn Mâlik.\nAu fol. 1 r° se trouve un titre ajouté après coup en écriture Magrébine: ...... الاشمونى شرح الفية ابن مالك. Le vrai titre est donné au fol. 1 v°, où l'auteur Takî ed-Dîn Ahmad ibn Mohammad Asch-Schoumounnî, qui mourut en 872 de l'Hégire (1467 ap. J.-Ch.), dit de son livre وقد لقبته بمنهج المسالك، الى الفية ابن مالك. A la tranche inférieure, on lit également: منهج المسالك للاشمونى. L'orthographe Al-Ouschmoânî provient d'une confusion entre l'auteur de notre commentaire et Nour ed-Dîn Ali ibn Mohammad Al-Ouschmoûnî, mort vers 900 de l'Hégire (1494 ap. J.-Ch.), qui composa aussi un commentaire sur l'Alfiyya d'Ibn Mâlik. Voir Hadji Khalifa, I, p. 411.\nCommencement de notre commentaire: اما بعد حمد الله على ما منح من اسباب البيان الخ.\nPapier. Écriture Asiatique. 272 feuillets. 27 lignes par page. Sans date.\n"
    },
    {
        "title": "Commentaire d'Al-Mouradi sur l'Alfiyya d'Ibn Mâlik",
        "author": "Al-Mouradi",
        "author_date_hijri": "802",
        "author_date_CE": "1399",
        "title_of_original_text_commented_upon": "Alfiyya",
        "author_of_original_text_commented_upon": "Ibn Mâlik",
        "date_of_author_of_original_text_commented_upon_hijri": "",
        "date_of_author_of_original_text_commented_upon_CE": "",
        "date_of_original_text_commented_upon_hijri": "",
        "date_of_original_text_commented_upon_CE": "",
        "date_of_copying_hijri": "",
        "date_of_copying_CE": "",
        "date_of_printing_hijri": "",
        "date_of_printing_CE": "",
        "place_of_printing": "",
        "incipit": "",
        "explicit": "كمل شرح الفية ابن ملك للمرادى",
        "material": "Papier",
        "script": "Magrébine",
        "number_of_folios": 151,
        "layaout_or_lines_per_page": 31,
        "text": "Commentaire d'Al-Mouradi sur l'Alfiyya d'Ibn Mâlik. Tel est le désordre de ce manuscrit que le dernier feuillet est relié en tête; on y lit: كمل شرح الفية ابن ملك للمرادى. Une collation faite avec les mss. 4, 70-73 permettrait de rétablir l'ordre dans ce volume, écrit en 802 de l'Hégire (1399 ap. J.-Ch.). Le commencement ne s'y trouve pas.\nLes fol. 27 et 28 non seulement n'appartiennent pas à ce manuscrit, mais ils sont du format in-12. Ils contiennent un fragment institute: التعليق الخامس لابى الفتح بن جنى عن الشيخ ابى على الحسين بن احمد بن عبد الغفّار النحوى الفارسي . Les deux grammairiens cités dans ce titre appartiennent tous deux à la seconde moitié du quatrième siècle de l'Hégire (cf. Fihrist, I, p. ٦٤ et ٨٧). Commencement de ce fragment مسلة سألت فقلت له كنت قلت فى قديما ان كان مستقرة لا مصدر . لي الشيخ ابا على لها فقال نعم لانها لا تفيد الحدث قلت له فانه قلت عجبت من كون زيد قائما ا فليس هذا مصدرا لها الخ.\nPapier. Écriture Magrébine. 151 feuillets. 31 lignes par page."
    },
    {
        "title": "هداية السبيل الى بيان مسائل التسهيل «Direction vers le chemin qui conduit à l'intelligence des questions posées par le Tashil.»",
        "author": "Abd el-Kâdir ibn Abi 'l-Kasim Al-'Imadi Al-Anşârî",
        "author_date_hijri": "820",
        "author_date_CE": "1420",
        "title_of_original_text_commented_upon": "تسهيل الفوائد وتكميل المقاصد",
        "author_of_original_text_commented_upon": "Ibn Mâlik",
        "date_of_author_of_original_text_commented_upon_hijri": "",
        "date_of_author_of_original_text_commented_upon_CE": "",
        "date_of_original_text_commented_upon_hijri": "",
        "date_of_original_text_commented_upon_CE": "",
        "date_of_copying_hijri": "",
        "date_of_copying_CE": "",
        "date_of_printing_hijri": "",
        "date_of_printing_CE": "",
        "place_of_printing": "",
        "incipit": "الحمد لله الذى منح من شاء من عباده تسهيل الفوائد الخ",
        "explicit": "",
        "material": "Papier",
        "script": "Asiatique",
        "number_of_folios": 125,
        "layaout_or_lines_per_page": 31,
        "text": "Titre: هداية السبيل الى بيان مسائل التسهيل «Direction vers le chemin qui conduit à l'intelligence des questions posées par le Tashil.» C'est un commentaire sur l'ouvrage d'Ibn Mâlik (جمال الدين ابو عبد الله محمد بن عبد الله بن مالك الطائى الحياني, ainsi au fol. 3 v°) intitulé تسهيل الفوائد وتكميل المقاصد Le texte de cet ouvrage se trouve dans les manuscrits 64 et 140. Le titre est donné au fol. 4 r°; l'auteur de ce commentaire, qui est resté inachevé, est, d'après Hadji Khalifa II, p. 294 Abd el-Kâdir ibn Abi 'l-Kasim Al-'Imadi Al-Anşârî, mort vers 820 de l'Hégire (1420 ap. J.-Ch.). L'exemplaire, incomplet de la fin, s'arrête au milieu du باب اسم الفاعل. Le commentateur raconte dans sa préface qu'Ibn Mâlik, effrayé de voir les variantes nombreuses qui s'étaient introduites dans les copies de son ouvrage, entreprit de le commenter et de l'expliquer, pour mieux fixer le texte véritable. Ce commentaire par l'auteur lui-même n'a jamais été au delà des trois premiers cinquiemens (الى باب مصادر غير الثلاثى وذلك نحو ثلاثة اخماسه fol. 3 v°), et il a été utilisé dans cette «compilation» (مجموع), comme Al-Imâdî appelle lui-même son travail. Commencement: الحمد لله الذى منح من شاء من عباده تسهيل الفوائد الخ.\nPapier. Écriture Asiatique. 125 feuillets. 31 lignes par page. Lacuno entre les feuillets 67 et 68. Sans date."
    },
    {
        "title": "كتاب المقاصد النحوية، في شرح شواهد شروح الالفيه",
        "author": "Aboû Mohammad Mahmoud ibn Ahmad Al-Ainî",
        "author_date_hijri": "855",
        "author_date_CE": "1451",
        "title_of_original_text_commented_upon": "الالفية",
        "author_of_original_text_commented_upon": "",
        "date_of_author_of_original_text_commented_upon_hijri": "",
        "date_of_author_of_original_text_commented_upon_CE": "",
        "date_of_original_text_commented_upon_hijri": "",
        "date_of_original_text_commented_upon_CE": "",
        "date_of_copying_hijri": "",
        "date_of_copying_CE": "",
        "date_of_printing_hijri": "",
        "date_of_printing_CE": "",
        "place_of_printing": "",
        "incipit": "اياك نحمد يا من علمتنا من العلوم ما لم تعلم الخ",
        "explicit": "",
        "material": "Papier",
        "script": "Asiatique très soignée",
        "number_of_folios": 257,
        "layaout_or_lines_per_page": 21,
        "text": "Titre: كتاب المقاصد النحوية، في شرح شواهد شروح الالفيه «Livre intitulé: Études grammaticales; commentaire sur les vers cités comme exemples dans les commentaires de l'Alfiyya.» Ce titre est donné dans la préface, où est indiqué également l'auteur Aboû Mohammad Mahmoud ibn Ahmad Al-Ainî. Celui-ci mourut en 855 de l'Hégire (1451 ap. J.-Ch.). Il avait écrit deux rédactions de ses «Études grammaticales», l'une développée, l'autre abrégée; nous avons ici la première. Les commentaires sur l'Alfiyya, dont les exemples en vers sont ici expliqués, sont au nombre de quatre : ils ont pour auteurs: 1° ابن الناظم «le fils du versificateur», c'est-à-dire le fils d'Ibn Al-Malik designé par un ظ; 2° ابن ام القاسم, c'est-à-dire Al-Mourâdî, désigné par un ق (cf. n° 4 et 12); 3° ابن هشام désigné par un ه (cf. n° 7, 2°); 4° ابن عقيل désigné par un ع (cf. n° 10). Ce commentaire, très étendu, donne souvent, à propos d'un vers, la poésie entière, à laquelle il a été emprunté. Bien que rien ne l'indique dans le manuscrit, il ne paraît renfermer que la première moitié de l'ouvrage. Le dernier vers d'Ibn 'Akil, qu'il cite, se trouve page ١٩٢ dans l'édition de Dieterici. Commencement: اياك نحمد يا من علمتنا من العلوم ما لم تعلم الخ.\nPapier. Écriture Asiatique très soignée. 257 feuillets. 21 lignes par page. Sans date."
    },
    {
        "title": "Dernier volume d'un Commentaire très étendu sur l'Alfiyya",
        "author": "",
        "author_date_hijri": "771",
        "author_date_CE": "1369",
        "title_of_original_text_commented_upon": "Alfiyya",
        "author_of_original_text_commented_upon": "",
        "date_of_author_of_original_text_commented_upon_hijri": "",
        "date_of_author_of_original_text_commented_upon_CE": "",
        "date_of_original_text_commented_upon_hijri": "",
        "date_of_original_text_commented_upon_CE": "",
        "date_of_copying_hijri": "771",
        "date_of_copying_CE": "1369",
        "date_of_printing_hijri": "",
        "date_of_printing_CE": "",
        "place_of_printing": "",
        "incipit": "والاسم المنقوص فى احكام الوقف على اربعة اقسام",
        "explicit": "وقد كمل بحمد الله الغرض المقصود ...... رسمته بالمقاصد الشافية في شرح خلاصة الكافية ...... وكان الفراغ من تقييده ...... عام ۷۷۱",
        "material": "Papier",
        "script": "Magrébine",
        "number_of_folios": 165,
        "layaout_or_lines_per_page": 30,
        "text": "Dernier volume d'un Commentaire très étendu sur l'Alfiyya. Ce volume, qui doit être le dixième environ, commence au vers 884: وحذف يا المنقوص البيت. Commencement du commentaire: والاسم المنقوص فى احكام الوقف على اربعة اقسام. A la fin (fol. 165 v°), le titre est donné dans la note suivante: وقد كمل بحمد الله الغرض المقصود ...... رسمته بالمقاصد الشافية في شرح خلاصة الكافية ...... وكان الفراغ من تقييده ...... عام ۷۷۱. Le titre pent ainsi se traduire: «Les études réconfortantes; commentaire sur ce qu'il y a de meilleur dans le Livre suffisant.» Il semble que les noms des traités si connus, la Schafiya et la Kafiya aient été ici réunis à dessein. Ce manuscrit, de 771 de l'Hégire (1369 ap. J.-Ch.), doit être peu postérieur à l'époque où vivait l'auteur anonyme. En marge, des corrections provenant d'une collation faite sur son autographe en 832 de l'Hégire (1428 ap. J.-Ch.).\nPapier. Écriture Magrébine. 165 feuillets. 30 lignes par pago."
    },
    {
        "title": "Commentaire par بدر الدين ابو عبد الله محمد بن مالك الطائي sur la لامية الافعال",
        "author": "بدر الدين ابو عبد الله محمد بن مالك الطائي",
        "author_date_hijri": "686",
        "author_date_CE": "1287",
        "title_of_original_text_commented_upon": "لامية الافعال",
        "author_of_original_text_commented_upon": "Ibn Mâlik",
        "date_of_author_of_original_text_commented_upon_hijri": "",
        "date_of_author_of_original_text_commented_upon_CE": "",
        "date_of_original_text_commented_upon_hijri": "",
        "date_of_original_text_commented_upon_CE": "",
        "date_of_copying_hijri": "",
        "date_of_copying_CE": "",
        "date_of_printing_hijri": "",
        "date_of_printing_CE": "1854",
        "place_of_printing": "Helsingfors",
        "incipit": "هذه اوراق تشتمل على قصيدة والدى رحمه الله تعالى فى ابنية الافعال وما يتصل على ذكر ما يحتاج اليه من الامثلة والايضاح ما أبهم وتفسير الغريب الخ",
        "explicit": "",
        "material": "Papier",
        "script": "Magrébine",
        "number_of_folios": 170,
        "layaout_or_lines_per_page": 35,
        "text": "Sept commentaires sur la لامية الافعال «Poème rimant en lâm sur les verbes», poème d'Ibn Mâlik (cf. Hadji Khalifa, n° 11021): Commentaire par le fils de l'auteur بدر الدين ابو عبد الله محمد بن مالك الطائي , mort en 686 de l'Hégire (1287 ap. J.-Ch.). Ce commentaire a été publié par M. Kellgren (Helsingfors, 1854), par MM. Kellgren et Volck (St. Pétersbourg, 1864), : enfin par M. Volek (Leipzig, 1866). Commencement هذه اوراق تشتمل على قصيدة والدى رحمه الله تعالى فى ابنية الافعال وما يتصل على ذكر ما يحتاج اليه من الامثلة والايضاح ما أبهم وتفسير الغريب الخ.\n2° (Fol. 9 v°). Commentaire par شمس الدين محمد بن عبد الدائم النعيمي البرماوي الشافعي. Il cite le précédent et lui est donc postérieur. Commencement: الحمد لله مصرف الافعال بما هو مريد الخ.\n3° (Fol. 46 v°). Commentaire intitulé تحقيق المقال وتسهيل المنال فى شرح لامية الأفعال, par ابو عبد الله محمد بن العباس (cf. ms. 79). Commencement: الحمد لله الذي تفرد فى ذاته الخ.\n4° (Fol. 80 v°). Commentaire par يعقوب بن سعيد بن يعقوب المكلاتى. Commencement: الحمد لله رب العالمين الخ\n5° (Fol. 107 v°). Commentaire sans titre ni préface, et s'arrêtant court avant la fin du poème. A la fin (fol. 127 r°): انتهى ما وُجد من شرح لامية الافعال للامام ابي عبد الله النجادي. La note porte-t-elle البخاري النجادي, on, comme lit Casiri, البجادي (cf. n° 34)? La lecture est douteuse. Commencement après le premier vers du poème: قوله الحمد لله لا ابغى به بدلا الحمد هو الثناء على المحمود باللسان على الجميل من الفضائل الخ.\n6° (Fol. 127 v°). Commentaire par ابو العباس احمد بن العباس الوهراني. Commentaire sans préface\n7° (Fol. 138 v°). Commentaire sans nom d'auteur. Commencement: الحمد لله المتصرف قبل علّة التصريف الخ. D'après Hadjt Khalifa V, p. 291, c'est le commentaire d'Aboû Abd Allah Mohammad ibn 'Omar Al-Hadrami. Voir aussi manuscrit 144.\nPapier. Écriture Magrébine très soignée. 170 feuillets. En moyenne, 35 lignes par page. Sans date; le tout écrit de la même main au Xᵉ siècle de l’Hégire."
    },
    {
        "title": "Commentaire par شمس الدين محمد بن عبد الدائم النعيمي البرماوي الشافعي sur la لامية الافعال",
        "author": "شمس الدين محمد بن عبد الدائم النعيمي البرماوي الشافعي",
        "author_date_hijri": "",
        "author_date_CE": "",
        "title_of_original_text_commented_upon": "لامية الافعال",
        "author_of_original_text_commented_upon": "Ibn Mâlik",
        "date_of_author_of_original_text_commented_upon_hijri": "",
        "date_of_author_of_original_text_commented_upon_CE": "",
        "date_of_original_text_commented_upon_hijri": "",
        "date_of_original_text_commented_upon_CE": "",
        "date_of_copying_hijri": "",
        "date_of_copying_CE": "",
        "date_of_printing_hijri": "",
        "date_of_printing_CE": "",
        "place_of_printing": "",
        "incipit": "الحمد لله مصرف الافعال بما هو مريد الخ",
        "explicit": "",
        "material": "Papier",
        "script": "Magrébine",
        "number_of_folios": 170,
        "layaout_or_lines_per_page": 35,
        "text": "Sept commentaires sur la لامية الافعال «Poème rimant en lâm sur les verbes», poème d'Ibn Mâlik (cf. Hadji Khalifa, n° 11021): Commentaire par le fils de l'auteur بدر الدين ابو عبد الله محمد بن مالك الطائي , mort en 686 de l'Hégire (1287 ap. J.-Ch.). Ce commentaire a été publié par M. Kellgren (Helsingfors, 1854), par MM. Kellgren et Volck (St. Pétersbourg, 1864), : enfin par M. Volek (Leipzig, 1866). Commencement هذه اوراق تشتمل على قصيدة والدى رحمه الله تعالى فى ابنية الافعال وما يتصل على ذكر ما يحتاج اليه من الامثلة والايضاح ما أبهم وتفسير الغريب الخ.\n2° (Fol. 9 v°). Commentaire par شمس الدين محمد بن عبد الدائم النعيمي البرماوي الشافعي. Il cite le précédent et lui est donc postérieur. Commencement: الحمد لله مصرف الافعال بما هو مريد الخ.\n3° (Fol. 46 v°). Commentaire intitulé تحقيق المقال وتسهيل المنال فى شرح لامية الأفعال, par ابو عبد الله محمد بن العباس (cf. ms. 79). Commencement: الحمد لله الذي تفرد فى ذاته الخ.\n4° (Fol. 80 v°). Commentaire par يعقوب بن سعيد بن يعقوب المكلاتى. Commencement: الحمد لله رب العالمين الخ\n5° (Fol. 107 v°). Commentaire sans titre ni préface, et s'arrêtant court avant la fin du poème. A la fin (fol. 127 r°): انتهى ما وُجد من شرح لامية الافعال للامام ابي عبد الله النجادي. La note porte-t-elle البخاري النجادي, on, comme lit Casiri, البجادي (cf. n° 34)? La lecture est douteuse. Commencement après le premier vers du poème: قوله الحمد لله لا ابغى به بدلا الحمد هو الثناء على المحمود باللسان على الجميل من الفضائل الخ.\n6° (Fol. 127 v°). Commentaire par ابو العباس احمد بن العباس الوهراني. Commentaire sans préface\n7° (Fol. 138 v°). Commentaire sans nom d'auteur. Commencement: الحمد لله المتصرف قبل علّة التصريف الخ. D'après Hadjt Khalifa V, p. 291, c'est le commentaire d'Aboû Abd Allah Mohammad ibn 'Omar Al-Hadrami. Voir aussi manuscrit 144.\nPapier. Écriture Magrébine très soignée. 170 feuillets. En moyenne, 35 lignes par page. Sans date; le tout écrit de la même main au Xᵉ siècle de l’Hégire."
    },
    {
        "title": "Commentaire intitulé تحقيق المقال وتسهيل المنال فى شرح لامية الأفعال",
        "author": "ابو عبد الله محمد بن العباس",
        "author_date_hijri": "",
        "author_date_CE": "",
        "title_of_original_text_commented_upon": "لامية الافعال",
        "author_of_original_text_commented_upon": "Ibn Mâlik",
        "date_of_author_of_original_text_commented_upon_hijri": "",
        "date_of_author_of_original_text_commented_upon_CE": "",
        "date_of_original_text_commented_upon_hijri": "",
        "date_of_original_text_commented_upon_CE": "",
        "date_of_copying_hijri": "",
        "date_of_copying_CE": "",
        "date_of_printing_hijri": "",
        "date_of_printing_CE": "",
        "place_of_printing": "",
        "incipit": "الحمد لله الذي تفرد فى ذاته الخ",
        "explicit": "",
        "material": "Papier",
        "script": "Magrébine",
        "number_of_folios": 170,
        "layaout_or_lines_per_page": 35,
        "text": "Sept commentaires sur la لامية الافعال «Poème rimant en lâm sur les verbes», poème d'Ibn Mâlik (cf. Hadji Khalifa, n° 11021): Commentaire par le fils de l'auteur بدر الدين ابو عبد الله محمد بن مالك الطائي , mort en 686 de l'Hégire (1287 ap. J.-Ch.). Ce commentaire a été publié par M. Kellgren (Helsingfors, 1854), par MM. Kellgren et Volck (St. Pétersbourg, 1864), : enfin par M. Volek (Leipzig, 1866). Commencement هذه اوراق تشتمل على قصيدة والدى رحمه الله تعالى فى ابنية الافعال وما يتصل على ذكر ما يحتاج اليه من الامثلة والايضاح ما أبهم وتفسير الغريب الخ.\n2° (Fol. 9 v°). Commentaire par شمس الدين محمد بن عبد الدائم النعيمي البرماوي الشافعي. Il cite le précédent et lui est donc postérieur. Commencement: الحمد لله مصرف الافعال بما هو مريد الخ.\n3° (Fol. 46 v°). Commentaire intitulé تحقيق المقال وتسهيل المنال فى شرح لامية الأفعال, par ابو عبد الله محمد بن العباس (cf. ms. 79). Commencement: الحمد لله الذي تفرد فى ذاته الخ.\n4° (Fol. 80 v°). Commentaire par يعقوب بن سعيد بن يعقوب المكلاتى. Commencement: الحمد لله رب العالمين الخ\n5° (Fol. 107 v°). Commentaire sans titre ni préface, et s'arrêtant court avant la fin du poème. A la fin (fol. 127 r°): انتهى ما وُجد من شرح لامية الافعال للامام ابي عبد الله النجادي. La note porte-t-elle البخاري النجادي, on, comme lit Casiri, البجادي (cf. n° 34)? La lecture est douteuse. Commencement après le premier vers du poème: قوله الحمد لله لا ابغى به بدلا الحمد هو الثناء على المحمود باللسان على الجميل من الفضائل الخ.\n6° (Fol. 127 v°). Commentaire par ابو العباس احمد بن العباس الوهراني. Commentaire sans préface\n7° (Fol. 138 v°). Commentaire sans nom d'auteur. Commencement: الحمد لله المتصرف قبل علّة التصريف الخ. D'après Hadjt Khalifa V, p. 291, c'est le commentaire d'Aboû Abd Allah Mohammad ibn 'Omar Al-Hadrami. Voir aussi manuscrit 144.\nPapier. Écriture Magrébine très soignée. 170 feuillets. En moyenne, 35 lignes par page. Sans date; le tout écrit de la même main au Xᵉ siècle de l’Hégire."
    },
    {
        "title": "Commentaire par يعقوب بن سعيد بن يعقوب المكلاتى sur la لامية الافعال",
        "author": "يعقوب بن سعيد بن يعقوب المكلاتى",
        "author_date_hijri": "",
        "author_date_CE": "",
        "title_of_original_text_commented_upon": "لامية الافعال",
        "author_of_original_text_commented_upon": "Ibn Mâlik",
        "date_of_author_of_original_text_commented_upon_hijri": "",
        "date_of_author_of_original_text_commented_upon_CE": "",
        "date_of_original_text_commented_upon_hijri": "",
        "date_of_original_text_commented_upon_CE": "",
        "date_of_copying_hijri": "",
        "date_of_copying_CE": "",
        "date_of_printing_hijri": "",
        "date_of_printing_CE": "",
        "place_of_printing": "",
        "incipit": "الحمد لله رب العالمين الخ",
        "explicit": "",
        "material": "Papier",
        "script": "Magrébine",
        "number_of_folios": 170,
        "layaout_or_lines_per_page": 35,
        "text": "Sept commentaires sur la لامية الافعال «Poème rimant en lâm sur les verbes», poème d'Ibn Mâlik (cf. Hadji Khalifa, n° 11021): Commentaire par le fils de l'auteur بدر الدين ابو عبد الله محمد بن مالك الطائي , mort en 686 de l'Hégire (1287 ap. J.-Ch.). Ce commentaire a été publié par M. Kellgren (Helsingfors, 1854), par MM. Kellgren et Volck (St. Pétersbourg, 1864), : enfin par M. Volek (Leipzig, 1866). Commencement هذه اوراق تشتمل على قصيدة والدى رحمه الله تعالى فى ابنية الافعال وما يتصل على ذكر ما يحتاج اليه من الامثلة والايضاح ما أبهم وتفسير الغريب الخ.\n2° (Fol. 9 v°). Commentaire par شمس الدين محمد بن عبد الدائم النعيمي البرماوي الشافعي. Il cite le précédent et lui est donc postérieur. Commencement: الحمد لله مصرف الافعال بما هو مريد الخ.\n3° (Fol. 46 v°). Commentaire intitulé تحقيق المقال وتسهيل المنال فى شرح لامية الأفعال, par ابو عبد الله محمد بن العباس (cf. ms. 79). Commencement: الحمد لله الذي تفرد فى ذاته الخ.\n4° (Fol. 80 v°). Commentaire par يعقوب بن سعيد بن يعقوب المكلاتى. Commencement: الحمد لله رب العالمين الخ\n5° (Fol. 107 v°). Commentaire sans titre ni préface, et s'arrêtant court avant la fin du poème. A la fin (fol. 127 r°): انتهى ما وُجد من شرح لامية الافعال للامام ابي عبد الله النجادي. La note porte-t-elle البخاري النجادي, on, comme lit Casiri, البجادي (cf. n° 34)? La lecture est douteuse. Commencement après le premier vers du poème: قوله الحمد لله لا ابغى به بدلا الحمد هو الثناء على المحمود باللسان على الجميل من الفضائل الخ.\n6° (Fol. 127 v°). Commentaire par ابو العباس احمد بن العباس الوهراني. Commentaire sans préface\n7° (Fol. 138 v°). Commentaire sans nom d'auteur. Commencement: الحمد لله المتصرف قبل علّة التصريف الخ. D'après Hadjt Khalifa V, p. 291, c'est le commentaire d'Aboû Abd Allah Mohammad ibn 'Omar Al-Hadrami. Voir aussi manuscrit 144.\nPapier. Écriture Magrébine très soignée. 170 feuillets. En moyenne, 35 lignes par page. Sans date; le tout écrit de la même main au Xᵉ siècle de l’Hégire."
    },
    {
        "title": "Commentaire sans titre ni préface sur la لامية الافعال",
        "author": "غير nommé",
        "author_date_hijri": "",
        "author_date_CE": "",
        "title_of_original_text_commented_upon": "لامية الافعال",
        "author_of_original_text_commented_upon": "Ibn Mâlik",
        "date_of_author_of_original_text_commented_upon_hijri": "",
        "date_of_author_of_original_text_commented_upon_CE": "",
        "date_of_original_text_commented_upon_hijri": "",
        "date_of_original_text_commented_upon_CE": "",
        "date_of_copying_hijri": "",
        "date_of_copying_CE": "",
        "date_of_printing_hijri": "",
        "date_of_printing_CE": "",
        "place_of_printing": "",
        "incipit": "قوله الحمد لله لا ابغى به بدلا الحمد هو الثناء على المحمود باللسان على الجميل من الفضائل الخ",
        "explicit": "انتهى ما وُجد من شرح لامية الافعال للامام ابي عبد الله النجادي",
        "material": "Papier",
        "script": "Magrébine",
        "number_of_folios": 170,
        "layaout_or_lines_per_page": 35,
        "text": "Sept commentaires sur la لامية الافعال «Poème rimant en lâm sur les verbes», poème d'Ibn Mâlik (cf. Hadji Khalifa, n° 11021): Commentaire par le fils de l'auteur بدر الدين ابو عبد الله محمد بن مالك الطائي , mort en 686 de l'Hégire (1287 ap. J.-Ch.). Ce commentaire a été publié par M. Kellgren (Helsingfors, 1854), par MM. Kellgren et Volck (St. Pétersbourg, 1864), : enfin par M. Volek (Leipzig, 1866). Commencement هذه اوراق تشتمل على قصيدة والدى رحمه الله تعالى فى ابنية الافعال وما يتصل على ذكر ما يحتاج اليه من الامثلة والايضاح ما أبهم وتفسير الغريب الخ.\n2° (Fol. 9 v°). Commentaire par شمس الدين محمد بن عبد الدائم النعيمي البرماوي الشافعي. Il cite le précédent et lui est donc postérieur. Commencement: الحمد لله مصرف الافعال بما هو مريد الخ.\n3° (Fol. 46 v°). Commentaire intitulé تحقيق المقال وتسهيل المنال فى شرح لامية الأفعال, par ابو عبد الله محمد بن العباس (cf. ms. 79). Commencement: الحمد لله الذي تفرد فى ذاته الخ.\n4° (Fol. 80 v°). Commentaire par يعقوب بن سعيد بن يعقوب المكلاتى. Commencement: الحمد لله رب العالمين الخ\n5° (Fol. 107 v°). Commentaire sans titre ni préface, et s'arrêtant court avant la fin du poème. A la fin (fol. 127 r°): انتهى ما وُجد من شرح لامية الافعال للامام ابي عبد الله النجادي. La note porte-t-elle البخاري النجادي, on, comme lit Casiri, البجادي (cf. n° 34)? La lecture est douteuse. Commencement après le premier vers du poème: قوله الحمد لله لا ابغى به بدلا الحمد هو الثناء على المحمود باللسان على الجميل من الفضائل الخ.\n6° (Fol. 127 v°). Commentaire par ابو العباس احمد بن العباس الوهراني. Commentaire sans préface\n7° (Fol. 138 v°). Commentaire sans nom d'auteur. Commencement: الحمد لله المتصرف قبل علّة التصريف الخ. D'après Hadjt Khalifa V, p. 291, c'est le commentaire d'Aboû Abd Allah Mohammad ibn 'Omar Al-Hadrami. Voir aussi manuscrit 144.\nPapier. Écriture Magrébine très soignée. 170 feuillets. En moyenne, 35 lignes par page. Sans date; le tout écrit de la même main au Xᵉ siècle de l’Hégire."
    },
    {
        "title": "Commentaire par ابو العباس احمد بن العباس الوهراني sur la لامية الافعال",
        "author": "ابو العباس احمد بن العباس الوهراني",
        "author_date_hijri": "",
        "author_date_CE": "",
        "title_of_original_text_commented_upon": "لامية الافعال",
        "author_of_original_text_commented_upon": "Ibn Mâlik",
        "date_of_author_of_original_text_commented_upon_hijri": "",
        "date_of_author_of_original_text_commented_upon_CE": "",
        "date_of_original_text_commented_upon_hijri": "",
        "date_of_original_text_commented_upon_CE": "",
        "date_of_copying_hijri": "",
        "date_of_copying_CE": "",
        "date_of_printing_hijri": "",
        "date_of_printing_CE": "",
        "place_of_printing": "",
        "incipit": "",
        "explicit": "",
        "material": "Papier",
        "script": "Magrébine",
        "number_of_folios": 170,
        "layaout_or_lines_per_page": 35,
        "text": "Sept commentaires sur la لامية الافعال «Poème rimant en lâm sur les verbes», poème d'Ibn Mâlik (cf. Hadji Khalifa, n° 11021): Commentaire par le fils de l'auteur بدر الدين ابو عبد الله محمد بن مالك الطائي , mort en 686 de l'Hégire (1287 ap. J.-Ch.). Ce commentaire a été publié par M. Kellgren (Helsingfors, 1854), par MM. Kellgren et Volck (St. Pétersbourg, 1864), : enfin par M. Volek (Leipzig, 1866). Commencement هذه اوراق تشتمل على قصيدة والدى رحمه الله تعالى فى ابنية الافعال وما يتصل على ذكر ما يحتاج اليه من الامثلة والايضاح ما أبهم وتفسير الغريب الخ.\n2° (Fol. 9 v°). Commentaire par شمس الدين محمد بن عبد الدائم النعيمي البرماوي الشافعي. Il cite le précédent et lui est donc postérieur. Commencement: الحمد لله مصرف الافعال بما هو مريد الخ.\n3° (Fol. 46 v°). Commentaire intitulé تحقيق المقال وتسهيل المنال فى شرح لامية الأفعال, par ابو عبد الله محمد بن العباس (cf. ms. 79). Commencement: الحمد لله الذي تفرد فى ذاته الخ.\n4° (Fol. 80 v°). Commentaire par يعقوب بن سعيد بن يعقوب المكلاتى. Commencement: الحمد لله رب العالمين الخ\n5° (Fol. 107 v°). Commentaire sans titre ni préface, et s'arrêtant court avant la fin du poème. A la fin (fol. 127 r°): انتهى ما وُجد من شرح لامية الافعال للامام ابي عبد الله النجادي. La note porte-t-elle البخاري النجادي, on, comme lit Casiri, البجادي (cf. n° 34)? La lecture est douteuse. Commencement après le premier vers du poème: قوله الحمد لله لا ابغى به بدلا الحمد هو الثناء على المحمود باللسان على الجميل من الفضائل الخ.\n6° (Fol. 127 v°). Commentaire par ابو العباس احمد بن العباس الوهراني. Commentaire sans préface\n7° (Fol. 138 v°). Commentaire sans nom d'auteur. Commencement: الحمد لله المتصرف قبل علّة التصريف الخ. D'après Hadjt Khalifa V, p. 291, c'est le commentaire d'Aboû Abd Allah Mohammad ibn 'Omar Al-Hadrami. Voir aussi manuscrit 144.\nPapier. Écriture Magrébine très soignée. 170 feuillets. En moyenne, 35 lignes par page. Sans date; le tout écrit de la même main au Xᵉ siècle de l’Hégire."
    },
    {
        "title": "Commentaire sans nom d'auteur sur la لامية الافعال",
        "author": "غير nommé",
        "author_date_hijri": "",
        "author_date_CE": "",
        "title_of_original_text_commented_upon": "لامية الافعال",
        "author_of_original_text_commented_upon": "Ibn Mâlik",
        "date_of_author_of_original_text_commented_upon_hijri": "",
        "date_of_author_of_original_text_commented_upon_CE": "",
        "date_of_original_text_commented_upon_hijri": "",
        "date_of_original_text_commented_upon_CE": "",
        "date_of_copying_hijri": "",
        "date_of_copying_CE": "",
        "date_of_printing_hijri": "",
        "date_of_printing_CE": "",
        "place_of_printing": "",
        "incipit": "الحمد لله المتصرف قبل علّة التصريف الخ",
        "explicit": "",
        "material": "Papier",
        "script": "Magrébine",
        "number_of_folios": 170,
        "layaout_or_lines_per_page": 35,
        "text": "Sept commentaires sur la لامية الافعال «Poème rimant en lâm sur les verbes», poème d'Ibn Mâlik (cf. Hadji Khalifa, n° 11021): Commentaire par le fils de l'auteur بدر الدين ابو عبد الله محمد بن مالك الطائي , mort en 686 de l'Hégire (1287 ap. J.-Ch.). Ce commentaire a été publié par M. Kellgren (Helsingfors, 1854), par MM. Kellgren et Volck (St. Pétersbourg, 1864), : enfin par M. Volek (Leipzig, 1866). Commencement هذه اوراق تشتمل على قصيدة والدى رحمه الله تعالى فى ابنية الافعال وما يتصل على ذكر ما يحتاج اليه من الامثلة والايضاح ما أبهم وتفسير الغريب الخ.\n2° (Fol. 9 v°). Commentaire par شمس الدين محمد بن عبد الدائم النعيمي البرماوي الشافعي. Il cite le précédent et lui est donc postérieur. Commencement: الحمد لله مصرف الافعال بما هو مريد الخ.\n3° (Fol. 46 v°). Commentaire intitulé تحقيق المقال وتسهيل المنال فى شرح لامية الأفعال, par ابو عبد الله محمد بن العباس (cf. ms. 79). Commencement: الحمد لله الذي تفرد فى ذاته الخ.\n4° (Fol. 80 v°). Commentaire par يعقوب بن سعيد بن يعقوب المكلاتى. Commencement: الحمد لله رب العالمين الخ\n5° (Fol. 107 v°). Commentaire sans titre ni préface, et s'arrêtant court avant la fin du poème. A la fin (fol. 127 r°): انتهى ما وُجد من شرح لامية الافعال للامام ابي عبد الله النجادي. La note porte-t-elle البخاري النجادي, on, comme lit Casiri, البجادي (cf. n° 34)? La lecture est douteuse. Commencement après le premier vers du poème: قوله الحمد لله لا ابغى به بدلا الحمد هو الثناء على المحمود باللسان على الجميل من الفضائل الخ.\n6° (Fol. 127 v°). Commentaire par ابو العباس احمد بن العباس الوهراني. Commentaire sans préface\n7° (Fol. 138 v°). Commentaire sans nom d'auteur. Commencement: الحمد لله المتصرف قبل علّة التصريف الخ. D'après Hadjt Khalifa V, p. 291, c'est le commentaire d'Aboû Abd Allah Mohammad ibn 'Omar Al-Hadrami. Voir aussi manuscrit 144.\nPapier. Écriture Magrébine très soignée. 170 feuillets. En moyenne, 35 lignes par page. Sans date; le tout écrit de la même main au Xᵉ siècle de l’Hégire."
    },
    {
        "title": "Commentaire sur la Kâfiya d'Ibn Al-Hâdjib",
        "author": "ابراهيم المستمى بعصام الدين",
        "author_date_hijri": "943",
        "author_date_CE": "1356",
        "title_of_original_text_commented_upon": "Kâfiya",
        "author_of_original_text_commented_upon": "Ibn Al-Hâdjib",
        "date_of_author_of_original_text_commented_upon_hijri": "",
        "date_of_author_of_original_text_commented_upon_CE": "",
        "date_of_original_text_commented_upon_hijri": "",
        "date_of_original_text_commented_upon_CE": "",
        "date_of_copying_hijri": "",
        "date_of_copying_CE": "",
        "date_of_printing_hijri": "1256",
        "date_of_printing_CE": "1840",
        "place_of_printing": "Constantinople",
        "incipit": "احمد الله على ما الهمنى ان عصاميا لا عظاميا الخ",
        "explicit": "",
        "material": "Papier",
        "script": "Magrébine",
        "number_of_folios": 283,
        "layaout_or_lines_per_page": 21,
        "text": "Commentaire sur la Kâfiya d'Ibn Al-Hâdjib, par ابراهيم المستمى بعصام الدين (sic, lisez الاسفرائنی) ابن محمد بن عربشاه الاسفراني, mort en 943 de l'Hégire (1356 ap. J.-Ch.). Cf. Ḥâdjî Khalîfa V, p. 10. Ce commentaire a été publié à Constantinople en 1256 de l'Hégire (1840 ap. J.-Ch.). Commencement: احمد الله على ما الهمنى ان عصاميا لا عظاميا الخ.\nPapier. Écriture Magrébine. 283 feuillets. 21 lignes par page. Sans date."
    },
    {
        "title": "Commentaire de Radî ed-Dîn Mohammad Al-Astarâbâdht sur la Kâfiya d'Ibn Al-Hâdjib",
        "author": "Radî ed-Dîn Mohammad Al-Astarâbâdht",
        "author_date_hijri": "686",
        "author_date_CE": "1287",
        "title_of_original_text_commented_upon": "Kâfiya",
        "author_of_original_text_commented_upon": "Ibn Al-Hâdjib",
        "date_of_author_of_original_text_commented_upon_hijri": "",
        "date_of_author_of_original_text_commented_upon_CE": "",
        "date_of_original_text_commented_upon_hijri": "",
        "date_of_original_text_commented_upon_CE": "",
        "date_of_copying_hijri": "",
        "date_of_copying_CE": "",
        "date_of_printing_hijri": "",
        "date_of_printing_CE": "",
        "place_of_printing": "",
        "incipit": "الحمد لله الذي جلّت آلاؤه",
        "explicit": "",
        "material": "Papier",
        "script": "Asiatique",
        "number_of_folios": 383,
        "layaout_or_lines_per_page": 31,
        "text": "Commentaire de Radî ed-Dîn Mohammad Al-Astarâbâdht sur la Kâfiya d'Ibn Al-Hâdjib (cf. mss. 3 et 91). Pas de titre en tête; mais à la tranche inférieure الرضى على الكافية et en tête des divers cahiers الثانى من الرضى et même الكراس ٢١ من الرضى شرح كافية, etc. Cet exemplaire, de 686 de Hégire (1287 ap. J.-Ch.), n'est que de trois ans postérieur à la composition du commentaire. Commencement: الحمد لله الذي جلّت آلاؤه.\nPapier. Écriture Asiatique. 383 feuillets. 31 lignes par page."
    },
    {
        "title": "Commentaire de Dschârpardî sur la Schâfiya, manuel d'étymologie et de syntaxe, par Ibn Al-Hâdjib",
        "author": "Dschârpardî",
        "author_date_hijri": "746",
        "author_date_CE": "1345",
        "title_of_original_text_commented_upon": "كتاب التصريف",
        "author_of_original_text_commented_upon": "Ibn Al-Hâdjib",
        "date_of_author_of_original_text_commented_upon_hijri": "",
        "date_of_author_of_original_text_commented_upon_CE": "",
        "date_of_original_text_commented_upon_hijri": "",
        "date_of_original_text_commented_upon_CE": "",
        "date_of_copying_hijri": "839",
        "date_of_copying_CE": "1435",
        "date_of_printing_hijri": "1262",
        "date_of_printing_CE": "1845",
        "place_of_printing": "Calcutta",
        "incipit": "رب تمم بالخير ربنا افرغ علينا صبرا الخ",
        "explicit": "",
        "material": "Papier",
        "script": "Asiatique",
        "number_of_folios": 175,
        "layaout_or_lines_per_page": 23,
        "text": "Commentaire de Dschârpardî sur la Schâfiya, manuel d'étymologie et de syntaxe, par Ibn Al-Hâdjib. Sur le titre, une main plus moderne a tracé الجار پردی شرح الشافية. Le commentateur, qui mourut en 746 de l'Hégire (1345 ap. J.-Ch.), est nommé fol. 3 v° فخر الملة والدين ابو عبد الله احمد بن الحسين الجاربردي. Il n'appelle jamais le livre, qu'il commente, autrement que كتاب التصريف d'Ibn Al-Hâdjib. Ce commentaire a été imprimé à Calcutta en 1262 de l'Hégire (1845 ap. J.-Ch.). Commencement différent de celui donné par Hadjî Khalifa, رب تمم بالخير ربنا افرغ علينا صبرا الخ: IC, p. 4.\nPapier. Écriture Asiatique. 175 feuillets. 23 lignes par page. Copie datée de 839 de l'Hégire (1435 ap. J.-Ch.). Écriture beaucoup plus serrée à la fin qu'au commencement. Les premiers feuillets sont encombrés de notes marginales; il y en a ensuite de moins en moins."
    },
    {
        "title": "Premier volume d'un commentaire sur la Schâfiya d'Ibn Al-Hadjib",
        "author": "Aboû Djama Sa'id ibn Mas'oud As-Sinhâdji Al-Marrâkouschi",
        "author_date_hijri": "",
        "author_date_CE": "",
        "title_of_original_text_commented_upon": "Schâfiya",
        "author_of_original_text_commented_upon": "Ibn Al-Hadjib",
        "date_of_author_of_original_text_commented_upon_hijri": "",
        "date_of_author_of_original_text_commented_upon_CE": "",
        "date_of_original_text_commented_upon_hijri": "",
        "date_of_original_text_commented_upon_CE": "",
        "date_of_copying_hijri": "",
        "date_of_copying_CE": "",
        "date_of_printing_hijri": "",
        "date_of_printing_CE": "",
        "place_of_printing": "",
        "incipit": "الحمد لله الذي تصرف بقدرته فى ملكوته الخ",
        "explicit": "انتهى السفر الاول من كنز المطالب على شافية ابن الحاجب على يد جامعه ........ ابى جمعة سعيد بن مسعود المراكشي الدار الصنهاجي الاصل والنجار الخ",
        "material": "Papier",
        "script": "Magrébine",
        "number_of_folios": 269,
        "layaout_or_lines_per_page": 25,
        "text": "Premier volume d'un commentaire sur la Schâfiya d'Ibn Al-Hadjib. A la fin, on lit: انتهى السفر الاول من كنز المطالب على شافية ابن الحاجب على يد جامعه ........ ابى جمعة (sic, cf. n° 9) سعيد بن مسعود المراكشي الدار الصنهاجي الاصل والنجار الخ. L'auteur, dont nous avons sans doute ici l'autographe, se nomme donc Aboû Djama Sa'id ibn Mas'oud As-Sinhâdji Al-Marrâkouschi, et le titre de son commentaire est «Le trésor des recherches sur la Schâfiya d'Ibn Al-Hâdjib». Ce titre est déjà donné une première fois au bout de la préface (fol. 3 r°). Commencement: الحمد لله الذي تصرف بقدرته فى ملكوته الخ.\nPapier. Écriture Magrébine. 269 feuillets. 25 lignes par page. Sans date."
    },
    {
        "title": "Commentaire sur la Kâfiya d'Ibn Al-Hâdjib",
        "author": "",
        "author_date_hijri": "",
        "author_date_CE": "",
        "title_of_original_text_commented_upon": "Kâfiya",
        "author_of_original_text_commented_upon": "Ibn Al-Hâdjib",
        "date_of_author_of_original_text_commented_upon_hijri": "",
        "date_of_author_of_original_text_commented_upon_CE": "",
        "date_of_original_text_commented_upon_hijri": "",
        "date_of_original_text_commented_upon_CE": "",
        "date_of_copying_hijri": "859",
        "date_of_copying_CE": "1455",
        "date_of_printing_hijri": "",
        "date_of_printing_CE": "",
        "place_of_printing": "",
        "incipit": "الحمد لله الذي خلق الانسان وعلمه البيان الخ",
        "explicit": "",
        "material": "Papier",
        "script": "Asiatique",
        "number_of_folios": 263,
        "layaout_or_lines_per_page": 30,
        "text": "Commentaire sur la Kâfiya d'Ibn Al-Hâdjib, avec le titre suivant التحفة الشافية في شرح الكافية. Aucune indication d'auteur, non plus que dans Hâdji Khalîfa V, p. 13. Au dernier feuillet, le manuscrit est daté de 859 de l'Hégire (1455 ap. J.-Ch.), Commencement: الحمد لله الذي خلق الانسان وعلمه البيان الخ.\nPapier. Écriture Asiatique. 263 feuillets. 30 lignes par page."
    },
    {
        "title": "Commentaire sur le poème grammatical d'Ibn Mou't, intitulé Alfiyya",
        "author": "Ibn Al-Khabbâz",
        "author_date_hijri": "639",
        "author_date_CE": "1241",
        "title_of_original_text_commented_upon": "Alfiyya",
        "author_of_original_text_commented_upon": "Ibn Mou't",
        "date_of_author_of_original_text_commented_upon_hijri": "",
        "date_of_author_of_original_text_commented_upon_CE": "",
        "date_of_original_text_commented_upon_hijri": "",
        "date_of_original_text_commented_upon_CE": "",
        "date_of_copying_hijri": "644",
        "date_of_copying_CE": "1246",
        "date_of_printing_hijri": "",
        "date_of_printing_CE": "",
        "place_of_printing": "",
        "incipit": "اما بعد حمد الله على ما أفاض علينا من ملابس آلائه الخ",
        "explicit": "",
        "material": "Papier",
        "script": "Asiatique",
        "number_of_folios": 154,
        "layaout_or_lines_per_page": 22,
        "text": "Commentaire sur le poème grammatical d'Ibn Mou't, intitulé Alfiyya, comme celui d'Ibn Mâlik (voir manuscrit 9). L'auteur du commentaire est nommé dans le titre orné d'arabesques, qui est placé en tête: شرح الدرّة الالفية إملاء الشيخ شمس الدين ابى العباس احمد بن الحسين بن احمد النحوى الموصلي المعروف بابن الخباز ..... «Commentaire sur la perle intitulée l' Alfiyya; œuvre du schaikh Schams ed-Dîn Aboû 'l-'Abbâs Ahmad ibn Hosain ibn Ahmad le grammairien de Mausoul, connu sous le nom d'Ibn Al-Khabbâz.» Le nom complet d'Ibn Mout est, d'apres de fol 1 v° يحيى بن معط بن عبد النور; son Alfiyya se trouve dans le manuscrit 195, 3°; Ibn AlKhabbâz dit avoir eu pour collaborateur dans la composition de ce commentaire الاخ الفقيه ...... شمس الدين ابو العباس احمد بن محمد بن احمد الاسعردى, et l'avoir terminé en 639 de l'Hégire (1241 ap. J.-Ch.). Il n'est donc pas mort en 637 de l'Hégire, quoi qu'en dise Ḥâdjî Khalîfa I, p. 415. La copie, qui est excellente, est presque contemporaine de l'oeuvre, puisqu'elle a été exécutée à Mausoul en 644 de l'Hégire (1246 ap. J.-Ch.). Commencement: اما بعد حمد الله على ما أفاض علينا من ملابس آلائه الخ.\nPapier. Écriture Asiatique. 154 feuillets. 22 lignes par page.\n"
    },
    {
        "title": "Autre exemplaire du même ouvrage",
        "author": "",
        "author_date_hijri": "698",
        "author_date_CE": "1298",
        "title_of_original_text_commented_upon": "",
        "author_of_original_text_commented_upon": "",
        "date_of_author_of_original_text_commented_upon_hijri": "",
        "date_of_author_of_original_text_commented_upon_CE": "",
        "date_of_original_text_commented_upon_hijri": "",
        "date_of_original_text_commented_upon_CE": "",
        "date_of_copying_hijri": "698",
        "date_of_copying_CE": "1298",
        "date_of_printing_hijri": "",
        "date_of_printing_CE": "",
        "place_of_printing": "",
        "incipit": "",
        "explicit": "",
        "material": "Papier",
        "script": "Asiatique",
        "number_of_folios": 166,
        "layaout_or_lines_per_page": 21,
        "text": "Autre exemplaire du même ouvrage. Copie non moins bonne que la précédente, datée de 698 de l'Hégire (1298 ap. J.-Ch.).\nPapier. Écriture Asiatique. 166 feuillets. 21 lignes par page,"
    },
    {
        "title": "Commentaire de Zauzanî sur le traité de grammaire intitule اللباب «La moëlle», par Al-Fâdil Al-Isfara'ini",
        "author": "Zauzanî",
        "author_date_hijri": "736",
        "author_date_CE": "1335",
        "title_of_original_text_commented_upon": "اللباب",
        "author_of_original_text_commented_upon": "Al-Fâdil Al-Isfara'ini",
        "date_of_author_of_original_text_commented_upon_hijri": "",
        "date_of_author_of_original_text_commented_upon_CE": "",
        "date_of_original_text_commented_upon_hijri": "",
        "date_of_original_text_commented_upon_CE": "",
        "date_of_copying_hijri": "814",
        "date_of_copying_CE": "1411",
        "date_of_printing_hijri": "",
        "date_of_printing_CE": "",
        "place_of_printing": "",
        "incipit": "الحمد لله رب العالمين وشرائف صلواته على سيد البشر محمد ......",
        "explicit": "",
        "material": "Papier",
        "script": "Asiatique",
        "number_of_folios": 209,
        "layaout_or_lines_per_page": 28,
        "text": "Commentaire de Zauzanî sur le traité de grammaire intitule اللباب «La moëlle», par Al-Fâdil Al-Isfara'ini. C'est ainsi que l'ouvrage est nommé en marge du fol. 2 r° شرح اللباب للفاضل للزوزنى. Commencement: الحمد لله رب العالمين وشرائف صلواته على سيد البشر محمد ...... (2 v°) يقول محمد بن عثمان بن محمد بن ابى على العرضى جمعتُ حواشى الامام ....... محمد بن محمد بن احمد بن السيف الاسفرائنى المعروف ...... على الكتاب المسمى باللباب وتعليقه عليه près cette note, le commentateur a utilisé pour son travail les gloses et additions qu'Al-Fâḍil avait lui-même ajoutées à son traité grammatical. La composition de ce commentaire également intitulé par son auteur الحواشى «Les gloses» a été achevée à Nîsaboûr en 736 de l'Hégire (1335 ap. J.-Ch.); la copie est datée de 814 de l'Hégire (1411 ap. J.-Ch.).\nPapier. Écriture Asiatique. 209 feuillets. 28 lignes par page. Quelques notes marginales."
    },
    {
        "title": "Autre commentaire sur le traité grammatical d'Al-Fâḍil Al-Isfarâ'inî, intitulé الباب في النحو",
        "author": "قطب الدين محمد بن مسعود الفالي",
        "author_date_hijri": "712",
        "author_date_CE": "1312",
        "title_of_original_text_commented_upon": "الباب في النحو",
        "author_of_original_text_commented_upon": "",
        "date_of_author_of_original_text_commented_upon_hijri": "",
        "date_of_author_of_original_text_commented_upon_CE": "",
        "date_of_original_text_commented_upon_hijri": "",
        "date_of_original_text_commented_upon_CE": "",
        "date_of_copying_hijri": "778",
        "date_of_copying_CE": "1377",
        "date_of_printing_hijri": "",
        "date_of_printing_CE": "",
        "place_of_printing": "",
        "incipit": "الحمد لله اللذي هدانا الى معرفة اعجاز القرآن الخ",
        "explicit": "",
        "material": "Papier",
        "script": "Asiatique",
        "number_of_folios": 223,
        "layaout_or_lines_per_page": 25,
        "text": "Autre commentaire sur le traité grammatical d'Al-Fâḍil Al-Isfarâ'inî, intitulé الباب في النحو. L'auteur de ce commentaire n'est pas nommé; d'après Ḥâdjî Khalîfa V, p. 303 (cf. VII, p. 867), il est de قطب الدين محمد بن مسعود الفالي qui l'aurait achevé en 712 de l'Hégire (1312 ap. J.-Ch.). D'autres exemplaires de ce même commentaire se trouvent dans les manuscrits 116 et 265. A la fin, la copie est datée de 778 de l'Hégire (1377 ap. J.-Ch.). Commencement: الحمد لله اللذي هدانا الى معرفة اعجاز القرآن الخ.\nPapier. Écriture Asiatique. 223 feuillets. 25 lignes par page."
    },
    {
        "title": "Commentaire sur le Miftah, par le très savant ...... Sa'd ed-Dîn At-Taftâzânî",
        "author": "Sa'd ed-Dîn At-Taftâzânî",
        "author_date_hijri": "791",
        "author_date_CE": "1388",
        "title_of_original_text_commented_upon": "مفتاح العلوم",
        "author_of_original_text_commented_upon": "ابو يعقوب سراج المعالى يوسف بن محمد السكاكي",
        "date_of_author_of_original_text_commented_upon_hijri": "626",
        "date_of_author_of_original_text_commented_upon_CE": "1228",
        "date_of_original_text_commented_upon_hijri": "",
        "date_of_original_text_commented_upon_CE": "",
        "date_of_copying_hijri": "804",
        "date_of_copying_CE": "1401",
        "date_of_printing_hijri": "",
        "date_of_printing_CE": "",
        "place_of_printing": "",
        "incipit": "خير خبر يوشح به صدر الكلام الخ",
        "explicit": "",
        "material": "Papier",
        "script": "Asiatique très soignée",
        "number_of_folios": 342,
        "layaout_or_lines_per_page": 21,
        "text": "Titre: كتاب شرح المفتاح للعلامة ...... سعد الدين التفتازانى. «Livre intitulé: Commentaire sur le Miftah, par le très savant ...... Sa'd ed-Dîn At-Taftâzânî». Le texte est celui de la troisième partie du مفتاح العلوم «la clef des sciences», partie في علمى المعاني والبيان; l'auteur, nommé fol. 2 r° ابو يعقوب سراج المعالى يوسف بن محمد السكاكي, mourut en 626 de l'Hégire (1228 ap. J.-Ch.); le commentateur mourut en 791 (1388 ap. J.-Ch.). Copie datée de 804 de l'Hégire (1401 ap. J.-Ch.). C'est un manuscrit de rhétorique, égaré dans la grammaire: خير خبر يوشح به صدر الكلام الخ.\nPapier. Écriture Asiatique très soignée. 342 feuillets. 21 lignes par page."
    },
    {
        "title": "كتاب الفاخر في شرح جمل عبد القاهر الجرجاني",
        "author": "شمس الدين محمد بن ابى الفتح بن ابي الفضل البعلي",
        "author_date_hijri": "645",
        "author_date_CE": "1247",
        "title_of_original_text_commented_upon": "جمل عبد القاهر الجرجاني",
        "author_of_original_text_commented_upon": "عبد القاهر الجرجاني",
        "date_of_author_of_original_text_commented_upon_hijri": "",
        "date_of_author_of_original_text_commented_upon_CE": "",
        "date_of_original_text_commented_upon_hijri": "",
        "date_of_original_text_commented_upon_CE": "",
        "date_of_copying_hijri": "VIII",
        "date_of_copying_CE": "",
        "date_of_printing_hijri": "",
        "date_of_printing_CE": "",
        "place_of_printing": "",
        "incipit": "الى خلق الانسان وعلمه البيان",
        "explicit": "انتهاه البعلى (ms. الفضلي) كتابة وتأليفا العبد ...... محمد بن ابي الفتح بن ابي الفضل مولدا الدمشق منشأ الخنبلي مذهبا ...... وكانت خاتمته ...... سنة ٦٩٥ بدمشق",
        "material": "Papier",
        "script": "Asiatique",
        "number_of_folios": 275,
        "layaout_or_lines_per_page": 25,
        "text": "Titre: ...... كتاب الفاخر في شرح جمل عبد القاهر الجرجاني تأليف الشيخ شمس الدين محمد بن ابى الفتح بن ابي الفضل البعلي. «Livre intitule: Le Superbe, commentaire sur le traité des propositions de Abd al-Ķâhir Al-Djordjânî, par le schaikh ...... Schams edDîn Moḥammad ibn Abî 'l-Fath ibn Abi 'l-Fadl Al-Ba´lî.» Au fol. 1 v°, le nom du commentateur est répété et complété: après ibn Abî 'l-Faḍl, on y lit: ibn Abi Alî Al-Ba´lî Al-Hanbali.\nC'est au fol. 1 r° que se trouve la note traduite par Casiri, d'après laquelle le commentateur naquit à Ba'lbak en 645 de l'Hégire (1247 ap. J.-Ch.) et mourut au Caire en 709 de l'Hégire (1309 ap. J.-Ch.). Son commentaire fut achevé à Damas en 695 de l'Hégire (1295 ap. J.-Ch.), comme il ressort de la note suivante, au fol. 275 v° انتهاه البعلى (ms. الفضلي) كتابة وتأليفا العبد ...... محمد بن ابي الفتح بن ابي الفضل مولدا الدمشق منشأ الخنبلي مذهبا ...... وكانت خاتمته ...... سنة ٦٩٥ بدمشق. Notre exemplaire a été copié sur un autre exemplaire, qui avait été copié sur l'autographe de l'auteur, et a été collationné sur celui-ci à Damas. Commencement الى خلق الانسان وعلمه البيان.\nPapier. Écriture Asiatique. 275 feuillets. 25 ligues par page. Sans date; manuscrit du VIIIº siècle de l'Hégire."
    },
    {
        "title": "كتاب شرح الجرجانية فى النحو تأليف سيدنا شهاب الدین احمد بن الشيخ ...... شرف الدين شرف بن منصور الثعلبي الشافعى الزرعى قاضي قضاة المسلمين بطرابلس الشام وكتب فى ...... عام ٧٨٦",
        "author": "شهاب الدین احمد بن الشيخ شرف الدين شرف بن منصور الثعلبي",
        "author_date_hijri": "",
        "author_date_CE": "",
        "title_of_original_text_commented_upon": "الجرجانية",
        "author_of_original_text_commented_upon": "",
        "date_of_author_of_original_text_commented_upon_hijri": "",
        "date_of_author_of_original_text_commented_upon_CE": "",
        "date_of_original_text_commented_upon_hijri": "",
        "date_of_original_text_commented_upon_CE": "",
        "date_of_copying_hijri": "",
        "date_of_copying_CE": "",
        "date_of_printing_hijri": "786",
        "date_of_printing_CE": "1385",
        "place_of_printing": "",
        "incipit": "الحمد لله الكريم المنان العظيم السلطان الخ",
        "explicit": "",
        "material": "Papier",
        "script": "Asiatique très soignée",
        "number_of_folios": 88,
        "layaout_or_lines_per_page": 17,
        "text": "Autre commentaire sur le même traité d'Al-Djordjânî. Voici ce que porte le title: كتاب شرح الجرجانية فى النحو تأليف سيدنا شهاب الدین احمد بن الشيخ ...... شرف الدين شرف بن منصور الثعلبي الشافعى الزرعى قاضي قضاة المسلمين بطرابلس الشام وكتب فى ...... عام ٧٨٦. Le livre intitulé الجرجانية dans le titre et .... المختصر تصنيف الجرجاني dans la préface (fol. 1 v°) est le même qui an manuscrit 27 est nommé الجمل فى النحو. Cf. du reste Hâdji Khalifa, n° 4196. Commencement: الحمد لله الكريم المنان العظيم السلطان الخ.\nPapier. Écriture Asiatique très soignée. 88 feuillets. 17 lignes par page. Sans date, si 786 de l'Hégire (1385 ap. J.-Ch.) est l'année non de la copie, mais de la composition."
    },
    {
        "title": "سفر فيه جميع اصلاح المنطق",
        "author": "أبو يوسف يعقوب بن اسحق السكيت",
        "author_date_hijri": "244",
        "author_date_CE": "858",
        "title_of_original_text_commented_upon": "",
        "author_of_original_text_commented_upon": "",
        "date_of_author_of_original_text_commented_upon_hijri": "",
        "date_of_author_of_original_text_commented_upon_CE": "",
        "date_of_original_text_commented_upon_hijri": "",
        "date_of_original_text_commented_upon_CE": "",
        "date_of_copying_hijri": "627",
        "date_of_copying_CE": "1229",
        "date_of_printing_hijri": "",
        "date_of_printing_CE": "",
        "place_of_printing": "",
        "incipit": "املاء ابي يوسف",
        "explicit": "تم اصلاح المنطق ...... وذلك ...... عام ٦٢٧",
        "material": "Papier",
        "script": "Magrébine",
        "number_of_folios": 134,
        "layaout_or_lines_per_page": 21,
        "text": "Titre: سفر فيه جميع اصلاح المنطق تأليف ابي يوسف يعقوب بن اسحق السكيت رواية ابى على اسمعيل بن القاسم البغدادي «Volume contenant un exemplaire complet du Redressement de la prononciation, œuvre de Aboû Yousouf Ya'koûb ibn Ishak As-Sikkit, recension d'Abot 'Ali Ismail ibn Al-Kasim AlBagdadi.» Le premier, connu sous le nom d'Ibn As-Sikkît, mourut en 244 de l'Hégire (858 ap. J.-Ch.); le second en 356 de l'Hégire (966 ap. J.-Ch.). A la fin de ce manuscrit, entièrement et excellemment vocalisé, le copiste dit (fol. 134 v°) عارضت كتابى هذا بكتاب الاستاذ اللغوى النحوى العلامة ابى محمد ابن السيد البطليوسى ..... تم اصلاح المنطق ...... وذلك ...... عام ٦٢٧. Cet exemplaire, de 627 de l'Hégire (1229 ap. J.-Ch.), a donc été collationné avec la copie du célèbre grammairien Ibn AsSid Al-Batalyoûsî, qui mourut en 521 de l'Hégire (1127 ap. J.-Ch.). Commencement au fol. 1 v°, au verso du titre: املاء ابي يوسف; puis, à la ligne suivante: اخبرنا ابو بكر قال حدثني ابى قال حدثنا ابو محمد عبد الله بن رستم قال قال ابو يوسف يعقوب بن اسحق السكست (sic) هذا باب فعل وفعل باختلاف المعنى الحمل ما كان في بطن اوعلى رأس شجرة وجمعه أحمال والجمل ما حمل على ظهر او على رأس الخ.\nPapier. Écriture Magrébine. 134 feuillets. 21 lignes par page."
    },
    {
        "title": "كتاب الجمل في النحو «Traité des propositions grammaticales»",
        "author": "Abot 'l-Kasim Abd er-Rahman ibn Ishalk AzZadjdjâdjî",
        "author_date_hijri": "339",
        "author_date_CE": "950",
        "title_of_original_text_commented_upon": "",
        "author_of_original_text_commented_upon": "",
        "date_of_author_of_original_text_commented_upon_hijri": "",
        "date_of_author_of_original_text_commented_upon_CE": "",
        "date_of_original_text_commented_upon_hijri": "",
        "date_of_original_text_commented_upon_CE": "",
        "date_of_copying_hijri": "604",
        "date_of_copying_CE": "1207",
        "date_of_printing_hijri": "",
        "date_of_printing_CE": "",
        "place_of_printing": "",
        "incipit": "أقسام الكلام ثلاثة اسم وفعل وحرف جاء لمعنى الخ",
        "explicit": "",
        "material": "Papier",
        "script": "Magrébine",
        "number_of_folios": 97,
        "layaout_or_lines_per_page": 20,
        "text": "1° كتاب الجمل في النحو «Traité des propositions grammaticales», par Abot 'l-Kasim Abd er-Rahman ibn Ishalk AzZadjdjâdjî, mort en 339 de l'Hégire (950 ap. J.-Ch.). Le titre se trouve à la fin (fol. 78 vº), le nom de l'auteur aux fol. 2 v° et 78 v°. Copie datée de 604 de l'Hégire (1207 ap. J.-Ch.). Commencement: أقسام الكلام ثلاثة اسم وفعل وحرف جاء لمعنى الخ.\n2° (Fol. 79 v°) كتاب الفصيح \t«Livre intitulé: La langue pure.» Ainsi est dénommé cet opuscule à la fin (fol. 92 r°). Cf. Hadji Khalifa n° 9110 qui donne comme auteur probable ابو العباس احمد بن يحي الكوفى المعروف بثعلب. C'est aussi comme œuvre de Tha'lab qu'il figure dans le manuscrit 187, à la Bibliothèque de Leyde (ms. CXIV; Dozy, Catalogus, I, p. 62) et dans l'édition savante de M. J. Barth (Leipzig, 1876, in-8°). Voir aussi Lane dans la Zeitschrift der deutsch. morg. Gesellschaft, III, p. 94. Avant la préface, telle qu'elle W : a été imprimée, on lit dans ce manuscrit: قال ابو على قرأتُ هذا الكتاب على ابى عمر المطرز وعلى نفطويه وعلى ابى بكر بن الانباري قالوا كلهم حدثنا ابو العباس احمد بن يحى ثعلب اخبرنى ابو الحسن على بن عبيد الكوفي النحوى والاسدى سمعت ابا العباس احمد بن يحى النحوى يقول. C'est un des rares documents originaux qui nous ait été conservé de l'école de Koûfa.\n3° (Fol. 93 v°) Titre en tête: هذا كتاب المثلث مما الف قطرب ابن احمد النحوى البصرى «Ceci est le livre intitulé: Les mots dont le premier radical peut recevoir les trois voyelles, composition de Koutroub, fils d'Aḥmad, le grammairien de Başra.» Ce petit traité en vers a été publié par Ed.Vilmar (Marburg, 1857. In-8).\nPapier, Écriture Magrébine. 97 feuillets. 20 lignes par page. Volume tout entier écrit de la même main en 604 de l'Hégire (1207 ap. J.-Ch.)."
    },
    {
        "title": "كتاب الفصيح «Livre intitulé: La langue pure.»",
        "author": "ابو العباس احمد بن يحي الكوفى المعروف بثعلب",
        "author_date_hijri": "",
        "author_date_CE": "",
        "title_of_original_text_commented_upon": "",
        "author_of_original_text_commented_upon": "",
        "date_of_author_of_original_text_commented_upon_hijri": "",
        "date_of_author_of_original_text_commented_upon_CE": "",
        "date_of_original_text_commented_upon_hijri": "",
        "date_of_original_text_commented_upon_CE": "",
        "date_of_copying_hijri": "604",
        "date_of_copying_CE": "1207",
        "date_of_printing_hijri": "",
        "date_of_printing_CE": "",
        "place_of_printing": "",
        "incipit": "",
        "explicit": "",
        "material": "Papier",
        "script": "Magrébine",
        "number_of_folios": 97,
        "layaout_or_lines_per_page": 20,
        "text": "1° كتاب الجمل في النحو «Traité des propositions grammaticales», par Abot 'l-Kasim Abd er-Rahman ibn Ishalk AzZadjdjâdjî, mort en 339 de l'Hégire (950 ap. J.-Ch.). Le titre se trouve à la fin (fol. 78 vº), le nom de l'auteur aux fol. 2 v° et 78 v°. Copie datée de 604 de l'Hégire (1207 ap. J.-Ch.). Commencement: أقسام الكلام ثلاثة اسم وفعل وحرف جاء لمعنى الخ.\n2° (Fol. 79 v°) كتاب الفصيح \t«Livre intitulé: La langue pure.» Ainsi est dénommé cet opuscule à la fin (fol. 92 r°). Cf. Hadji Khalifa n° 9110 qui donne comme auteur probable ابو العباس احمد بن يحي الكوفى المعروف بثعلب. C'est aussi comme œuvre de Tha'lab qu'il figure dans le manuscrit 187, à la Bibliothèque de Leyde (ms. CXIV; Dozy, Catalogus, I, p. 62) et dans l'édition savante de M. J. Barth (Leipzig, 1876, in-8°). Voir aussi Lane dans la Zeitschrift der deutsch. morg. Gesellschaft, III, p. 94. Avant la préface, telle qu'elle W : a été imprimée, on lit dans ce manuscrit: قال ابو على قرأتُ هذا الكتاب على ابى عمر المطرز وعلى نفطويه وعلى ابى بكر بن الانباري قالوا كلهم حدثنا ابو العباس احمد بن يحى ثعلب اخبرنى ابو الحسن على بن عبيد الكوفي النحوى والاسدى سمعت ابا العباس احمد بن يحى النحوى يقول. C'est un des rares documents originaux qui nous ait été conservé de l'école de Koûfa.\n3° (Fol. 93 v°) Titre en tête: هذا كتاب المثلث مما الف قطرب ابن احمد النحوى البصرى «Ceci est le livre intitulé: Les mots dont le premier radical peut recevoir les trois voyelles, composition de Koutroub, fils d'Aḥmad, le grammairien de Başra.» Ce petit traité en vers a été publié par Ed.Vilmar (Marburg, 1857. In-8).\nPapier, Écriture Magrébine. 97 feuillets. 20 lignes par page. Volume tout entier écrit de la même main en 604 de l'Hégire (1207 ap. J.-Ch.)."
    },
    {
        "title": "هذا كتاب المثلث مما الف قطرب ابن احمد النحوى البصرى «Ceci est le livre intitulé: Les mots dont le premier radical peut recevoir les trois voyelles, composition de Koutroub, fils d'Aḥmad, le grammairien de Başra.»",
        "author": "قطرب ابن احمد النحوى البصرى",
        "author_date_hijri": "",
        "author_date_CE": "",
        "title_of_original_text_commented_upon": "",
        "author_of_original_text_commented_upon": "",
        "date_of_author_of_original_text_commented_upon_hijri": "",
        "date_of_author_of_original_text_commented_upon_CE": "",
        "date_of_original_text_commented_upon_hijri": "",
        "date_of_original_text_commented_upon_CE": "",
        "date_of_copying_hijri": "604",
        "date_of_copying_CE": "1207",
        "date_of_printing_hijri": "",
        "date_of_printing_CE": "",
        "place_of_printing": "",
        "incipit": "",
        "explicit": "",
        "material": "Papier",
        "script": "Magrébine",
        "number_of_folios": 97,
        "layaout_or_lines_per_page": 20,
        "text": "1° كتاب الجمل في النحو «Traité des propositions grammaticales», par Abot 'l-Kasim Abd er-Rahman ibn Ishalk AzZadjdjâdjî, mort en 339 de l'Hégire (950 ap. J.-Ch.). Le titre se trouve à la fin (fol. 78 vº), le nom de l'auteur aux fol. 2 v° et 78 v°. Copie datée de 604 de l'Hégire (1207 ap. J.-Ch.). Commencement: أقسام الكلام ثلاثة اسم وفعل وحرف جاء لمعنى الخ.\n2° (Fol. 79 v°) كتاب الفصيح \t«Livre intitulé: La langue pure.» Ainsi est dénommé cet opuscule à la fin (fol. 92 r°). Cf. Hadji Khalifa n° 9110 qui donne comme auteur probable ابو العباس احمد بن يحي الكوفى المعروف بثعلب. C'est aussi comme œuvre de Tha'lab qu'il figure dans le manuscrit 187, à la Bibliothèque de Leyde (ms. CXIV; Dozy, Catalogus, I, p. 62) et dans l'édition savante de M. J. Barth (Leipzig, 1876, in-8°). Voir aussi Lane dans la Zeitschrift der deutsch. morg. Gesellschaft, III, p. 94. Avant la préface, telle qu'elle W : a été imprimée, on lit dans ce manuscrit: قال ابو على قرأتُ هذا الكتاب على ابى عمر المطرز وعلى نفطويه وعلى ابى بكر بن الانباري قالوا كلهم حدثنا ابو العباس احمد بن يحى ثعلب اخبرنى ابو الحسن على بن عبيد الكوفي النحوى والاسدى سمعت ابا العباس احمد بن يحى النحوى يقول. C'est un des rares documents originaux qui nous ait été conservé de l'école de Koûfa.\n3° (Fol. 93 v°) Titre en tête: هذا كتاب المثلث مما الف قطرب ابن احمد النحوى البصرى «Ceci est le livre intitulé: Les mots dont le premier radical peut recevoir les trois voyelles, composition de Koutroub, fils d'Aḥmad, le grammairien de Başra.» Ce petit traité en vers a été publié par Ed.Vilmar (Marburg, 1857. In-8).\nPapier, Écriture Magrébine. 97 feuillets. 20 lignes par page. Volume tout entier écrit de la même main en 604 de l'Hégire (1207 ap. J.-Ch.)."
    },
    {
        "title": "Commentaire sur le «Traité des propositions grammaticales»",
        "author": "Aboû 'l-Ķâsim Az-Zadjdjâdjî",
        "author_date_hijri": "",
        "author_date_CE": "",
        "title_of_original_text_commented_upon": "Traité des propositions grammaticales",
        "author_of_original_text_commented_upon": "",
        "date_of_author_of_original_text_commented_upon_hijri": "",
        "date_of_author_of_original_text_commented_upon_CE": "",
        "date_of_original_text_commented_upon_hijri": "",
        "date_of_original_text_commented_upon_CE": "",
        "date_of_copying_hijri": "",
        "date_of_copying_CE": "",
        "date_of_printing_hijri": "",
        "date_of_printing_CE": "",
        "place_of_printing": "",
        "incipit": "قول ابى القاسم في اول كتابه قال يحتمل ان يكون من ايقاع الماضى موقع المستقبل كما جاء فى كلام العرب الخ",
        "explicit": "",
        "material": "Papier",
        "script": "Magrébine",
        "number_of_folios": 57,
        "layaout_or_lines_per_page": 27,
        "text": "Commentaire sur le «Traité des propositions grammaticales», par Aboû 'l-Ķâsim Az-Zadjdjâdjî (ms. 30, 1°). Commencement: قول ابى القاسم في اول كتابه قال يحتمل ان يكون من ايقاع الماضى موقع المستقبل كما جاء فى كلام العرب الخ. Ce commentaire anonyme est très écourté vers la fin.\nPapier. Écriture Magrėbine. 57 feuillets. 27 lignes par page. Sans date.\n"
    },
    {
        "title": "Commentaire de Abd el-Wahid ibn Ahmad ibn Mohammad Al-Hasant sur un poème qui n'a rien de grammatical",
        "author": "Abd el-Wahid ibn Ahmad ibn Mohammad Al-Hasant",
        "author_date_hijri": "736",
        "author_date_CE": "1335",
        "title_of_original_text_commented_upon": "المقصورة",
        "author_of_original_text_commented_upon": "Aboû Zaid Abd er-Rahmân ibn 'Alî ibn Şâliḥ Al-Makoûdî",
        "date_of_author_of_original_text_commented_upon_hijri": "",
        "date_of_author_of_original_text_commented_upon_CE": "",
        "date_of_original_text_commented_upon_hijri": "807",
        "date_of_original_text_commented_upon_CE": "1404",
        "date_of_copying_hijri": "",
        "date_of_copying_CE": "",
        "date_of_printing_hijri": "",
        "date_of_printing_CE": "",
        "place_of_printing": "",
        "incipit": "الحمد لله الذي خص من شاء من عباده بمزايا الايثار الخ",
        "explicit": "",
        "material": "Papier",
        "script": "Magrébine",
        "number_of_folios": 37,
        "layaout_or_lines_per_page": 23,
        "text": "Commentaire de Abd el-Wahid ibn Ahmad ibn Mohammad Al-Hasant sur un poème qui n'a rien de grammatical, d'Aboû Zaid Abd er-Rahmân ibn 'Alî ibn Şâliḥ Al-Makoûdî, le commentateur de l'Alfiyya d'Ibn Mâlik (voir les manuscrits 6, 2°; 7, 1°). Celui-ci, d'après une longue biographie insérée aux fol. 5 r° à 7 v°, naquit en 736 de l'Hégire (1335 ap. J.-Ch.) et mourut en 807 (1404 ap. J.-Ch.). Quant au commentateur, il cite comme date de son travail «l'année vingt de ce dixième siècle» (fol. 3 v°). Le poème de Makoûdî, intitule المقصورة «Poème on la rime est en alif sans madda», paraît consacré à l'éloge du Prophète. Notre manuscrit, dont la fin manque, se rapporte tout entier aux deux premiers vers (fol. 10 r°):\nأَرقُنى بارِقُ مَجْرٍ از سرى\t\t\tيومضُ ما بين فُرادٍ وتُنَا\nأَهَبَّنى از هَبْ منه مُوهِنَّا\t\t\tما سَدّ ما بين الثَّرَيَّا والثَّرَا\nLe commentaire a été composé à Fez (fol. 3 v°, 5 v°, etc.), à l'instigation de مولانا المنصور بالله امير المومنين (cf. ms. 5).  De nombreuses ratures donnent au livre l'aspect d'un autographe. Au fol. 1 r°, en tête du volume on lit الحمد لله يقول كاتبه بخط يده الفانية عبد الواحد بن احمد بن محمد الحسني ان هذه المبيضة لم امد بعد الى ما اودعه ...... فربما قدمت ما حقه التقيم الخ. Commencement (fol. 1 v°): الحمد لله الذي خص من شاء من عباده بمزايا الايثار الخ.\nDans ce volume ont été intercalés trois feuillets, qui lui sont étrangers; au 2° von lit كمل كتب (sic) تلقيح الافكار في العمل برسوم الغبار تأليف ابن الياسمين. Au fol. 3 v°, la date de 727 de l'Hégire (1326 ap. J.-Ch.). C'est un fragment d'un traité des calculs avec les chiffres dits goubâr.\nPapier. Écriture Magrébine. 37 feuillets. 23 lignes par page. Sans date, de la première moitié du Xe siècle de l'Hégire.\n"
    },
    {
        "title": "كتاب الملقب بالذخائر تصنيف الامام أبي الحسن على بن محمد النحوى",
        "author": "أبو الحسن على بن محمد النحوى الهروى",
        "author_date_hijri": "",
        "author_date_CE": "",
        "title_of_original_text_commented_upon": "الازهرية",
        "author_of_original_text_commented_upon": "أبو الحسن على بن محمد النحوى الهروى",
        "date_of_author_of_original_text_commented_upon_hijri": "",
        "date_of_author_of_original_text_commented_upon_CE": "",
        "date_of_original_text_commented_upon_hijri": "",
        "date_of_original_text_commented_upon_CE": "",
        "date_of_copying_hijri": "1366",
        "date_of_copying_CE": "1947",
        "date_of_printing_hijri": "",
        "date_of_printing_CE": "",
        "place_of_printing": "",
        "incipit": "سألتني ايدك الله ان اجمع لك ابوابا من النحو قد ذكرناها متفرقة في كتابنا الملقب بالذخائر الخ",
        "explicit": "",
        "material": "Papier",
        "script": "Asiatique",
        "number_of_folios": 112,
        "layaout_or_lines_per_page": 23,
        "text": "1° Title au fo. 1 r°: .... كتاب الملقب بالذخائر تصنيف الامام أبي الحسن على بن محمد النحوى الهروى «Livre sunommé: Les trésors réservés, œuvre de l'imâm ..... Aboû 'l-Hasan ‘Alî ibn Mohammad le grammairien, connu sous le nom d'AlHarawi.» Malgré ce titre (cf. Hâdjî Khalîfa, nº 5773), il est certain que nous avons ici l'opuscule de l'auteur, intitulé الازهرية, dans lequel Al-Harawî, d'après Ḥâdjî Khalîfa, n° 558, aurait mis en ordre ce qu'il avait disséminé dans ses «Trésors réservés». Voici en effet notre commencement سألتني ايدك الله ان اجمع لك ابوابا من النحو قد ذكرناها متفرقة في كتابنا الملقب بالذخائر الخ. Copie date de de l'Hégire (1366 ap. J.-Ch.).\n2° (Fol. 48 r°) Titre: كتاب العوامل «Livre des régents grammaticaux», par Sirâdj ed-Din Mahmoud ibn Yousouf de Herat (الهروى). Copie datée de 628 de l'Hégire (1230 ap J-Ch). Commencement: الحمد لله حق حمده الخ\n3° (Fol. 52 r°) Titre: كتاب شرح الآيات البينات تصنيف السعيد فخر الدين محمد بن عمر الرازى شرح السعيد عن الدين عبد الحميد بن ابى الحديد. «Livre intitulé: Commentaire sur les Signes évidents, oeuvre du défunt Fakhr ed-Din Mohammad ibn Omar Ar-Râzî; commentaire par le défunt' Izz ed-Dîn'Abd el-Hamîd ibn Abt 'l-Hadid.» Sur l'«Introduction à la logique» المدخل المنطقي de Fakhr ed-Dîn Ar-Râzî, comme s'exprime le commentateur, voir Hadji Khalifa, n° 1508. 'Abd el-Hamid mourut en 655 de l'Hégire (1257 ap. J.-Ch.). La copie est datée de 669 de l'Hégire (1270 ap. J.-Ch.). Commencement: الحمد لله الواحد الاجل الفرد الصمد الخ. \nPapier. Écriture Asiatique. 112 feuillets. 23 lignes en moyenne par page."
    },
    {
        "title": "كتاب العوامل",
        "author": "Sirâdj ed-Din Mahmoud ibn Yousouf de Herat",
        "author_date_hijri": "",
        "author_date_CE": "",
        "title_of_original_text_commented_upon": "",
        "author_of_original_text_commented_upon": "",
        "date_of_author_of_original_text_commented_upon_hijri": "",
        "date_of_author_of_original_text_commented_upon_CE": "",
        "date_of_original_text_commented_upon_hijri": "",
        "date_of_original_text_commented_upon_CE": "",
        "date_of_copying_hijri": "628",
        "date_of_copying_CE": "1230",
        "date_of_printing_hijri": "",
        "date_of_printing_CE": "",
        "place_of_printing": "",
        "incipit": "الحمد لله حق حمده الخ",
        "explicit": "",
        "material": "Papier",
        "script": "Asiatique",
        "number_of_folios": 112,
        "layaout_or_lines_per_page": 23,
        "text": "1° Title au fo. 1 r°: .... كتاب الملقب بالذخائر تصنيف الامام أبي الحسن على بن محمد النحوى الهروى «Livre sunommé: Les trésors réservés, œuvre de l'imâm ..... Aboû 'l-Hasan ‘Alî ibn Mohammad le grammairien, connu sous le nom d'AlHarawi.» Malgré ce titre (cf. Hâdjî Khalîfa, nº 5773), il est certain que nous avons ici l'opuscule de l'auteur, intitulé الازهرية, dans lequel Al-Harawî, d'après Ḥâdjî Khalîfa, n° 558, aurait mis en ordre ce qu'il avait disséminé dans ses «Trésors réservés». Voici en effet notre commencement سألتني ايدك الله ان اجمع لك ابوابا من النحو قد ذكرناها متفرقة في كتابنا الملقب بالذخائر الخ. Copie date de de l'Hégire (1366 ap. J.-Ch.).\n2° (Fol. 48 r°) Titre: كتاب العوامل «Livre des régents grammaticaux», par Sirâdj ed-Din Mahmoud ibn Yousouf de Herat (الهروى). Copie datée de 628 de l'Hégire (1230 ap J-Ch). Commencement: الحمد لله حق حمده الخ\n3° (Fol. 52 r°) Titre: كتاب شرح الآيات البينات تصنيف السعيد فخر الدين محمد بن عمر الرازى شرح السعيد عن الدين عبد الحميد بن ابى الحديد. «Livre intitulé: Commentaire sur les Signes évidents, oeuvre du défunt Fakhr ed-Din Mohammad ibn Omar Ar-Râzî; commentaire par le défunt' Izz ed-Dîn'Abd el-Hamîd ibn Abt 'l-Hadid.» Sur l'«Introduction à la logique» المدخل المنطقي de Fakhr ed-Dîn Ar-Râzî, comme s'exprime le commentateur, voir Hadji Khalifa, n° 1508. 'Abd el-Hamid mourut en 655 de l'Hégire (1257 ap. J.-Ch.). La copie est datée de 669 de l'Hégire (1270 ap. J.-Ch.). Commencement: الحمد لله الواحد الاجل الفرد الصمد الخ. \nPapier. Écriture Asiatique. 112 feuillets. 23 lignes en moyenne par page."
    },
    {
        "title": "كتاب شرح الآيات البينات",
        "author": "السعيد فخر الدين محمد بن عمر الرازى",
        "author_date_hijri": "655",
        "author_date_CE": "1257",
        "title_of_original_text_commented_upon": "المدخل المنطقي",
        "author_of_original_text_commented_upon": "Fakhr ed-Dîn Ar-Râzî",
        "date_of_author_of_original_text_commented_upon_hijri": "",
        "date_of_author_of_original_text_commented_upon_CE": "",
        "date_of_original_text_commented_upon_hijri": "",
        "date_of_original_text_commented_upon_CE": "",
        "date_of_copying_hijri": "669",
        "date_of_copying_CE": "1270",
        "date_of_printing_hijri": "",
        "date_of_printing_CE": "",
        "place_of_printing": "",
        "incipit": "الحمد لله الواحد الاجل الفرد الصمد الخ",
        "explicit": "",
        "material": "Papier",
        "script": "Asiatique",
        "number_of_folios": 112,
        "layaout_or_lines_per_page": 23,
        "text": "1° Title au fo. 1 r°: .... كتاب الملقب بالذخائر تصنيف الامام أبي الحسن على بن محمد النحوى الهروى «Livre sunommé: Les trésors réservés, œuvre de l'imâm ..... Aboû 'l-Hasan ‘Alî ibn Mohammad le grammairien, connu sous le nom d'AlHarawi.» Malgré ce titre (cf. Hâdjî Khalîfa, nº 5773), il est certain que nous avons ici l'opuscule de l'auteur, intitulé الازهرية, dans lequel Al-Harawî, d'après Ḥâdjî Khalîfa, n° 558, aurait mis en ordre ce qu'il avait disséminé dans ses «Trésors réservés». Voici en effet notre commencement سألتني ايدك الله ان اجمع لك ابوابا من النحو قد ذكرناها متفرقة في كتابنا الملقب بالذخائر الخ. Copie date de de l'Hégire (1366 ap. J.-Ch.).\n2° (Fol. 48 r°) Titre: كتاب العوامل «Livre des régents grammaticaux», par Sirâdj ed-Din Mahmoud ibn Yousouf de Herat (الهروى). Copie datée de 628 de l'Hégire (1230 ap J-Ch). Commencement: الحمد لله حق حمده الخ\n3° (Fol. 52 r°) Titre: كتاب شرح الآيات البينات تصنيف السعيد فخر الدين محمد بن عمر الرازى شرح السعيد عن الدين عبد الحميد بن ابى الحديد. «Livre intitulé: Commentaire sur les Signes évidents, oeuvre du défunt Fakhr ed-Din Mohammad ibn Omar Ar-Râzî; commentaire par le défunt' Izz ed-Dîn'Abd el-Hamîd ibn Abt 'l-Hadid.» Sur l'«Introduction à la logique» المدخل المنطقي de Fakhr ed-Dîn Ar-Râzî, comme s'exprime le commentateur, voir Hadji Khalifa, n° 1508. 'Abd el-Hamid mourut en 655 de l'Hégire (1257 ap. J.-Ch.). La copie est datée de 669 de l'Hégire (1270 ap. J.-Ch.). Commencement: الحمد لله الواحد الاجل الفرد الصمد الخ. \nPapier. Écriture Asiatique. 112 feuillets. 23 lignes en moyenne par page."
    },
    {
        "title": "النصف الاول من كتاب شمس العلوم ودواء كلام العرب من الكلوم صحيح التأليف والأمان من التصحيف",
        "author": "صفى المجد ابي الحسن نشوان بن سعيد الحميرى",
        "author_date_hijri": "573",
        "author_date_CE": "1177",
        "title_of_original_text_commented_upon": "",
        "author_of_original_text_commented_upon": "",
        "date_of_author_of_original_text_commented_upon_hijri": "",
        "date_of_author_of_original_text_commented_upon_CE": "",
        "date_of_original_text_commented_upon_hijri": "",
        "date_of_original_text_commented_upon_CE": "",
        "date_of_copying_hijri": "626",
        "date_of_copying_CE": "1228",
        "date_of_printing_hijri": "",
        "date_of_printing_CE": "",
        "place_of_printing": "",
        "incipit": "بسم الله الواحد القديم، القادر العظيم الخ",
        "explicit": "",
        "material": "Papier",
        "script": "Asiatique",
        "number_of_folios": 253,
        "layaout_or_lines_per_page": "27 à 34",
        "text": "Titre: النصف الاول من كتاب شمس العلوم ودواء كلام العرب من الكلوم صحيح التأليف والأمان من التصحيف تأليف القاضي الجليل صفى المجد ابي الحسن نشوان بن سعيد الحميرى علامة اليمن بخط مالكه .... جمهور بن على بن جمهور بن زيد الهمداني. «Première moitié du livre intitude: Le soleil des sciences et l'art de guérir le langage des Arabes des blessures; composition saine et à l'abri de l'erreur, par l'illustre ķâdî, dont la gloire est pure, Aboû 'l-Ḥasan Naschwân ibn Sa'id l'Himyarite, le grand savant du Yémen. Copie faite par son possesseur Djoumhoûr ibn 'Alî ibn Djoumhoûr ibn Zaid Al-Hamadânî.» Cette copie, entièrement vocalisée, a été collationnée avec l'original de l'auteur et, à deux reprises, après le premier et le second quart de l'ouvrage; elle est datée de 626 de l'Hégire (1228 ap. J.-Ch.). La première moitié contient les lettres depuis l'alif jusqu'au schîn; le complément, depuis le sad, forme le second volume du même exemplaire et sera décrit plus loin comme manuscrit 603 (Casiri, 600). L'auteur de ce dictionnaire très original, qui n'est pas un Onomasticon, mourut en 573 de l'Hégire (1177 ap. J.-Ch.). Ce que Casiri a pris pour un premier ouvrage sont les prolégomènes grammaticaux, commençant par بسم الله الواحد القديم، القادر العظيم الخ. M. D. H. Müller, professeur à Vienne, qui, dans ses divers écrits relatifs à l'antiquité sabéenne, cite de nombreux extraits du Dictionnaire de Naschwân, en prépare une édition complète d'après le manuscrit de Berlin.\nPapier. Écriture Asiatique. 253 feuillets. De 27 à 34 lignes par page."
    },
    {
        "title": "كتاب الروض الانسم فى معاني حروف المعجم",
        "author": "احمد بن محمد من على بن ويغلان بن نماری بن مونس البجائى",
        "author_date_hijri": "",
        "author_date_CE": "",
        "title_of_original_text_commented_upon": "",
        "author_of_original_text_commented_upon": "",
        "date_of_author_of_original_text_commented_upon_hijri": "",
        "date_of_author_of_original_text_commented_upon_CE": "",
        "date_of_original_text_commented_upon_hijri": "",
        "date_of_original_text_commented_upon_CE": "",
        "date_of_copying_hijri": "",
        "date_of_copying_CE": "",
        "date_of_printing_hijri": "",
        "date_of_printing_CE": "",
        "place_of_printing": "",
        "incipit": "الحمد لله الذى بسط الامل بعد القبض المخوف الخ",
        "explicit": "",
        "material": "Papier",
        "script": "Magrébine",
        "number_of_folios": 48,
        "layaout_or_lines_per_page": 11,
        "text": "Titre: كتاب الروض الانسم فى معاني حروف المعجم. «Livre in titulé: Le jardin embaumé; des sens des lettres de l'alphabet.» L'auteur est nommé احمد بن محمد من على بن ويغلان بن نماری بن مونس البجائى. Casiri a donné de ce livre des extraits suffisants pour montrer combien ces interprétations détournées des lettres présentent peu d'intérêt. Le manuscrit est écrit avec un soin et un luxe d'espacements, qui en font une merveille calligraphique. Commencement: الحمد لله الذى بسط الامل بعد القبض المخوف الخ.\nPapier. Écriture Magrébine. 48 feuillets. 11 lignes par page. Il doit manquer à la fin un feuillet seulement, celui qui contenait la date."
    },
    {
        "title": "Commentaire d'Abou 'Ali 'Omar ibn Mohammad ibn ‘Omar ibn 'Abd Allah Al-Azdî sur المقدمة الجزولية «Introduction à la grammaire, par Al-Djouzoûlî»",
        "author": "Abou 'Ali 'Omar ibn Mohammad ibn ‘Omar ibn 'Abd Allah Al-Azdî",
        "author_date_hijri": "562",
        "author_date_CE": "1166",
        "title_of_original_text_commented_upon": "المقدمة الجزولية «Introduction à la grammaire»",
        "author_of_original_text_commented_upon": "Al-Djouzoûlî",
        "date_of_author_of_original_text_commented_upon_hijri": "",
        "date_of_author_of_original_text_commented_upon_CE": "",
        "date_of_original_text_commented_upon_hijri": "",
        "date_of_original_text_commented_upon_CE": "",
        "date_of_copying_hijri": "622",
        "date_of_copying_CE": "1225",
        "date_of_printing_hijri": "",
        "date_of_printing_CE": "",
        "place_of_printing": "Séville",
        "incipit": "",
        "explicit": "",
        "material": "Papier",
        "script": "Magrébine",
        "number_of_folios": 103,
        "layaout_or_lines_per_page": 23,
        "text": "Commentaire d'Abou 'Ali 'Omar ibn Mohammad ibn ‘Omar ibn 'Abd Allah Al-Azdî sur المقدمة الجزولية «Introduction à la grammaire, par Al-Djouzoûlî», c'est-à-dire par Abou Mousa 'Isa ibn 'Abd el-'Azîz Al-Djouzofilf (cf. ms. 2). Le commentateur, né en 562 de l'Hégire (1166 ap. J.-Ch.), mort en 645 (1247 ap. J.-Ch.), est nommé à la fin (fol. 103 v°).\nSon nom se trouvait également sur le titre, dont la moitié, coupée par le milieu du haut en bas, nous a été conservée comme fol. 3. Après الازدي, on peut encore y lire عُرف (sic) بالشلوبين. C'est au verso de ce même fol. que se trouve le nom d' ابو موسى الجزولى, qui a permis de fixer le contenu du manuscrit; on y parle aussi de المقدمة المذكورة. Si, par impossible, ce n'est pas le manuscrit autographe de l'auteur, en tout cas cet exemplaire a été écrit dans l'année même où la composition a été terminée d'après le manuscrit 190, fol. 1 v°: cette copie, qui est dans le plus grand désordre, a été faite à Séville en 622 de l'Hégire (1225 ap. J.-Ch.). Ce doit être le plus court des deux commentaires composés par Schaloûbînî, tandis que le manuscrit 2 est un volume du commentaire développé. Cf. Ḥâdjî Khalîfa, VI, p. 80.\nPapier. Écriture Magrébine. 103 feuillets. 23 lignes par page."
    },
    {
        "title": "المزهر في علوم اللغة «Le lath; des sciences du langage.»",
        "author": "Soyoûtî",
        "author_date_hijri": "",
        "author_date_CE": "",
        "title_of_original_text_commented_upon": "",
        "author_of_original_text_commented_upon": "",
        "date_of_author_of_original_text_commented_upon_hijri": "",
        "date_of_author_of_original_text_commented_upon_CE": "",
        "date_of_original_text_commented_upon_hijri": "",
        "date_of_original_text_commented_upon_CE": "",
        "date_of_copying_hijri": "",
        "date_of_copying_CE": "",
        "date_of_printing_hijri": "1282",
        "date_of_printing_CE": "1865",
        "place_of_printing": "Boûlâķ",
        "incipit": "",
        "explicit": "",
        "material": "Papier",
        "script": "Asiatique",
        "number_of_folios": 257,
        "layaout_or_lines_per_page": 27,
        "text": "\nالمزهر في علوم اللغة «Le lath; des sciences du langage.» C'est le fameux ouvrage de Soyoûtî, publié à Boûlâķ en 1282 de l'Hégire (1865 ap. J.-Ch.).\nPapier. Écriture Asiatique. 257 feuillets. 27 lignes par page. Sans date."
    },
    {
        "title": "كتاب همع الهوامع في شرح جمع الجوامع للشيخ ..... جلال الدين السيوطي",
        "author": "جلال الدين السيوطي",
        "author_date_hijri": "",
        "author_date_CE": "",
        "title_of_original_text_commented_upon": "جمع الجوامع",
        "author_of_original_text_commented_upon": "غير précisé",
        "date_of_author_of_original_text_commented_upon_hijri": "",
        "date_of_author_of_original_text_commented_upon_CE": "",
        "date_of_original_text_commented_upon_hijri": "",
        "date_of_original_text_commented_upon_CE": "",
        "date_of_copying_hijri": "",
        "date_of_copying_CE": "",
        "date_of_printing_hijri": "",
        "date_of_printing_CE": "",
        "place_of_printing": "",
        "incipit": "سبحانك لا احصى ثنا عليك انت كا اثنيت على نفسك الخ",
        "explicit": "",
        "material": "Papier",
        "script": "Asiatique",
        "number_of_folios": 296,
        "layaout_or_lines_per_page": 34,
        "text": "Titre: كتاب همع الهوامع في شرح جمع الجوامع للشيخ ..... جلال الدين السيوطي ..... «Livre intitulé: Les larmes répandues; commentaire sur Les collections formées; par le schaikh ...... Djalal ed-Din As-Soyoûtt.» Texte et commentaire sont de Soyoûtî; l'un et l'autre sont relatifs à la grammaire. Cf Hadji Khalifa, n° 4666. Au fol. 1 v°, l'auteur est nommé plus complètement: جلال الدين عبد الرحمن بن ابى بكر السيوطى الشافعي Commencement: سبحانك لا احصى ثنا عليك انت كا اثنيت على نفسك الخ.\nPapier. Écriture Asiatique. 296 feuillets. 34 lignes par page. Sans date."
    },
    {
        "title": "Commentaire sur le même ouvrage",
        "author": "",
        "author_date_hijri": "",
        "author_date_CE": "",
        "title_of_original_text_commented_upon": "",
        "author_of_original_text_commented_upon": "",
        "date_of_author_of_original_text_commented_upon_hijri": "",
        "date_of_author_of_original_text_commented_upon_CE": "",
        "date_of_original_text_commented_upon_hijri": "",
        "date_of_original_text_commented_upon_CE": "",
        "date_of_copying_hijri": "990",
        "date_of_copying_CE": "1582",
        "date_of_printing_hijri": "",
        "date_of_printing_CE": "",
        "place_of_printing": "",
        "incipit": "",
        "explicit": "",
        "material": "Papier",
        "script": "Asiatique",
        "number_of_folios": 279,
        "layaout_or_lines_per_page": 35,
        "text": "Autre exemplaire du même commentaire sur le même ouvrage. Copie faite en 990 de l'Hégire (1582 ap. J.-Ch.).\nPapier. Écriture Asiatique. 279 feuillets. 35 lignes par page."
    },
    {
        "title": "كتاب الاشباه والنظائر",
        "author": "جلال الدين السيوطى الشافعى",
        "author_date_hijri": "",
        "author_date_CE": "",
        "title_of_original_text_commented_upon": "",
        "author_of_original_text_commented_upon": "",
        "date_of_author_of_original_text_commented_upon_hijri": "",
        "date_of_author_of_original_text_commented_upon_CE": "",
        "date_of_original_text_commented_upon_hijri": "",
        "date_of_original_text_commented_upon_CE": "",
        "date_of_copying_hijri": "985",
        "date_of_copying_CE": "1577",
        "date_of_printing_hijri": "",
        "date_of_printing_CE": "",
        "place_of_printing": "",
        "incipit": "سبحان الله المنزه عن الاشباه والنظائر الخ",
        "explicit": "",
        "material": "Papier",
        "script": "Asiatique",
        "number_of_folios": 356,
        "layaout_or_lines_per_page": 31,
        "text": "Titre orné d'arabesques: كتاب الاشباه والنظائر تأليف الشيخ جلال الدين السيوطى الشافعى «Livre intitulé: Les ressemblances et les analogies, oeuvre du schaikh Djalâl ed-Dîn As-Soyoûtî Asch-Schâfi'î.» Sur les divisions de ce traité grammatical, voir Ḥâdjî Khalîfa, n° 776. Copie datée de 985 de l'Hégire (1577 ap. J.-Ch.) Commencement: سبحان الله المنزه عن الاشباه والنظائر الخ.\nPapier. Écriture Asiatique. 356 feuillets. 31 lignes par page."
    },
    {
        "title": "النكت للجلال «Les observations fines d'Al-Djalâl»",
        "author": "جلال الدين عبد الرحمن نجل الشيخ ... کمال الدين ابى بكر السيوطي الشافعي",
        "author_date_hijri": "",
        "author_date_CE": "",
        "title_of_original_text_commented_upon": "",
        "author_of_original_text_commented_upon": "",
        "date_of_author_of_original_text_commented_upon_hijri": "",
        "date_of_author_of_original_text_commented_upon_CE": "",
        "date_of_original_text_commented_upon_hijri": "",
        "date_of_original_text_commented_upon_CE": "",
        "date_of_copying_hijri": "913",
        "date_of_copying_CE": "1507",
        "date_of_printing_hijri": "",
        "date_of_printing_CE": "",
        "place_of_printing": "",
        "incipit": "اما بعد حمد الله على نعمه الكافيه ...... فهذه نكت حررتها على كتب في علم العربية ......",
        "explicit": "",
        "material": "Papier",
        "script": "Asiatique",
        "number_of_folios": 187,
        "layaout_or_lines_per_page": 31,
        "text": "النكت للجلال «Les observations fines d'Al-Djalâl». Ainsi est donné le titre à la tranche inférieure. L'auteur est nommé au fol 1° جلال الدين عبد الرحمن نجل الشيخ ... کمال  الدين ابى بكر السيوطي الشافعي. «Les observations fines» de Soyoûttî se rapportent à cinq ouvrages de grammaire, comme il ressort de la note suivante que nous donnons avec le commencement: اما بعد حمد الله على نعمه الكافيه ...... فهذه نكت حررتها على كتب في علم العربية ...... وهي الخلاصة لابن مالك المشهورة بالالفية والكافية لابن الحاجب والشافية له وشذور الذهب لابن هشام ونزهة الطرف في علم الصرف له الخ. Au fol. 187 r°, l'anteur raconte qu'il a com Au mencé à composer ce livre en 867 de l'Hégire (1462 ap. J.-Ch.) pour le  reprendre en 876 et 885 et pour le terminer enfin en 895 (1489 ap. J.-Ch.). Notre copie est datée de 913 de l'Hégire (1507 ap. J.-Ch.).\nPapier. Écriture Asiatique. 187 feuillets. 31 lignes par page."
    },
    {
        "title": "سفر فيه كتاب الايضاح فى النحو تأليف ابى على الحسن بن احمد ابن عبد الغفار الفارسى الثموى",
        "author": "Abou 'Ali Hasan ibn Ahmad ibn 'Abd el-Gaffar Al-Farist Ath-Thamawî",
        "author_date_hijri": "377",
        "author_date_CE": "987",
        "title_of_original_text_commented_upon": "L'exposition grammaticale",
        "author_of_original_text_commented_upon": "",
        "date_of_author_of_original_text_commented_upon_hijri": "",
        "date_of_author_of_original_text_commented_upon_CE": "",
        "date_of_original_text_commented_upon_hijri": "",
        "date_of_original_text_commented_upon_CE": "",
        "date_of_copying_hijri": "605",
        "date_of_copying_CE": "1208",
        "date_of_printing_hijri": "",
        "date_of_printing_CE": "",
        "place_of_printing": "",
        "incipit": "الحمد لله رب العلمين الخ",
        "explicit": "",
        "material": "Papier",
        "script": "Magrébine",
        "number_of_folios": 126,
        "layaout_or_lines_per_page": 23,
        "text": "Titre: سفر فيه كتاب الايضاح فى النحو تأليف ابى على الحسن بن احمد ابن عبد الغفار الفارسى الثموى (sic). «Volume contenant le livre intitulé: L'exposition grammaticale, oeuvre d'Abou 'Ali Hasan ibn Ahmad ibn 'Abd el-Gaffar Al-Farist Ath-Thamawî (?).» Casiri a lu ce dernier mot As-Samawî; peut-être faut-il lire النحوى «le grammairien» avec Hadji Khalifa, n° 1564 et avec le titre du manuscrit 125. Le manuscrit 194 porte Al-Fasawî. Cet ouvrage, dont l'auteur mourut en 377 de l'Hégire (987 ap. J.-Ch.), contient des chapitres sur la langue arabe (ابوابا من العربية, fol. 1 v°) et a été composé pour le Boûyide عضد الدولة. La copie, qui est complete, est de 605 de l'Hégire (1208 ap. J.-Ch.). Commencement: الحمد لله رب العلمين الخ.\nPapier. Écriture Magrébine. 126 feuillets. 23 lignes par page."
    },
    {
        "title": "Autre exemplaire du même ouvrage",
        "author": "",
        "author_date_hijri": "",
        "author_date_CE": "",
        "title_of_original_text_commented_upon": "",
        "author_of_original_text_commented_upon": "",
        "date_of_author_of_original_text_commented_upon_hijri": "",
        "date_of_author_of_original_text_commented_upon_CE": "",
        "date_of_original_text_commented_upon_hijri": "",
        "date_of_original_text_commented_upon_CE": "",
        "date_of_copying_hijri": "698",
        "date_of_copying_CE": "1298",
        "date_of_printing_hijri": "",
        "date_of_printing_CE": "",
        "place_of_printing": "",
        "incipit": "",
        "explicit": "",
        "material": "Papier",
        "script": "Magrébine",
        "number_of_folios": 125,
        "layaout_or_lines_per_page": 20,
        "text": "Autre exemplaire du même ouvrage. En tête, une lacune de cinq feuillets environ; à la fin, la date de 698 de l'Hégire (1298 ap. J.-Ch.), sans que je sois bien sûr de ma lecture.\nPapier. Écriture Magrébine. 125 feuillets. 20 lignes par page."
    },
    {
        "title": "الشافى من شرح الايضاح والتكمله",
        "author": "عبد القاهر الجرجانى",
        "author_date_hijri": "471",
        "author_date_CE": "1078",
        "title_of_original_text_commented_upon": "L'exposition et Le supplément",
        "author_of_original_text_commented_upon": "Abou Ali Hasan Al-Farisî",
        "date_of_author_of_original_text_commented_upon_hijri": "",
        "date_of_author_of_original_text_commented_upon_CE": "",
        "date_of_original_text_commented_upon_hijri": "",
        "date_of_original_text_commented_upon_CE": "",
        "date_of_copying_hijri": "604",
        "date_of_copying_CE": "1207",
        "date_of_printing_hijri": "",
        "date_of_printing_CE": "",
        "place_of_printing": "Damas",
        "incipit": "الحمد لله رب العالمين الذي جعل حمده فاتحة كتابه وخاتمة دعوى اوليائه الخ",
        "explicit": "",
        "material": "Papier",
        "script": "Asiatique",
        "number_of_folios": 337,
        "layaout_or_lines_per_page": 21,
        "text": "Titre: الشافى من شرح الايضاح والتكمله (sic) تأليف عبد القاهر الجرجانى. «Le réconfortant; commentaire sur L'exposition et Le supplément, œuvre de Abd el-Ḳâhir Al-Djordjânî.» A la fin, l'auteur est nommé plus complètement ابو بكر عبد القاهر ابن عبد الرحمن الجرجاني; il mourut en 471 de l'Hégire (1078 ap J.-Ch.). Les deux traités nommés dans le titre sont tous deux d'Abou Ali Hasan Al-Farisî. (Cf. mss. 42 et 43 qui contiennent le premier.) Le commentateur est l'auteur bien connu des Cent régents (voir manuscrit 6, 1°, etc.). La copie, faite à Damas, est datée de 604 de l'Hégire (1207 ap. J.-Ch.). Commencement: الحمد لله رب العالمين الذي جعل حمده فاتحة كتابه وخاتمة دعوى اوليائه الخ.\nPapier. Écriture Asiatique. 337 feuillets. 21 lignes par page."
    },
    {
        "title": "كتاب ايضاح شواهد الايضاح للقيسى",
        "author": "Al-Ḳaisî",
        "author_date_hijri": "567",
        "author_date_CE": "1171",
        "title_of_original_text_commented_upon": "كتاب الايضاح",
        "author_of_original_text_commented_upon": "",
        "date_of_author_of_original_text_commented_upon_hijri": "",
        "date_of_author_of_original_text_commented_upon_CE": "",
        "date_of_original_text_commented_upon_hijri": "",
        "date_of_original_text_commented_upon_CE": "",
        "date_of_copying_hijri": "633",
        "date_of_copying_CE": "1235",
        "date_of_printing_hijri": "",
        "date_of_printing_CE": "",
        "place_of_printing": "",
        "incipit": "الحمد لله العظيم السلطين (sic) القديم الاحسان الخ",
        "explicit": "",
        "material": "Papier",
        "script": "Magrébine",
        "number_of_folios": 197,
        "layaout_or_lines_per_page": 23,
        "text": "Titre: كتاب ايضاح شواهد الايضاح للقيسى «Livre intitulé: Explication des vers cités comme exemples dans l'Iḍâḥ (Exposition) par Al-Ḳaisî.» Le nom de l'auteur est donné plus completement au fol. 1 v° ابو على حسن بن عبد الله القيسي المبى. Pour le كتاب الايضاح, qui ser de texte au commentaire, on lit dans le nom de l'auteur, après الفارسي, le mot الفسوي (cf. notre description du ms. 42). Al-Ḳaisî mourut en 567 de l'Hégire (1171 ap. J.-Ch.), d'après Ḥâdjî Khalifa, I, p. 514. Copie datée de 633 de l'Hégire (1235 ap. J.-Ch.). Commencement: الحمد لله العظيم السلطين (sic) القديم الاحسان الخ.\nPapier. Écriture Magrébine. 197 feuillets. 23 lignes par page."
    },
    {
        "title": "كتاب الرد على الزبيدى فى لحن العوام لابن هشام",
        "author": "Ibn Hischâm",
        "author_date_hijri": "",
        "author_date_CE": "",
        "title_of_original_text_commented_upon": "",
        "author_of_original_text_commented_upon": "",
        "date_of_author_of_original_text_commented_upon_hijri": "",
        "date_of_author_of_original_text_commented_upon_CE": "",
        "date_of_original_text_commented_upon_hijri": "379",
        "date_of_original_text_commented_upon_CE": "989",
        "date_of_copying_hijri": "VII",
        "date_of_copying_CE": "",
        "date_of_printing_hijri": "",
        "date_of_printing_CE": "",
        "place_of_printing": "",
        "incipit": "الحمد لله قبل كل مقال الخ",
        "explicit": "",
        "material": "Papier",
        "script": "Magrébine",
        "number_of_folios": 72,
        "layaout_or_lines_per_page": 27,
        "text": "Titre: كتاب الرد على الزبيدى فى لحن العوام لابن هشام. «Livre in  titulé: La réfutation de Az-Zobaidî au sujet de la fausse prononciation du bas peuple, par Ibn Hischâm.» L'auteur de la réfutation est nommé plus complètement au fol. 1 v° ابو عبد الله محمد بن احمد بن هشام; l'auteur réfute ابو بكر محمد بن حسن الزبيدي. En dehons des opinions d'Az-Zobaidî, mort en 379 de l'Hégire (989 ap. J.-Ch.), Ibn Hischâm s'est attaqué aux اوهام ابن مكى فى كتاب (sic)المستمى بتثقيف اللسان وتلقيح الجبان (sic, lisez الجنان); de plus il a exprimé nombre d'asser ions personnelles, sans les rattacher à aucune critique ni de l'un ni de l'autre. Je n'ai rencontre le nom d' ابن المكي et de son ouvrage mentionné que dans Ibn Khallikân, Biographical Dictionary, trad. de Slane, I, p. 435; cf. note 16, p. 439. Le manuscrit 99 contient un autre exemplaire de ce même ouvrage, avec un titre absolument différent. Commencement: الحمد لله قبل كل مقال الخ\nPapier. Écriture Magrébine. 72 feuillets. 27 lignes par page. Sans date. Manuscrit vocalisé du VII siècle de l'Hégire.\n"
    },
    {
        "title": "Commentaire d'Ibn Hischâm sur son opuscule grammatical, intitulé قطر الندى وبلّ الصدى «La pluie qui dégoutte et la soif étanchée.»",
        "author": "Ibn Hischâm",
        "author_date_hijri": "761",
        "author_date_CE": "1359",
        "title_of_original_text_commented_upon": "قطر الندى وبلّ الصدى",
        "author_of_original_text_commented_upon": "Ibn Hischâm",
        "date_of_author_of_original_text_commented_upon_hijri": "",
        "date_of_author_of_original_text_commented_upon_CE": "",
        "date_of_original_text_commented_upon_hijri": "",
        "date_of_original_text_commented_upon_CE": "",
        "date_of_copying_hijri": "974",
        "date_of_copying_CE": "1566",
        "date_of_printing_hijri": "1281",
        "date_of_printing_CE": "1864",
        "place_of_printing": "Tunis",
        "incipit": "الحمد لله رافع الدرجات لمن انخفض لجلاله ...... وبعد فهذه نكت حررتها على مقدمتى المسماة بقطر الندى وبل الصدى الخ",
        "explicit": "",
        "material": "Papier",
        "script": "Magrébine",
        "number_of_folios": 271,
        "layaout_or_lines_per_page": "22 et 23",
        "text": "1° Commentaire d'Ibn Hischâm sur son opuscule grammatical, intitulé قطر الندى وبلّ الصدى «La pluie qui dégoutte et la soif étanchée.» Il ne faut pas confondre Ibn Hischâm, auteur ici du texte et du commentaire, avec son homonyme, dont nous avons l'oeuvre dans le manuscrit 46 et qui vivait à la fin du VI siècle de l'Hégire. Ici, nous avons à faire à ابو محمد جمال الدين عبد الله بن هشام المصرى, mort en 761 ou 762 de l'Hégire (1359 ou 1360 ap. J.-Ch.). Copie datée de 974 de l'Hégire (1566 ap. J.-Ch.). Des gloses à ce commentaire ont été lithographiées au Caire en 1274 de l'Hégire (1857 ap. J.-Ch.); il a été imprimé à Tunis en 1281 (1864 ap. J.-Ch.). Commencement: الحمد لله رافع الدرجات لمن انخفض لجلاله ...... وبعد فهذه نكت حررتها على مقدمتى المسماة بقطر الندى وبل الصدى الخ\n2° (Fol. 109) Commentaire du même auteur sur son traité de grammaire intitule شذور الذهب. «Les parcelles d'or.» Commencement: اول ما اقول انى احمد الله العلى الكريم ...... فهذا كتاب شرحت به مختصري المسمى بشذور الذهب في معرفة كلام العرب الخ. Ce commentaire a été imprimé à Boûlak en 1253 de l'Hégire (1837 ap. J.-Ch.) et au Caire en 1289 (1873 ap. J.-Ch.).\n3° (Fol. 177) Commentaire du même auteur sur l'Alfiyya d'Ibn Mâlik, intitulé اوضح المسالك الى الفية ابن مالك. Nous avons déjà vu un autre exemplaire (ms. 7, 2°). Copie terminée بمدينة مراكش en 974 de l'Hégire (1566 ap. J-Ch.).\nPapier. Écriture Magrébine. 271 feuillets. 22 et 23 lignes par page. Trois traités écrits d'une même main.\n"
    },
    {
        "title": "Commentaire du même auteur sur son traité de grammaire intitule شذور الذهب. «Les parcelles d'or.»",
        "author": "Ibn Hischâm",
        "author_date_hijri": "761",
        "author_date_CE": "1359",
        "title_of_original_text_commented_upon": "شذور الذهب",
        "author_of_original_text_commented_upon": "Ibn Hischâm",
        "date_of_author_of_original_text_commented_upon_hijri": "",
        "date_of_author_of_original_text_commented_upon_CE": "",
        "date_of_original_text_commented_upon_hijri": "",
        "date_of_original_text_commented_upon_CE": "",
        "date_of_copying_hijri": "",
        "date_of_copying_CE": "",
        "date_of_printing_hijri": "1289",
        "date_of_printing_CE": "1873",
        "place_of_printing": "Caire",
        "incipit": "اول ما اقول انى احمد الله العلى الكريم ...... فهذا كتاب شرحت به مختصري المسمى بشذور الذهب في معرفة كلام العرب الخ",
        "explicit": "",
        "material": "Papier",
        "script": "Magrébine",
        "number_of_folios": 271,
        "layaout_or_lines_per_page": "22 et 23",
        "text": "1° Commentaire d'Ibn Hischâm sur son opuscule grammatical, intitulé قطر الندى وبلّ الصدى «La pluie qui dégoutte et la soif étanchée.» Il ne faut pas confondre Ibn Hischâm, auteur ici du texte et du commentaire, avec son homonyme, dont nous avons l'oeuvre dans le manuscrit 46 et qui vivait à la fin du VI siècle de l'Hégire. Ici, nous avons à faire à ابو محمد جمال الدين عبد الله بن هشام المصرى, mort en 761 ou 762 de l'Hégire (1359 ou 1360 ap. J.-Ch.). Copie datée de 974 de l'Hégire (1566 ap. J.-Ch.). Des gloses à ce commentaire ont été lithographiées au Caire en 1274 de l'Hégire (1857 ap. J.-Ch.); il a été imprimé à Tunis en 1281 (1864 ap. J.-Ch.). Commencement: الحمد لله رافع الدرجات لمن انخفض لجلاله ...... وبعد فهذه نكت حررتها على مقدمتى المسماة بقطر الندى وبل الصدى الخ\n2° (Fol. 109) Commentaire du même auteur sur son traité de grammaire intitule شذور الذهب. «Les parcelles d'or.» Commencement: اول ما اقول انى احمد الله العلى الكريم ...... فهذا كتاب شرحت به مختصري المسمى بشذور الذهب في معرفة كلام العرب الخ. Ce commentaire a été imprimé à Boûlak en 1253 de l'Hégire (1837 ap. J.-Ch.) et au Caire en 1289 (1873 ap. J.-Ch.).\n3° (Fol. 177) Commentaire du même auteur sur l'Alfiyya d'Ibn Mâlik, intitulé اوضح المسالك الى الفية ابن مالك. Nous avons déjà vu un autre exemplaire (ms. 7, 2°). Copie terminée بمدينة مراكش en 974 de l'Hégire (1566 ap. J-Ch.).\nPapier. Écriture Magrébine. 271 feuillets. 22 et 23 lignes par page. Trois traités écrits d'une même main.\n"
    },
    {
        "title": "Commentaire du même auteur sur l'Alfiyya d'Ibn Mâlik, intitulé اوضح المسالك الى الفية ابن مالك.",
        "author": "Ibn Hischâm",
        "author_date_hijri": "761",
        "author_date_CE": "1359",
        "title_of_original_text_commented_upon": "الفية ابن مالك",
        "author_of_original_text_commented_upon": "Ibn Mâlik",
        "date_of_author_of_original_text_commented_upon_hijri": "",
        "date_of_author_of_original_text_commented_upon_CE": "",
        "date_of_original_text_commented_upon_hijri": "",
        "date_of_original_text_commented_upon_CE": "",
        "date_of_copying_hijri": "974",
        "date_of_copying_CE": "1566",
        "date_of_printing_hijri": "",
        "date_of_printing_CE": "",
        "place_of_printing": "",
        "incipit": "",
        "explicit": "",
        "material": "Papier",
        "script": "Magrébine",
        "number_of_folios": 271,
        "layaout_or_lines_per_page": "22 et 23",
        "text": "1° Commentaire d'Ibn Hischâm sur son opuscule grammatical, intitulé قطر الندى وبلّ الصدى «La pluie qui dégoutte et la soif étanchée.» Il ne faut pas confondre Ibn Hischâm, auteur ici du texte et du commentaire, avec son homonyme, dont nous avons l'oeuvre dans le manuscrit 46 et qui vivait à la fin du VI siècle de l'Hégire. Ici, nous avons à faire à ابو محمد جمال الدين عبد الله بن هشام المصرى, mort en 761 ou 762 de l'Hégire (1359 ou 1360 ap. J.-Ch.). Copie datée de 974 de l'Hégire (1566 ap. J.-Ch.). Des gloses à ce commentaire ont été lithographiées au Caire en 1274 de l'Hégire (1857 ap. J.-Ch.); il a été imprimé à Tunis en 1281 (1864 ap. J.-Ch.). Commencement: الحمد لله رافع الدرجات لمن انخفض لجلاله ...... وبعد فهذه نكت حررتها على مقدمتى المسماة بقطر الندى وبل الصدى الخ\n2° (Fol. 109) Commentaire du même auteur sur son traité de grammaire intitule شذور الذهب. «Les parcelles d'or.» Commencement: اول ما اقول انى احمد الله العلى الكريم ...... فهذا كتاب شرحت به مختصري المسمى بشذور الذهب في معرفة كلام العرب الخ. Ce commentaire a été imprimé à Boûlak en 1253 de l'Hégire (1837 ap. J.-Ch.) et au Caire en 1289 (1873 ap. J.-Ch.).\n3° (Fol. 177) Commentaire du même auteur sur l'Alfiyya d'Ibn Mâlik, intitulé اوضح المسالك الى الفية ابن مالك. Nous avons déjà vu un autre exemplaire (ms. 7, 2°). Copie terminée بمدينة مراكش en 974 de l'Hégire (1566 ap. J-Ch.).\nPapier. Écriture Magrébine. 271 feuillets. 22 et 23 lignes par page. Trois traités écrits d'une même main.\n"
    },
    {
        "title": "كتاب مغني اللبيب عن كتب الاعاريب",
        "author": "جمال الدين عبد الله بن يوسف بن احمد بن عبد الله بن هشام الانصارى الحنبلي",
        "author_date_hijri": "749",
        "author_date_CE": "1348",
        "title_of_original_text_commented_upon": "",
        "author_of_original_text_commented_upon": "",
        "date_of_author_of_original_text_commented_upon_hijri": "756",
        "date_of_author_of_original_text_commented_upon_CE": "1355",
        "date_of_original_text_commented_upon_hijri": "",
        "date_of_original_text_commented_upon_CE": "",
        "date_of_copying_hijri": "IX",
        "date_of_copying_CE": "",
        "date_of_printing_hijri": "1284",
        "date_of_printing_CE": "1867",
        "place_of_printing": "Boulak",
        "incipit": "اما بعد حمد اللهعلى افضاله الخ",
        "explicit": "",
        "material": "Papier",
        "script": "Magrébine",
        "number_of_folios": 165,
        "layaout_or_lines_per_page": 27,
        "text": "Titre: كتاب مغني اللبيب عن كتب الاعاريب تأليف الأمام ...... جمال الدين عبد الله بن يوسف بن احمد بن عبد الله بن هشام الانصارى الحنبلي ...... «Livre intitulé: Celui qui dispense l'homme intelligent de tout autre livre sur les flexions finales, œuvre de l'imam ..... Djamâl ed-Dîn Abd Allah ibn Yoûsouf ibn Alhmad ibn 'Abd Allah Ibn Hischâm Al-Ansari Al-Hanbali.» C'est l'auteur des trois ouvrages contenus dans le manuscrit 47. Ce livre, commencé à la Mecque en 749 de l'Hégire (1348 ap. J.-Ch.), fut terminé en 756 (1355 ap. J.-Ch.). Au fol. 1, note biographique et bibliographique, au bout de laquelle on lit au sujet de notre manuscrit ونقل من خط بعض تلامذة ولد بن هشام. Hadji Khalifa, n° 12, 496. La bibliothèque de l'Université de Strasbourg possède une lithographie de cet ouvrage sans indication de lieu ni d'année. Voir Katalog, nº 2142. Le texte a aussi été imprimé à la marge des gloses d'Ad-Dasoûkî à Boulak en 1284 de l'Hegire (1867 ap. J.-Ch.) Commencement: اما بعد حمد اللهعلى افضاله الخ.\nPapier. Écriture Magrébine. 165 feuillets. 27 lignes par page. Sans date excellent manuscrit du commencement du IX siècle de l'Hégire."
    },
    {
        "title": "Commentaire sur l'ouvrage précédent",
        "author": "تقى الدين ابو العباس احمد بن محمد الشمنى",
        "author_date_hijri": "872",
        "author_date_CE": "1467",
        "title_of_original_text_commented_upon": "مغني ابن هشام",
        "author_of_original_text_commented_upon": "Ibn Hischâm",
        "date_of_author_of_original_text_commented_upon_hijri": "",
        "date_of_author_of_original_text_commented_upon_CE": "",
        "date_of_original_text_commented_upon_hijri": "",
        "date_of_original_text_commented_upon_CE": "",
        "date_of_copying_hijri": "992",
        "date_of_copying_CE": "1584",
        "date_of_printing_hijri": "",
        "date_of_printing_CE": "",
        "place_of_printing": "",
        "incipit": "الحمد لله الذي خص كتابه بعدم المعارضة والاعجاز الخ",
        "explicit": "",
        "material": "Papier",
        "script": "Asiatique",
        "number_of_folios": 304,
        "layaout_or_lines_per_page": 33,
        "text": "Commentaire sur l'ouvrage précédent. Le titre de ce commentaire se trouve à la tranche inférieure du volume et au 1 v°. C'est المنصف من الكلام على معنى ابن هشام. Au ms. 50, le premier mot est vocalisé المُنصِف; traduisez donc: «Commentaire juste-milieu sur le Mougnî d'Ibn Hischâm.» Copie datée de 992 de l'Hégire (1584 ap. J.-Ch.). L'auteur de ce commentaire est, d'après Hadji Khalifa, V, p. 656 تقى الدين ابو العباس احمد بن محمد الشمنى, mort en 872 de l'Hégire (1467 ap. J.-Ch.). Son commentaire sur l'Alfiyya est dans le ms. 11. Commencement: الحمد لله الذي خص كتابه بعدم المعارضة والاعجاز الخ.\nPapier. Écriture Asiatique. 304 feuillets. 33 lignes par page."
    },
    {
        "title": "Le même commentaire sur le même ouvrage",
        "author": "",
        "author_date_hijri": "",
        "author_date_CE": "",
        "title_of_original_text_commented_upon": "",
        "author_of_original_text_commented_upon": "",
        "date_of_author_of_original_text_commented_upon_hijri": "",
        "date_of_author_of_original_text_commented_upon_CE": "",
        "date_of_original_text_commented_upon_hijri": "",
        "date_of_original_text_commented_upon_CE": "",
        "date_of_copying_hijri": "IX",
        "date_of_copying_CE": "",
        "date_of_printing_hijri": "",
        "date_of_printing_CE": "",
        "place_of_printing": "",
        "incipit": "",
        "explicit": "بلغ مقابلة على الاصل الاخير الذى عليه خط سيدنا وشيخنا مؤلّفه ابقاه الله تعالى بمحمد وآله",
        "material": "Papier",
        "script": "Asiatique",
        "number_of_folios": 414,
        "layaout_or_lines_per_page": 29,
        "text": "Le même commentaire sur le même ouvrage. Copie faite du vivant de l'auteur, sur sa dernière rédaction, d'après la note finale: بلغ مقابلة على الاصل الاخير الذى عليه خط سيدنا وشيخنا مؤلّفه ابقاه الله تعالى بمحمد وآله.\nPapier. Écriture Asiatique. 414 feuillets. 29 lignes par page. Sans date; manuscrit du IX siècle de l'Hégire."
    },
    {
        "title": "شرح مغني اللبيب للسيوطى «Commentaire de Soyoûtî sur le Livre qui dispense l'homme intelligent, etc.»",
        "author": "Soyoûtî",
        "author_date_hijri": "",
        "author_date_CE": "",
        "title_of_original_text_commented_upon": "مغني اللبيب",
        "author_of_original_text_commented_upon": "",
        "date_of_author_of_original_text_commented_upon_hijri": "",
        "date_of_author_of_original_text_commented_upon_CE": "",
        "date_of_original_text_commented_upon_hijri": "",
        "date_of_original_text_commented_upon_CE": "",
        "date_of_copying_hijri": "",
        "date_of_copying_CE": "",
        "date_of_printing_hijri": "",
        "date_of_printing_CE": "",
        "place_of_printing": "",
        "incipit": "اما بعد حمد الله مغني اللبيب بفضله ......",
        "explicit": "",
        "material": "Papier",
        "script": "Asiatique",
        "number_of_folios": 212,
        "layaout_or_lines_per_page": 33,
        "text": "شرح مغني اللبيب للسيوطى «Commentaire de Soyoûtî sur le Livre qui dispense l'homme intelligent, etc.» Le titre est ainsi donné sur la reliure. Commencement: اما بعد حمد الله مغني اللبيب بفضله ......  فهذا تعليق لطيف على مغني اللبيب عن كتب الاعاريب ..... سميته بالفتح القريب يبتهج به الاريب الخ. Ce titre, que porte le commentaire, est également cité par Ḥâdjî Khalîfa V, p. 657, 1. ult.\nPapier. Écriture Asiatique, 212 feuillets. 33 lignes par page. Sans date."
    },
    {
        "title": "الجزء الاول من كتاب التذييل والتكميل في شرح كتاب التسهيل",
        "author": "Athir ed-Din Abou Hayyan Mohammad ibn Yousouf ibn Ali ibn Yousouf ibn Hayyan ibn Yousouf",
        "author_date_hijri": "745",
        "author_date_CE": "1344",
        "title_of_original_text_commented_upon": "كتاب التسهيل",
        "author_of_original_text_commented_upon": "Ibn Mâlik",
        "date_of_author_of_original_text_commented_upon_hijri": "",
        "date_of_author_of_original_text_commented_upon_CE": "",
        "date_of_original_text_commented_upon_hijri": "",
        "date_of_original_text_commented_upon_CE": "",
        "date_of_copying_hijri": "738",
        "date_of_copying_CE": "1337",
        "date_of_printing_hijri": "",
        "date_of_printing_CE": "",
        "place_of_printing": "",
        "incipit": "حمد لله المنفرد شريف الاختراع ...... وبعد فان كتاب تسهيل الفوائد لبلدينا ابي عبد الله محمد بن عبد الله بن مالك الطائى الجياني مقم دمشق رحمه الله ابدع كتاب فى فنه ألف الخ.",
        "explicit": "ويتلوه فى الثانى قوله فصل من وما فى اللفظ مفردان مذكران XXX  كتبه لنفسه العبد ...... ابن عبد القادر بن احمد بن مكتوم بن احمد بن محمد بن سليم القيسي من خط المؤلف المذكور.",
        "material": "Papier",
        "script": "Asiatique",
        "number_of_folios": 230,
        "layaout_or_lines_per_page": "21 et 22",
        "text": "Titre: الجزء الاول من كتاب التذييل والتكميل في شرح كتاب التسهيل تصنيف الشيخ ...... اثير الدين ابى حيان محمد بن يوسف بن على بن يوسف بن حيان بن يوسف الاندلسي النحوى. «Premier tome du livre intitulé: Appendice et complément, commentaire sur le livre intitule: L'art de faciliter; commentaire par Athir ed-Din Abou Hayyan Mohammad ibn Yousouf ibn Ali ibn Yousouf ibn Hayyan ibn Yousouf, le grammairien espagnol.» Le manuscrit 13 contient un autre commentaire sur le même ouvrage; le nôtre y est cité au fol. 3 v°, et l'auteur y est nommé الغرناطي «celui qui naquit à Grenade» (cf. ms. 54). II mourut en 745 de l'Hégire (1344 ap. J.-Ch.). Au fol. 1 v°, il est nommé comme sur le titre, si ce n'est qu'après ابن حیان on y lit النفرى الاندلسي. Le titre est redommé aux fol. 3 v° et 230 r°. Le texte commenté est d'Ibn Mâlik (mss. 64 et 140).\nLa copie a été faite du vivant de l'auteur, dont le nom au fol. 230 r° est suivi de ابقاه الله. Une copie a été faite d'après celle-ci en 738 de l'Hégire (1337 ap. J.-Ch.), ce qui : a trompé Casiri. Commencement: حمد لله المنفرد شريف الاختراع ...... وبعد فان كتاب تسهيل الفوائد لبلدينا ابي عبد الله محمد بن عبد الله بن مالك الطائى الجياني مقم دمشق رحمه الله ابدع كتاب فى فنه ألف الخ.\nA la fin de ce premier volume, on lit ويتلوه فى الثانى قوله فصل من وما فى اللفظ مفردان مذكران XXX  كتبه لنفسه العبد ...... ابن عبد القادر بن احمد بن مكتوم بن احمد بن محمد بن سليم القيسي من خط المؤلف المذكور. Déjà au-dessus du titre, au fol 1 r°, l'attention est appelée par les mots بخط ابن مكتوم. Or, d'après Hadji Khalifa, IV, p. 445, Ibn Maktoum mourut en 749 de l'Hégire (1348 ap. J.-Ch.). Notre copie, qui n'est pas datée, est en tout cas antérieure à l'an 738 de l'Hégire.\nPapier. Écriture Asiatique. 230 feuillets. 21 et 22 lignes par page."
    },
    {
        "title": "الجزء الثانى من كتاب التذييل والتكميل في شرح كتاب التسهيل تصنيف الشيخ ...... ابى حيان محمد بن يوسف الاندلسي الشافعي",
        "author": "ابى حيان محمد بن يوسف الاندلسي الشافعي",
        "author_date_hijri": "",
        "author_date_CE": "",
        "title_of_original_text_commented_upon": "كتاب التسهيل",
        "author_of_original_text_commented_upon": "",
        "date_of_author_of_original_text_commented_upon_hijri": "",
        "date_of_author_of_original_text_commented_upon_CE": "",
        "date_of_original_text_commented_upon_hijri": "",
        "date_of_original_text_commented_upon_CE": "",
        "date_of_copying_hijri": "",
        "date_of_copying_CE": "",
        "date_of_printing_hijri": "",
        "date_of_printing_CE": "",
        "place_of_printing": "",
        "incipit": "",
        "explicit": "يتلوه في المجلد الثالث ص فصل يتقدم كسران الخ",
        "material": "Papier",
        "script": "Asiatique",
        "number_of_folios": 207,
        "layaout_or_lines_per_page": 21,
        "text": "Titre: الجزء الثانى من كتاب التذييل والتكميل في شرح كتاب التسهيل تصنيف الشيخ ...... ابى حيان محمد بن يوسف الاندلسي الشافعي. Tome II du même exemplaire. A la fin (fol. 207 r°), on lit: يتلوه في المجلد الثالث ص فصل يتقدم كسران الخ. Ce ص = صورة «Texte». En tête aussi بخط ابن مكتوم; à la fin كتبه لنفسه الخ, comme au ms. 52.\nPapier. Écriture Asiatique. 207 feuillets. 21 lignes par page."
    },
    {
        "title": "الجزء الخامس من كتاب التذييل والتكميل في شرح كتاب التسهيل",
        "author": "أثير الدين ابى حيان محمد بن يوسف بن على بن يوسف بن حيان الاندلسي الشافعى النحوى الغرناطي",
        "author_date_hijri": "",
        "author_date_CE": "",
        "title_of_original_text_commented_upon": "كتاب التسهيل",
        "author_of_original_text_commented_upon": "",
        "date_of_author_of_original_text_commented_upon_hijri": "",
        "date_of_author_of_original_text_commented_upon_CE": "",
        "date_of_original_text_commented_upon_hijri": "",
        "date_of_original_text_commented_upon_CE": "",
        "date_of_copying_hijri": "",
        "date_of_copying_CE": "",
        "date_of_printing_hijri": "",
        "date_of_printing_CE": "",
        "place_of_printing": "",
        "incipit": "",
        "explicit": "يتلوه فى اول الجزء السادس باب افعل التفضيل; ثم كتبه لنفسه الخ",
        "material": "Papier",
        "script": "Asiatique",
        "number_of_folios": 229,
        "layaout_or_lines_per_page": 21,
        "text": "Titre: الجزء الخامس من كتاب التذييل والتكميل في شرح كتاب التسهيل تصنيف الشيخ ...... اثير الدين ابى حيان محمد بن يوسف بن على بن يوسف بن حيان الاندلسي الشافعى النحوى الغرناطي. Tome V du même exemplaire. A la fin (fol. 229 r°), on lit: يتلوه فى اول الجزء السادس باب افعل التفضيل; puis كتبه لنفسه الخ, comme au ms. 52. En tête aussi بخط ابن مكتوم.\nPapier. Écriture Asiatique. 229 feuillets. 21 lignes par page."
    },
    {
        "title": "الخامس من شرح التسهيل لأبي حيان",
        "author": "أبو حيان",
        "author_date_hijri": "",
        "author_date_CE": "",
        "title_of_original_text_commented_upon": "التسهيل",
        "author_of_original_text_commented_upon": "",
        "date_of_author_of_original_text_commented_upon_hijri": "",
        "date_of_author_of_original_text_commented_upon_CE": "",
        "date_of_original_text_commented_upon_hijri": "",
        "date_of_original_text_commented_upon_CE": "",
        "date_of_copying_hijri": "740",
        "date_of_copying_CE": "1339",
        "date_of_printing_hijri": "",
        "date_of_printing_CE": "",
        "place_of_printing": "",
        "incipit": "ص باب المعطوف عطف النسق الخ",
        "explicit": "ويتلوه فى الذى يليه باب اعراب الفعل وعوامله",
        "material": "Papier",
        "script": "Asiatique",
        "number_of_folios": 277,
        "layaout_or_lines_per_page": 23,
        "text": "الخامس من شرح التسهيل لأبي حيان. Tel le titre donné à la tranche inférieure. C'est le tome V d'un autre exemplaire.\nCopie datée de 740 de l'Hégire (1339 ap. J.-Ch.). A la fin, on lit: ويتلوه فى الذى يليه باب اعراب الفعل وعوامله. Commencement: ص باب المعطوف عطف النسق الخ.\nPapier. Écriture Asiatique. 277 feuillets. 23 lignes par page."
    },
    {
        "title": "الجزء الثامن «le tome VIII»",
        "author": "",
        "author_date_hijri": "",
        "author_date_CE": "",
        "title_of_original_text_commented_upon": "",
        "author_of_original_text_commented_upon": "",
        "date_of_author_of_original_text_commented_upon_hijri": "",
        "date_of_author_of_original_text_commented_upon_CE": "",
        "date_of_original_text_commented_upon_hijri": "",
        "date_of_original_text_commented_upon_CE": "",
        "date_of_copying_hijri": "",
        "date_of_copying_CE": "",
        "date_of_printing_hijri": "",
        "date_of_printing_CE": "",
        "place_of_printing": "",
        "incipit": "ص باب ما زيدت الميم في اوله الخ",
        "explicit": "يتلوه فى الجزء التاسع ص ويكثر قيام من مقرونة بالواو مقام النافى",
        "material": "Papier",
        "script": "Asiatique",
        "number_of_folios": 248,
        "layaout_or_lines_per_page": 25,
        "text": "Titre identique à celui du ms. 54, si ce n'est que c'est الجزء الثامن «le tome VIII» du même exemplaire, mais pourtant d'une autre main que 52-54. A la fin يتلوه فى الجزء التاسع ص ويكثر قيام من مقرونة بالواو مقام النافى. Commencement: ص باب ما زيدت الميم في اوله الخ.\nPapier. Écriture Asiatique. 248 feuillets. 25 lignes par page."
    },
    {
        "title": "الجزء العاشر «le tome X» du même exemplaire",
        "author": "",
        "author_date_hijri": "",
        "author_date_CE": "",
        "title_of_original_text_commented_upon": "",
        "author_of_original_text_commented_upon": "",
        "date_of_author_of_original_text_commented_upon_hijri": "",
        "date_of_author_of_original_text_commented_upon_CE": "",
        "date_of_original_text_commented_upon_hijri": "",
        "date_of_original_text_commented_upon_CE": "",
        "date_of_copying_hijri": "",
        "date_of_copying_CE": "",
        "date_of_printing_hijri": "",
        "date_of_printing_CE": "",
        "place_of_printing": "",
        "incipit": "ص فصل امالة الفعل في التصريف الخ",
        "explicit": "كمل السفر العاشر من كتاب التذييل والتكميل ...... وبكماله كمل جميع الديوان",
        "material": "Papier",
        "script": "Asiatique",
        "number_of_folios": 275,
        "layaout_or_lines_per_page": 25,
        "text": "Titre identique à celui des mss. 54 et 56, si ce n'est que c'est الجزء العاشر «le tome X» du même exemplaire, écrit de la même main que 56. Ce tome X est le dernier de l'ouvrage, comme il ressort de la note finale: كمل السفر العاشر من كتاب التذييل والتكميل ...... وبكماله كمل جميع الديوان. Commencement: ص فصل امالة الفعل في التصريف الخ.\nPapier. Écriture Asiatique. 275 feuillets. 25 lignes par page."
    },
    {
        "title": "الجزء الثانى من شرح التسهيل للشيخ ...... بدر الدین ابن قاسم ابن عبد الله ابن على المرادي",
        "author": "Badr ed-Dîn ibn Ḳâsim ibn Abd Allâh ibn Alî Al-Mourâdî",
        "author_date_hijri": "",
        "author_date_CE": "",
        "title_of_original_text_commented_upon": "L'art de faciliter",
        "author_of_original_text_commented_upon": "",
        "date_of_author_of_original_text_commented_upon_hijri": "",
        "date_of_author_of_original_text_commented_upon_CE": "",
        "date_of_original_text_commented_upon_hijri": "",
        "date_of_original_text_commented_upon_CE": "",
        "date_of_copying_hijri": "780",
        "date_of_copying_CE": "1378",
        "date_of_printing_hijri": "",
        "date_of_printing_CE": "",
        "place_of_printing": "",
        "incipit": "باب المستثنى",
        "explicit": "يتلوه فى الثالث باب نونى التوكيد",
        "material": "Papier",
        "script": "Asiatique",
        "number_of_folios": 215,
        "layaout_or_lines_per_page": 21,
        "text": "Titre: (sic) الجزء الثانى من شرح التسهيل للشيخ ...... بدر الدین ابن قاسم ابن (sic) عبد الله ابن (sic) على المرادي. «Tome II du commentaire sur le livre intitulé: L'art de faciliter; commentaire par Badr ed-Dîn ibn Ḳâsim ibn Abd Allâh ibn Alî Al-Mourâdî.» Les mss. 4, 12, 70-73 contiennent son commentaire sur l'Alfiyya, autre ouvrage d'Ibn Mâlik. Copie datée de 780 de l'Hégire (1378 ap. J-Ch.). A la fin: يتلوه فى الثالث باب نونى التوكيد. Commencement: باب المستثنى.\nPapier. Écriture Asiatique. 215 feuillets. 21 lignes par page."
    },
    {
        "title": "الجزء الثالث من شرح التسهيل للشيخ ...... بدر الدين حسن ابن قاسم بن عبد الله المرادى",
        "author": "بدر الدين حسن ابن قاسم بن عبد الله المرادى",
        "author_date_hijri": "780",
        "author_date_CE": "1378",
        "title_of_original_text_commented_upon": "",
        "author_of_original_text_commented_upon": "",
        "date_of_author_of_original_text_commented_upon_hijri": "",
        "date_of_author_of_original_text_commented_upon_CE": "",
        "date_of_original_text_commented_upon_hijri": "",
        "date_of_original_text_commented_upon_CE": "",
        "date_of_copying_hijri": "780",
        "date_of_copying_CE": "1378",
        "date_of_printing_hijri": "",
        "date_of_printing_CE": "",
        "place_of_printing": "",
        "incipit": "",
        "explicit": "",
        "material": "Papier",
        "script": "Asiatique",
        "number_of_folios": 180,
        "layaout_or_lines_per_page": 23,
        "text": "Titew: الجزء الثالث من شرح التسهيل للشيخ ...... بدر الدين حسن ابن قاسم بن عبد الله المرادى ,Tome III du même exemplaire, daté également de 780 de l'Hégire (1378 ap. J.-Ch.). Ce doit être la fin du commentaire.\nPapier. Écriture Asiatique. 180 feuillets. 23 lignes par page.\n"
    },
    {
        "title": "كتاب المكمل فى شرح المفصل «Livre intitule: Le commentaire perfectionné sur le Moufassal.»",
        "author": "Mouthahhir ed-Din Mohammad",
        "author_date_hijri": "659",
        "author_date_CE": "1260",
        "title_of_original_text_commented_upon": "المفصل",
        "author_of_original_text_commented_upon": "الزمخشري",
        "date_of_author_of_original_text_commented_upon_hijri": "",
        "date_of_author_of_original_text_commented_upon_CE": "",
        "date_of_original_text_commented_upon_hijri": "",
        "date_of_original_text_commented_upon_CE": "",
        "date_of_copying_hijri": "682",
        "date_of_copying_CE": "1283",
        "date_of_printing_hijri": "",
        "date_of_printing_CE": "",
        "place_of_printing": "",
        "incipit": "الحمد لله الذى قصّر عما يليق بكبريائه الخ",
        "explicit": "",
        "material": "Papier",
        "script": "Asiatique",
        "number_of_folios": 218,
        "layaout_or_lines_per_page": 31,
        "text": "Titre en partie effacé: كتاب المكمل فى شرح المفصل «Livre intitule: Le commentaire perfectionné sur le Moufassal.» Ainsi est nommée la remarquable grammaire de فخر خوازم خوازم محمود بن عمر (sic, lisez الزمخشري) grammaire qui se trouve dans les mss. 176 et 177, et qui a été publiée avec une minutieuse exactitude et une savante précision par le professeur J. P. Broch de Christiania (1 éd. 1859; 2° éd. 1879). Dans la préface de sa nouvelle édition, M. Broch signale une édition d'Alexandrie, qui a paru en 1874. Le commentaire que renferme ce manuscrit est, d'après Hadji Khalifa, VI, p. 40 et 41, de Mouthahhir ed-Din Mohammad Il a été terminé par son auteur en 659 de l'Hégire (1260 ap. J.-Ch.). La copie est datée de 682 de l'Hégire (1260 ap. J.-Ch). La copie est datèe de 682 de l'Hégire (1283 ap. J.-Ch.). Commencement: الحمد لله الذى قصّر عما يليق بكبريائه الخ.\nPapier. Écriture Asiatique. 218 feuillets, 31 lignes par page."
    },
    {
        "title": "الجزء الثاني من كتاب المفضّل على المفصل في درايه المفصل",
        "author": "كمال الدين عبد الواحد ابن عبد الكريم بن خلف الانصارى",
        "author_date_hijri": "651",
        "author_date_CE": "1253",
        "title_of_original_text_commented_upon": "المفصل",
        "author_of_original_text_commented_upon": "",
        "date_of_author_of_original_text_commented_upon_hijri": "",
        "date_of_author_of_original_text_commented_upon_CE": "",
        "date_of_original_text_commented_upon_hijri": "",
        "date_of_original_text_commented_upon_CE": "",
        "date_of_copying_hijri": "647",
        "date_of_copying_CE": "1249",
        "date_of_printing_hijri": "",
        "date_of_printing_CE": "",
        "place_of_printing": "",
        "incipit": "فصل قال سيبويه وهذه حجج سمعت من العرب يقولون اللهم ضبعا ونبا الخ",
        "explicit": "ويتلوه فى الجزء الثالث ذكر التوابع",
        "material": "Papier",
        "script": "Asiatique",
        "number_of_folios": 177,
        "layaout_or_lines_per_page": 21,
        "text": "Titre: الجزء الثاني من كتاب المفضّل على المفصل في درايه (sic, lisez دراية) المفصل تأليف القاضى ...... كمال الدين عبد الواحد ابن عبد الكريم بن خلف الانصارى ادام الله ايامه. «Tome II du Livre intitulé: La supériorité reconnue sur ce qui est bien divisé; ouvrage destiné à faire connaître le Moufassal, commentaire par le kadi ...... Ḳâmal ed-Din Abd el-Wahid ibn 'Abd elKarim ibn Khalaf Al-Ansari, qu'Allah prolonge ses jours! La copie a donc été faite du vivant de l'auteur; or, elle est datée de 647 de l'Hégire (1249 ap. J.-Ch.); quant à l'auteur, que notre manuscrit attribue à ce commentaire, il mourut en 651 (1253 ap. J.-Ch.) d'après Ḥâdjî Khalîfa, VI, p. 223; ce qui est tout-à-fait d'accord avec les indications du titre. Hâdjî Khalifa paraît commettre une erreur bibliographique, lorsqu'il affirme (VI, p. 39) que ce commentaire aurait été composé par Alam ed-Dîn Aboû 'l-Hasan Ali ibn Moḥammad As-Sakhawî, mort en 643 de l'Hégire (1245 ap. J.-Ch.). A la fin du volume, on it ويتلوه فى الجزء الثالث ذكر التوابع (éd. de M. Broch, p. ٤٤, 1. 17). Commencement) فصل قال سيبويه وهذه حجج سمعت من العرب يقولون اللهم ضبعا ونبا الخ (p. ١٨, 1. 15).\nPapier. Écriture Asiatique. 177 feuillets. 21 lignes par page."
    },
    {
        "title": "شرح المفصل للاندلسي «Commentaire sur le Moufaṣṣal, par l'Espagnol»",
        "author": "Tâdj ed-Din Ahmad ibn Maḥmoûd ibn 'Omar Al-Djondî",
        "author_date_hijri": "VIII",
        "author_date_CE": "",
        "title_of_original_text_commented_upon": "المفصل",
        "author_of_original_text_commented_upon": "",
        "date_of_author_of_original_text_commented_upon_hijri": "",
        "date_of_author_of_original_text_commented_upon_CE": "",
        "date_of_original_text_commented_upon_hijri": "",
        "date_of_original_text_commented_upon_CE": "",
        "date_of_copying_hijri": "",
        "date_of_copying_CE": "",
        "date_of_printing_hijri": "",
        "date_of_printing_CE": "",
        "place_of_printing": "",
        "incipit": "اياحمد على نعم تهللت وجوهها الصباح الخ",
        "explicit": "",
        "material": "Papier",
        "script": "Asiatique",
        "number_of_folios": 194,
        "layaout_or_lines_per_page": "25-29",
        "text": "Titre efface, on on lit encore: شرح المفصل للاندلسي «Commentaire sur le Moufaṣṣal, par l'Espagnol.» Cet Espagnol est, d'après Hâdjî Khalîfa, VI, p. 39, Tâdj ed-Din Ahmad ibn Maḥmoûd ibn 'Omar Al-Djondî qui vivait au milieu du VIII siècle de l'Hégire. Le titre de ce commentaire «La clef» se trouve au fol. 1 v°. Commencement: اياه احمد على نعم تهللت وجوهها الصباح الخ.\nPapier. Écriture Asiatique. 194 feuillets. De 25 à 29 lignes par page. Sans date."
    },
    {
        "title": "Commentaire de 'Ali ibn Mohammad Al-Djordjânî sur la troisième partie du مفتاح العلوم «La clef des sciences»",
        "author": "'Ali ibn Mohammad Al-Djordjânî",
        "author_date_hijri": "",
        "author_date_CE": "",
        "title_of_original_text_commented_upon": "مفتاح العلوم «La clef des sciences»",
        "author_of_original_text_commented_upon": "Sirâdj ed-Dîn Aboû Yakoûb Yoûsouf ibn Abî Moḥammad ibn Ali As-Sakkâkî",
        "date_of_author_of_original_text_commented_upon_hijri": "",
        "date_of_author_of_original_text_commented_upon_CE": "",
        "date_of_original_text_commented_upon_hijri": "",
        "date_of_original_text_commented_upon_CE": "",
        "date_of_copying_hijri": "",
        "date_of_copying_CE": "",
        "date_of_printing_hijri": "1241",
        "date_of_printing_CE": "1825",
        "place_of_printing": "Constantinople",
        "incipit": "",
        "explicit": "تمت (sic) شرح المفتاح بعون الله",
        "material": "Papier",
        "script": "Asiatique",
        "number_of_folios": 164,
        "layaout_or_lines_per_page": 25,
        "text": "Commentaire de 'Ali ibn Mohammad Al-Djordjânî sur la troisième partie du مفتاح العلوم «La clef des sciences», de Sirâdj ed-Dîn Aboû Yakoûb Yoûsouf ibn Abî Moḥammad ibn Ali As-Sakkâkî. Cette troisième partie (cf. ms. 26) est فى علمى المعاني والبيان. Il manque environ 8 fol. au commencement, comme nous l'a montré la collation d'un exemplaire complet (ms. 206). Ces gloses ont été imprimées à Constantinople en 1241 de l'Hégire (1825 ap. J.-Ch.). A la fin (fol. 164 v°) se trouve la seule indication sur le contenu de ce manuscrit: تمت (sic) شرح المفتاح بعون الله.\nPapier. Écriture Asiatique. 164 feuillets. 25 lignes par page. Sans date."
    },
    {
        "title": "كتاب تسهيل الفوائد وتكميل المقاصد",
        "author": "جمال الدین ابو عبد الله محمد بن عبد الله بن مالك الطاءى الأندلسي الحياني",
        "author_date_hijri": "",
        "author_date_CE": "",
        "title_of_original_text_commented_upon": "",
        "author_of_original_text_commented_upon": "",
        "date_of_author_of_original_text_commented_upon_hijri": "",
        "date_of_author_of_original_text_commented_upon_CE": "",
        "date_of_original_text_commented_upon_hijri": "",
        "date_of_original_text_commented_upon_CE": "",
        "date_of_copying_hijri": "794",
        "date_of_copying_CE": "1391",
        "date_of_printing_hijri": "",
        "date_of_printing_CE": "",
        "place_of_printing": "",
        "incipit": "حامدا لله رب العالمين ومصليا على محمد سيد المرسلين الخ",
        "explicit": "",
        "material": "Papier",
        "script": "Magrébine",
        "number_of_folios": 69,
        "layaout_or_lines_per_page": 21,
        "text": "Titre: كتاب تسهيل الفوائد وتكميل المقاصد تأليف الشيخ ......  جمال الدین ابو (sic) عبد الله محمد بن عبد الله بن مالك الطاءى الأندلسي الحياني نزيل دمشق ....... «Livre intitulé: L'art de faciliter les enseignements utiles et de parfaire les études, œuvre du schaikh ...... Djamal ed-Dîn Aboû 'Abd Allah Mohammad ibn Abd Allah Ibn Mâlik At-Ta'i Al-Djayyânî l'Espagnol établi à Damas.» Le nom de l'auteur est donné de même au fol. 1 v°, avec la variante مقيم دمشق. C'est le traité grammatical d'Ibn Mâlik (Hadji-Khalifa, n° 2989), dont le texte se retrouve au ms. 140, et dont nous possédons des commentaires dans les manuscrits 13, 52–59, 66. C'est d'après l'original que la copie a été faite, c'est sur lui qu'elle a été collationnée en 794 de l'Hégire (1391 ap. J.-Ch.). Commencement: حامدا لله رب العالمين ومصليا على محمد سيد المرسلين الخ.\nPapier. Écriture Magrébine. 69 feuillets. 21 lignes par page."
    },
    {
        "title": "Commentaire sur le كتاب التيسير فى القراءات السبع «Livre intitulé: L'appui pour connaître les sept recensions du Coran»",
        "author": "Aboû Mohammad Abd el-Wahid ibn Moḥammad Al-Bâhilî",
        "author_date_hijri": "750",
        "author_date_CE": "1349",
        "title_of_original_text_commented_upon": "كتاب التيسير فى القراءات السبع",
        "author_of_original_text_commented_upon": "أبو عمر عثمن بن سعيد الداني",
        "date_of_author_of_original_text_commented_upon_hijri": "444",
        "date_of_author_of_original_text_commented_upon_CE": "1052",
        "date_of_original_text_commented_upon_hijri": "",
        "date_of_original_text_commented_upon_CE": "",
        "date_of_copying_hijri": "712",
        "date_of_copying_CE": "1312",
        "date_of_printing_hijri": "",
        "date_of_printing_CE": "",
        "place_of_printing": "",
        "incipit": "",
        "explicit": "",
        "material": "Papier",
        "script": "Magrébine",
        "number_of_folios": 137,
        "layaout_or_lines_per_page": 23,
        "text": "Commentaire sur le كتاب التيسير فى القراءات السبع «Livre intitulé: L'appui pour connaître les sept recensions du Coran», ouvrage dont l'anteur, nommé au fol. 1° ابو عمر عثمن بن سعيد الداني, mourut en 444 de l'Hégire (1052 ap. J.-Ch.). Hâdji Khalifa, nº 3814.\nLe titre et le premier feuillet manquant, le nom du commentateur nous échappe. La date de 712 de l'Hégire (1312 ap. J.-Ch.), donnée à la fin, paraît s'appliquer non à la copie, mais à la composition du commentaire. Il se pourrait donc que ce fût celui d'Aboû Mohammad Abd el-Wahid ibn Moḥammad Al-Bâhilî, mort en 750 de l'Hégire (1349 ap. J.-Ch.) d'après Ḥâdjî Khalifa, II, p. 488.\nPour le titre même, il semble qu'à la tranche supérieure on lise شرح التيسير. Au fol. 1 r° se trouve le passage suivant: الاستاد اما كتاب التيسير فحدثني به الشيخ ابو بكر محمد بن محمد بن احمد الانصاری البلنسي ابن مشلیون اجازة نا (اخبرنا = sic) القاضي ابو بكر محمد بن احمد ابن عبد الملك بن ابى جمرة المرّى عن ابيه عن الحافظ ابي عمرو عثمن بن سعيد الدانى مؤلّفه وسمعته من لفظ الاستاذ الجليل ابى جعفر احمد بن ابرهيم ابن الزبير الثقفى الخ Du fol. 2 r°, je cite. مسئلة يثبت في كثير من نسخ التيسير بأثر البسملة والتصلية قال ابو عمرو عثمن بن سعيد بن عثمن والذي رويته ترك ذلك واثبات الخطبة باثر البسملة والتصلية وهو قوله الحمد لله المنفرد بالدوام. Après la lecture de ces passages, aucun doute ne peut subsister ni sur le titre, ni sur l'auteur de l'ouvrage commenté. Celui-ci est appelé, en tête de chaque passage, cité الحافظ رحمه الله (fol. 22 v°; 23 r °, etc).\nPapier. Écriture Magrébine, 137 feuillets. 23 lignes par page. Sans date."
    },
    {
        "title": "Tome Ier du commentaire, que le schaikh Djamal ed-Din Abou Abd Allah Mohammad ibn 'Abd Allâh Ibn Mâlik At-Ta'i l'Espagnol a composé sur son livre intitulé : L'art de faciliter les enseignements utiles et de parfaire les études relatives à la langue arabe",
        "author": "Djamal ed-Din Abou Abd Allah Mohammad ibn 'Abd Allâh Ibn Mâlik At-Ta'i",
        "author_date_hijri": "",
        "author_date_CE": "",
        "title_of_original_text_commented_upon": "تسهيل الفوائد وتكميل المقاصد في العربية",
        "author_of_original_text_commented_upon": "",
        "date_of_author_of_original_text_commented_upon_hijri": "",
        "date_of_author_of_original_text_commented_upon_CE": "",
        "date_of_original_text_commented_upon_hijri": "",
        "date_of_original_text_commented_upon_CE": "",
        "date_of_copying_hijri": "",
        "date_of_copying_CE": "",
        "date_of_printing_hijri": "",
        "date_of_printing_CE": "",
        "place_of_printing": "",
        "incipit": "",
        "explicit": "باب افعال المقاربة",
        "material": "Papier",
        "script": "Magrébine",
        "number_of_folios": 111,
        "layaout_or_lines_per_page": 23,
        "text": "Titre: الاول من شرح الشيخ ...... جمال الدين ابى عبد الله محمد ابن عبد الله ابن ملك الطائى الاندلسي ...... لكتابه المسمى تسهيل الفوائد وتكميل المقاصد في العربية ...... «Tome Ier du commentaire, que» le schaikh .....» Djamal ed-Din Abou Abd Allah Mohammad ibn 'Abd Allâh Ibn Mâlik At-Ta'i l'Espagnol a composé sur son livre intitulé : L'art de faciliter les enseignements utiles et de parfaire les études relatives à la langue arabe.» Le dernier chapitre commenté dans ce volume est باب افعال المقاربة. Commencement semblable à celui du texte même (mss. 64 et 140).\nPapier. Écriture Magrébine. 111 feuillets. 23 lignes par page. Sans date."
    },
    {
        "title": "كتاب اوضح المسالك الى الفية ابن مالك",
        "author": "ابى محمد عبد الله جمال الدين بن الشيخ جمال الدين بن يوسف بن هشام الانصاري",
        "author_date_hijri": "",
        "author_date_CE": "",
        "title_of_original_text_commented_upon": "الفية ابن مالك",
        "author_of_original_text_commented_upon": "Ibn Mâlik",
        "date_of_author_of_original_text_commented_upon_hijri": "",
        "date_of_author_of_original_text_commented_upon_CE": "",
        "date_of_original_text_commented_upon_hijri": "",
        "date_of_original_text_commented_upon_CE": "",
        "date_of_copying_hijri": "726",
        "date_of_copying_CE": "1325",
        "date_of_printing_hijri": "",
        "date_of_printing_CE": "",
        "place_of_printing": "",
        "incipit": "",
        "explicit": "",
        "material": "Papier",
        "script": "Asiatique",
        "number_of_folios": 173,
        "layaout_or_lines_per_page": 17,
        "text": "Titre: كتاب اوضح المسالك الى الفية ابن مالك تأليف الشيخ ...... ابى محمد عبد الله جمال الدين بن الشيخ جمال الدين بن يوسف بن هشام الانصاري. C'est le commentaire d' Ibn Hischam sur l' Alfiyya d'Ibn Mâlik, dont nous avons déjà vu deux exemplaires (manuscrits 7, 2°; 47, 3°). Copie datée de 726 de l'Hégire (1325 ap. J.-Ch.).\nPapier. Écriture Asiatique. 173 feuillets. 17 lignes par page."
    },
    {
        "title": "Commentaire sur l'Aliyya d' Ibn Malik, institule الدرة المضلة يي في شرح الالفية «La perle brillante; commentaire sur l' Alfiyya»",
        "author": "Ibn Malik",
        "author_date_hijri": "765",
        "author_date_CE": "1363",
        "title_of_original_text_commented_upon": "الدرة المضلة يي في شرح الالفية",
        "author_of_original_text_commented_upon": "",
        "date_of_author_of_original_text_commented_upon_hijri": "",
        "date_of_author_of_original_text_commented_upon_CE": "",
        "date_of_original_text_commented_upon_hijri": "",
        "date_of_original_text_commented_upon_CE": "",
        "date_of_copying_hijri": "810",
        "date_of_copying_CE": "1407",
        "date_of_printing_hijri": "",
        "date_of_printing_CE": "",
        "place_of_printing": "",
        "incipit": "",
        "explicit": "قال مؤلفه ...... ابرهيم بن موسى الأنباسى الشافعي ...... كان الفراغ من تأليفه ...... سنة ٧٦٥ وذلك بالجامع الاقصى من القدس الشريف",
        "material": "Papier",
        "script": "Magrébine",
        "number_of_folios": 259,
        "layaout_or_lines_per_page": 26,
        "text": "Commentaire sur l'Aliyya d' Ibn Malik, institule الدرة المضلة يي في شرح الالفية «La perle brillante; commentaire sur l' Alfiyya» Le commentateur est nommé à la fin (fol. 259 v ابو اسحاق ابرهيم بن الشيخ ...... ابي عمران موسى الأنباسي. Citons encore la note suivante (fol. 259 rº), d'après laquelle la composition fut achevée en Jérusalem en 765 de l'Hégire (1363 ap. J-C.): قال مؤلفه ...... ابرهيم بن موسى الأنباسى الشافعي ...... كان الفراغ من تأليفه ...... سنة ٧٦٥ وذلك بالجامع الاقصى من القدس الشريف. Copie datée de 810 de l'Hégire (1407 ap. J.-Ch.). Lacune au commencement.\nPapier. Écriture Magrébine. 259 feuillets. 26 lignes par page.soun"
    },
    {
        "title": "كتاب البهجة المرضية فى شرح الالفية",
        "author": "عبد الرحمن جلال الدين السيوطي",
        "author_date_hijri": "",
        "author_date_CE": "",
        "title_of_original_text_commented_upon": "Alfiyya",
        "author_of_original_text_commented_upon": "Ibn Mâlik",
        "date_of_author_of_original_text_commented_upon_hijri": "",
        "date_of_author_of_original_text_commented_upon_CE": "",
        "date_of_original_text_commented_upon_hijri": "",
        "date_of_original_text_commented_upon_CE": "",
        "date_of_copying_hijri": "960",
        "date_of_copying_CE": "1552",
        "date_of_printing_hijri": "",
        "date_of_printing_CE": "",
        "place_of_printing": "",
        "incipit": "احمدك اللهم على نعمك وآلائك الخ",
        "explicit": "",
        "material": "Papier",
        "script": "Asiatique",
        "number_of_folios": 70,
        "layaout_or_lines_per_page": 29,
        "text": "Titre: كتاب البهجة المرضية فى شرح الالفية تأليف الشيخ .... عبد الرحمن جلال الدين السيوطي. «Livre initiale: La beauté charmante; commentaire sur l'Alfiyya: œuvre du schaikh ..... Abd er-Raļuman Djalál ed-Din As-Soyoûți. C'est également un commentaire sur l'Alfigya d'Ibn Mâlik. Manuscrit daté de 960 de l'Hégire (1552 ap. J.-Ch.). Commencement; احمدك اللهم على نعمك وآلائك الخ.\nPapier. Écriture Asiatique. 70 feuillets. 29 lignes par page."
    },
    {
        "title": "السفر الاول من المرادى",
        "author": "Selams ed-Din Hasan ibn Ķâsim Al-Mouradi",
        "author_date_hijri": "",
        "author_date_CE": "",
        "title_of_original_text_commented_upon": "Alfiyya d'Ibn Malik",
        "author_of_original_text_commented_upon": "Ibn Malik",
        "date_of_author_of_original_text_commented_upon_hijri": "",
        "date_of_author_of_original_text_commented_upon_CE": "",
        "date_of_original_text_commented_upon_hijri": "",
        "date_of_original_text_commented_upon_CE": "",
        "date_of_copying_hijri": "",
        "date_of_copying_CE": "",
        "date_of_printing_hijri": "",
        "date_of_printing_CE": "",
        "place_of_printing": "",
        "incipit": "الحمد لله والشكر لله وصلاته على محمد خير نبي ارسله اما بعد فهذا مختصر توضيح المقاصد الفية ابن ملك الخ",
        "explicit": "",
        "material": "Papier",
        "script": "Magrébine",
        "number_of_folios": 130,
        "layaout_or_lines_per_page": 27,
        "text": "Titre: السفر الاول من المرادى. Le premier volume l'Al Mouradi. C'est le premier volume du commentaire sur l'Alfiyya d'Ibn Malik, par Selams ed-Din Hasan ibn Ķâsim Al-Mouradi (cf. muss. 4 et 12). Commencement: الحمد لله والشكر لله وصلاته على محمد خير نبي ارسله اما بعد فهذا مختصر توضيح المقاصد الفية ابن ملك الخ. La fin manque, et le volume s'arrête an milieu du chapitre intitule: اعمال اسم الفاعل *cf. éd ce Dieterici, p. ٢١٣)\nPapier. Écriture Magrébine. 130 feuillets. 27 lignes par page. Sans date,"
    },
    {
        "title": "الثاني من المرادي «Deuxième partie d'Al-Mouradi.»",
        "author": "",
        "author_date_hijri": "",
        "author_date_CE": "",
        "title_of_original_text_commented_upon": "",
        "author_of_original_text_commented_upon": "",
        "date_of_author_of_original_text_commented_upon_hijri": "",
        "date_of_author_of_original_text_commented_upon_CE": "",
        "date_of_original_text_commented_upon_hijri": "",
        "date_of_original_text_commented_upon_CE": "",
        "date_of_copying_hijri": "",
        "date_of_copying_CE": "",
        "date_of_printing_hijri": "",
        "date_of_printing_CE": "",
        "place_of_printing": "",
        "incipit": "الترجم",
        "explicit": "كمل هذا التقييد الخ",
        "material": "Papier",
        "script": "Magrobine",
        "number_of_folios": 171,
        "layaout_or_lines_per_page": 25,
        "text": "الثاني من المرادي «Deuxième partie d'Al-Mouradi.» Ainsi est donné le titre à la tranche inférieure. C'est le deuxième volume du même ouvrage, mais dans un autre exemplaire que celui dont le ms. 70 est un premier volume. Commencement الترجم (ef. l'édition de M. Dieterici, p. ٢٧٣). A la fin, sur le dernier feuillet qui est d'une écriture plus moderne: كمل هذا التقييد الخ.\nPapier. Écriture Magrobine. 171 feuillets. 25 lignes par page. Sans date."
    },
    {
        "title": "premier volume du commentaire sur l'Alfiyya",
        "author": "Al-Mourâdî",
        "author_date_hijri": "",
        "author_date_CE": "",
        "title_of_original_text_commented_upon": "Alfiyya",
        "author_of_original_text_commented_upon": "",
        "date_of_author_of_original_text_commented_upon_hijri": "",
        "date_of_author_of_original_text_commented_upon_CE": "",
        "date_of_original_text_commented_upon_hijri": "",
        "date_of_original_text_commented_upon_CE": "",
        "date_of_copying_hijri": "780",
        "date_of_copying_CE": "1378",
        "date_of_printing_hijri": "",
        "date_of_printing_CE": "",
        "place_of_printing": "",
        "incipit": "",
        "explicit": "",
        "material": "Papier",
        "script": "Magrébine",
        "number_of_folios": 114,
        "layaout_or_lines_per_page": 27,
        "text": "Autre exemplaire d'un premier volume du commentaire sur l'Alfiyya, par Al-Mourâdî. L'auteur est nommé ici, en title: بدر الدين ابو على حسن بن ....... قاسم بن عبد الله بن على المرادى المالكي. Manuscrit daté de 780 de l'Hégire (1378 ap. J.-Ch.). Le dernier chapitre commenté et sur les اسماء الازمنة (cf. l'édition de Dieterici, p. 106-109).\n1 Papier. Écriture Magrébine, 114 feuillets. 27 lignes par page."
    },
    {
        "title": "السفر الاول من شرح الفية ابن ملك",
        "author": "أبو علي حسن بن قاسم بن عبد الله المالكي المرادي",
        "author_date_hijri": "",
        "author_date_CE": "",
        "title_of_original_text_commented_upon": "Alfiyya d'Ibn Mâlik",
        "author_of_original_text_commented_upon": "",
        "date_of_author_of_original_text_commented_upon_hijri": "",
        "date_of_author_of_original_text_commented_upon_CE": "",
        "date_of_original_text_commented_upon_hijri": "",
        "date_of_original_text_commented_upon_CE": "",
        "date_of_copying_hijri": "798",
        "date_of_copying_CE": "1395",
        "date_of_printing_hijri": "",
        "date_of_printing_CE": "",
        "place_of_printing": "",
        "incipit": "",
        "explicit": "",
        "material": "Papier",
        "script": "Magrébine",
        "number_of_folios": 151,
        "layaout_or_lines_per_page": 23,
        "text": "Titre: السفر الاول من شرح الفية ابن ملك تأليف الشيخ ...... ابي على حسن بن ...... قاسم بن عبد الله المالكي المرادي. Premier volume du même commentaire sur l'Alfiyya d'Ibn Mâlik. Dernier chapitre : (cf. l'édition de Dieterici, .p. ٣٧—٧): Manuscrit daté de 798 de l'Hégire (1395 ap.-Ch.).\nPapier. Écriture Magrébine. 151 fouillets, 23 lignes par page."
    },
    {
        "title": "Commentaire sur l'Alfiyya d'Ibn Mâlik",
        "author": "شمس الدين ابو عبد الله محمد بن احمد بن جابر الهوارى الأندلسي المرسى المالكي",
        "author_date_hijri": "780",
        "author_date_CE": "1378",
        "title_of_original_text_commented_upon": "Alfiyya",
        "author_of_original_text_commented_upon": "Ibn Mâlik",
        "date_of_author_of_original_text_commented_upon_hijri": "",
        "date_of_author_of_original_text_commented_upon_CE": "",
        "date_of_original_text_commented_upon_hijri": "",
        "date_of_original_text_commented_upon_CE": "",
        "date_of_copying_hijri": "",
        "date_of_copying_CE": "",
        "date_of_printing_hijri": "",
        "date_of_printing_CE": "",
        "place_of_printing": "",
        "incipit": "الحمد لله الذي ارسل الينا اشرف الرسل باشرف لسان الخ",
        "explicit": "",
        "material": "Papier",
        "script": "Magrébine",
        "number_of_folios": 189,
        "layaout_or_lines_per_page": 27,
        "text": "Commentaire sur l'Alfiyya d'Ibn Mâlik. Le commentateur est nommé au fol. 1 v° شمس الدين ابو عبد الله محمد بن احمد بن جابر الهوارى الأندلسي المرسى المالكي; d'apres Hadji Khalifa, I, p 409, il était aveugle et mourut en 780 de l'Hégire (1378 ap. J.-Ch.). Cf. Makkari, Analectes, éd. de Leyde, I, p. 916. La fin manque, et le dernier vers commenté est le vers 983. Commencement: الحمد لله الذي ارسل الينا اشرف الرسل باشرف لسان الخ.\nPapier. Écriture Magrébine. 189 feuillets. 27 lignes par page. Sans date."
    },
    {
        "title": "سفر فيه شرح الفية ابن ملك ...... لابن جابر",
        "author": "ابن جابر",
        "author_date_hijri": "",
        "author_date_CE": "",
        "title_of_original_text_commented_upon": "Alfiyya d'Ibn Mâlik",
        "author_of_original_text_commented_upon": "Ibn Mâlik",
        "date_of_author_of_original_text_commented_upon_hijri": "",
        "date_of_author_of_original_text_commented_upon_CE": "",
        "date_of_original_text_commented_upon_hijri": "",
        "date_of_original_text_commented_upon_CE": "",
        "date_of_copying_hijri": "",
        "date_of_copying_CE": "",
        "date_of_printing_hijri": "",
        "date_of_printing_CE": "",
        "place_of_printing": "",
        "incipit": "",
        "explicit": "",
        "material": "Papier",
        "script": "Magrébine",
        "number_of_folios": 119,
        "layaout_or_lines_per_page": 18,
        "text": "Titre: سفر فيه شرح الفية ابن ملك ...... لابن جابر «Volume contenant le commentaire d'Ibn Djâbir sur l'Alfiyya d'Ibn Mâlik.» Malgré la promesse du titre, nous n'avons ici que la seconde moitié du commentaire que renferme le manuscrit 74, depuis le chapitre intitulé التوكيد (éd. Dieterici, p. ٦٤٨). Du reste, a la tranche inférienne, on lit: الثانى من ابن جابر على الالفية. Ce manuscrit pent servir pour compléter le précédent.\nPapier. Écriture Magrébine. 119 feuillets. 18 lignes par page. Sans date."
    },
    {
        "title": "الجزء الاول من التصريح بمضمون التوضيح للعلامة خالد الازهرى",
        "author": "Khalid Al-Azharî",
        "author_date_hijri": "890",
        "author_date_CE": "1485",
        "title_of_original_text_commented_upon": "التوضيح",
        "author_of_original_text_commented_upon": "Ibn Hischâm",
        "date_of_author_of_original_text_commented_upon_hijri": "",
        "date_of_author_of_original_text_commented_upon_CE": "",
        "date_of_original_text_commented_upon_hijri": "",
        "date_of_original_text_commented_upon_CE": "",
        "date_of_copying_hijri": "",
        "date_of_copying_CE": "",
        "date_of_printing_hijri": "",
        "date_of_printing_CE": "",
        "place_of_printing": "",
        "incipit": "الحمد لله الملهم لتحميده ...... وبعد فيقول العبد ...... خالد بن عبد الله الازهرى ...... ان الشرح المشهور بالتوضيح على الفية ابن مالك في علم النحو للشيخ ...... جمال الدين ابى محمد عبد الله بن يوسف بن هشام الانصاري ...... فى غاية حسن الوقع عند جميع الاخوان الخ",
        "explicit": "يتلوه الجزء الثانى من اول باب ابنية الفاعلين",
        "material": "Papier",
        "script": "Asiatique",
        "number_of_folios": 278,
        "layaout_or_lines_per_page": 25,
        "text": "Titre: الجزء الاول من التصريح بمضمون التوضيح للعلامة خالد الازهرى. «Tome premier du livre intitulé: L'exposition de ce qui est caché dans le Tauḍîḥ, livre par le très savant Khâlid Al-Azharî.» Or, le Tauḍîḥ «Élucidation» n'est autre que le commentaire sur l'Alfiyya d'Ibn Mâlik par Ibn Hischâm, commentaire également connu sous le nom de اوضح المسالك الى الفية ابن مالك et dont nous avons rencontre trois exemplaires (7, 2°; 47, 3°; 67). Nous avons donc ici le supercommentaire de Khalid Al-Azharî, mort en 890 de l'Hégire (1485 ap. J.-Ch.), sur le commentaire d'Ibn Hischâm sur l'Alfiyya d'Ibn Mâlik.\nCommencement: الحمد لله الملهم لتحميده ...... وبعد فيقول العبد ...... خالد بن عبد الله الازهرى ...... ان الشرح المشهور بالتوضيح على الفية ابن مالك في علم النحو للشيخ ...... جمال الدين ابى محمد عبد الله بن يوسف بن هشام الانصاري ...... فى غاية حسن الوقع عند جميع الاخوان الخ; puis le titre est redonné au fol. 2 r°.\nA la fin, on lit: يتلوه الجزء الثانى من اول باب ابنية الفاعلين (.ed Dieterici, p. ٢٢٢).\nPapier. Écriture Asiatique. 278 feuillets. 25 lignes par page. Sans date."
    },
    {
        "title": "شرح التوضيح للعلامة الشيخ بدر الدين خالد الوقار",
        "author": "",
        "author_date_hijri": "",
        "author_date_CE": "",
        "title_of_original_text_commented_upon": "",
        "author_of_original_text_commented_upon": "",
        "date_of_author_of_original_text_commented_upon_hijri": "",
        "date_of_author_of_original_text_commented_upon_CE": "",
        "date_of_original_text_commented_upon_hijri": "",
        "date_of_original_text_commented_upon_CE": "",
        "date_of_copying_hijri": "",
        "date_of_copying_CE": "",
        "date_of_printing_hijri": "",
        "date_of_printing_CE": "",
        "place_of_printing": "",
        "incipit": "",
        "explicit": "",
        "material": "Papier",
        "script": "Asiatique",
        "number_of_folios": 359,
        "layaout_or_lines_per_page": 23,
        "text": "Titre: شرح التوضيح للعلامة الشيخ بدر الدين خالد الوقار. Autre exemplaire du même supercommentaire, mais celui-ci complet. Même commencement.\nPapier. Écriture Asiatique très serrée. 359 feuillets. 23 lignes par page. Sans date."
    },
    {
        "title": "كتاب الجنى الدانى فى حروف المعاني",
        "author": "Badr ed-Dîn Al-Mourâdî",
        "author_date_hijri": "",
        "author_date_CE": "",
        "title_of_original_text_commented_upon": "",
        "author_of_original_text_commented_upon": "",
        "date_of_author_of_original_text_commented_upon_hijri": "",
        "date_of_author_of_original_text_commented_upon_CE": "",
        "date_of_original_text_commented_upon_hijri": "",
        "date_of_original_text_commented_upon_CE": "",
        "date_of_copying_hijri": "854",
        "date_of_copying_CE": "1450",
        "date_of_printing_hijri": "",
        "date_of_printing_CE": "",
        "place_of_printing": "",
        "incipit": "الحمد لله بجميع محامده الخ",
        "explicit": "",
        "material": "Papier",
        "script": "Asiatique",
        "number_of_folios": 89,
        "layaout_or_lines_per_page": 24,
        "text": "Titre: كتاب الجنى الدانى فى حروف المعاني تأليف الشيخ بدر الدين المرادى المعروف بابن ام القاسم. «Livre intitlé: La cueillette de ce qui est à la portée; traité des particules, par le schaikh Badr ed-Dîn Al-Mourâdî, connu sous le nom d'Ibn Oumm Kasim. Hadji Khalifa, n° 4223. Le commentaire sur l'Alfiyya, du même auteur, se trouve dans les mss. 4, 12, 70-73.\nCet exemplaire a été copié en 854 de l'Hégire (1450 ap. J.-Ch.) sur un exemplaire, copié lui-même sur l'autographe de l'auteur. Commencement: الحمد لله بجميع محامده الخ.\nPapier. Écriture Asiatique. 89 feuillets. 24 lignes par page."
    },
    {
        "title": "Commentaire sur la لامية الافعال «Poëme rimant en lâm sur les verbes» d'Ibn Mâlik",
        "author": "ابو عبد الله محمد بن العباس",
        "author_date_hijri": "",
        "author_date_CE": "",
        "title_of_original_text_commented_upon": "لامية الافعال",
        "author_of_original_text_commented_upon": "Ibn Mâlik",
        "date_of_author_of_original_text_commented_upon_hijri": "",
        "date_of_author_of_original_text_commented_upon_CE": "",
        "date_of_original_text_commented_upon_hijri": "",
        "date_of_original_text_commented_upon_CE": "",
        "date_of_copying_hijri": "871",
        "date_of_copying_CE": "1466",
        "date_of_printing_hijri": "",
        "date_of_printing_CE": "",
        "place_of_printing": "",
        "incipit": "",
        "explicit": "قال مؤلّفه ...... وكان الفراغ من تخليصه من میبینه ...... عام ٨٥٠ ...... وكان الفراغ من من نسخه مبيضة المؤلف ...... في ...... عام ٨٥١",
        "material": "Papier",
        "script": "Magrébine",
        "number_of_folios": 62,
        "layaout_or_lines_per_page": 27,
        "text": "Commentaire sur la لامية الافعال «Poëme rimant en lâm sur les verbes» d'Ibn Mâlik. Titre de ce commentaire (fol. 1 v°): تحقيق المقال وتسهيل المنال في شرح لامية الافعال; auteur: ابو عبد الله محمد بن العباس. Notus avons rencontre un exemplaire .de ce livre (ms. 16, 3°).\nAn fol. 62 r°, on lit: قال مؤلّفه ...... وكان الفراغ من تخليصه من میبینه ...... عام ٨٥٠ ...... وكان الفراغ من من نسخه مبيضة المؤلف ...... في ...... عام ٨٥١. C'est sur cette mise au net de l'anteur qu'a été faite notre copie en 871 de l'Hégire (1466 ap. J.-Ch.).\nPapier. Écriture Magrébine. 62 feuillets, 27 lignes par page."
    },
    {
        "title": "Gloses (حواش) sur la Kafiya d'Ibn Al-Hadjib",
        "author": "ابو المفاخر شهاب الدين بن شمس الدين بن عمر الدواني الدولتابادى ثم الهندى",
        "author_date_hijri": "",
        "author_date_CE": "",
        "title_of_original_text_commented_upon": "الكافية",
        "author_of_original_text_commented_upon": "Ibn Al-Hadjib",
        "date_of_author_of_original_text_commented_upon_hijri": "",
        "date_of_author_of_original_text_commented_upon_CE": "",
        "date_of_original_text_commented_upon_hijri": "",
        "date_of_original_text_commented_upon_CE": "",
        "date_of_copying_hijri": "958",
        "date_of_copying_CE": "1551",
        "date_of_printing_hijri": "",
        "date_of_printing_CE": "",
        "place_of_printing": "",
        "incipit": "نحمد الله نحو آلائه الوافيه ...... وبعد وقد صنف طبقات الادباء والكتاب تصانيف في علم الاعراب ...... لكن الشيخ ...... ابا المفاخر شهاب الدين بن شمس الدين بن عمر الدوانى الدولتابادى ثم الهندي ...... عمل حواشى على الرسالة المشهورة فى الاعراب لشيخ الصناعة ...... ابن الحاجب الخ.",
        "explicit": "",
        "material": "Papier",
        "script": "Asiatique",
        "number_of_folios": 116,
        "layaout_or_lines_per_page": 25,
        "text": "Gloses (حواش) sur la Kafiya d'Ibn Al-Hadjib. Le glossateur est nommé un fol. 1 v° ابو المفاخر شهاب الدين بن شمس الدين بن عمر الدواني الدولتابادى ثم الهندى; il veeut sans doute an commencement du IX siècle de l'Hégire. Ses notes sur la Kafiya sont mentionnées par Hadji Khalifa, V, p. 9. Manuscrit daté de 958 de l'Hégire (1551 ap. J.-Ch.). Commencement: نحمد الله نحو آلائه الوافيه ...... وبعد وقد صنف طبقات الادباء والكتاب تصانيف في علم الاعراب ...... لكن الشيخ ...... ابا المفاخر شهاب الدين بن شمس الدين بن عمر الدوانى الدولتابادى ثم الهندي ...... عمل حواشى على الرسالة المشهورة فى الاعراب لشيخ الصناعة ...... ابن الحاجب الخ.\nPapier. Écriture Asiatique. 116 feuillets. 25 lignes par page."
    }
]